id,question_id,created,updated,content,creator,is_spam,num_helpful,num_unhelpful
1729570,1509357,2025-05-01 22:16:56 -0700,2025-05-01 22:16:56 -0700,"<p>Here is Thunderbird for Android Community Forum. You should post your question in Thunderbird Community Forum instead: <a href=""https://support.mozilla.org/en-US/questions/thunderbird"" rel=""nofollow"">https://support.mozilla.org/en-US/questions/thunderbird</a> </p>",Yu5tiqX9og,False,0,0
1729572,1509357,2025-05-01 23:41:53 -0700,2025-05-01 23:41:53 -0700,<p>It is on Android. on a Samsung Tab S10 tablet </p>,ian11,False,0,0
1729721,1509471,2025-05-02 12:01:58 -0700,2025-05-02 12:01:58 -0700,"<p>If the sync interval is too long for you, you should use push email instead. The following link might be helpful: Configure push email for Thunderbird for Android <a href=""https://support.mozilla.org/en-US/kb/configure-push-email-thunderbird-android"" rel=""nofollow"">https://support.mozilla.org/en-US/kb/configure-push-email-thunderbird-android</a> </p>",Yu5tiqX9og,False,0,0
1730685,1509720,2025-05-07 06:03:37 -0700,2025-05-07 08:06:16 -0700,"<p>The following link might be helpful: <a href=""https://github.com/thunderbird/thunderbird-android/wiki/ReleaseNotes#minimum-android-version-compatibility"" rel=""nofollow"">https://github.com/thunderbird/thunderbird-android/wiki/ReleaseNotes#minimum-android-version-compatibility</a> </p> <blockquote>Minimum Android version compatibility: Thunderbird for Android 8.0 and above: Android 5.0 (Lollipop, API 21) </blockquote>",Yu5tiqX9og,False,1,0
1730683,1510249,2025-05-07 06:01:15 -0700,2025-05-07 06:01:15 -0700,"<p>As far as I know, Thunderbird for Android does not have add-ons. </p>",Yu5tiqX9og,False,0,0
1730680,1510274,2025-05-07 05:52:02 -0700,2025-05-07 05:52:02 -0700,"<p>Thunderbird for Android can use the contacts of your Android phone. </p><p>The following link might be helpful: <a href=""https://support.mozilla.org/en-US/questions/1484999#answer-1702948"" rel=""nofollow"">https://support.mozilla.org/en-US/questions/1484999#answer-1702948</a> </p>",Yu5tiqX9og,False,0,1
1730679,1510460,2025-05-07 05:48:45 -0700,2025-05-07 05:48:45 -0700,"<p>The following link might be helpful: <a href=""https://support.mozilla.org/en-US/questions/1497851#answer-1718158"" rel=""nofollow"">https://support.mozilla.org/en-US/questions/1497851#answer-1718158</a> </p>",Yu5tiqX9og,False,0,1
1732175,1510467,2025-05-12 16:15:10 -0700,2025-05-12 16:15:10 -0700,"<p>Just found a solution to this (at least on my Samsung phone). For some reason the Thunderbird app battery setting must be set to ""unlimited"" for mail checking to work. The standard ""optimized"" (that works for other apps like Messenger etc) doesn't work with Thunderbird. </p>",LarsErikOsterud,False,0,0
1730732,1510467,2025-05-07 09:27:11 -0700,2025-05-07 09:27:11 -0700,"<p>I've moved. this to <a href=""https://support.mozilla.org/en-US/questions/thunderbird-android"" rel=""nofollow"">https://support.mozilla.org/en-US/questions/thunderbird-android</a> </p>",wsmwk,False,0,0
1730999,1510760,2025-05-08 13:38:11 -0700,2025-05-08 13:38:11 -0700,"<p>See <a href=""https://support.mozilla.org/en-US/kb/thunderbird-android-import"" rel=""nofollow"">https://support.mozilla.org/en-US/kb/thunderbird-android-import</a> </p>",wsmwk,False,0,0
1733589,1510899,2025-05-16 14:59:59 -0700,2025-05-16 14:59:59 -0700,"<p>Hi </p><p>This is the Mozilla Support forum for Thunderbird for Android. </p><p>When you are away from home, are you using WiFi or mobile data? </p>",plwt,False,0,0
1732332,1510899,2025-05-13 04:00:40 -0700,2025-05-13 04:00:40 -0700,"<p>Like I said, using exactly the same settings (Zen Internet), I can send from home no problem. I'm not using mobile data, the obvious solution, because it doesn't sort out why Thunderbird can't send when other email apps can. I've had this posted in Android with no reply for about a week, which seems normal there. There also doesn't seem to be any way to get to Mozilla Support, if that exists. Nothing useful comes up on a Google search. That's why I tried here as a last resort. </p>",Tombarkas,False,0,0
1732310,1510899,2025-05-13 02:57:41 -0700,2025-05-13 02:57:41 -0700,"<p>Some providers require you to use their internet service to send mail.  Comcast used to be a big player that did that.  So folks would go on a cruise or the like and be unable to send mail for the duration.  So the first thing to look at is the server name you are sending from and checking with your provider if that is the one you should use for ""mobile"" devices.  As I don't see any mention of the email providers name anywhere in your many posts that I looked at.  That is about all anyone can tell you.  </p><p>Why are you not sending using mobile data?  Does it work if you do?  I looked at your other questions in the hope of learning anything useful about your mail provider or setup.  Many posts.  No useful information supplied at all. Either relevant to this post, or any of the others,  you do not provide any information to those that might support you those in the forums know exactly what you tell them.  So even if there is a well known issue with say Google and they are you provider, you will hear crickets as a response because no one has any knowledge that it is relevant to you. </p><p>It is even possible this is relevant here <a href=""https://support.mozilla.org/en-US/kb/thunderbird-smtp-ehlo"" rel=""nofollow"">https://support.mozilla.org/en-US/kb/thunderbird-smtp-ehlo</a>  anything that is advertised as protecting privacy causes issue with some providers.  It is almost a given.  That is the same to some servers as using a VPN.  I might hazard a guess Google will take it badly as they use reverse DNS to check you are where you say your are. </p><p>But I do not support the Android product. Hopefully somebody will reply to you in the Android forum if you supply enough inforamtion. </p>",MattAuSupport,False,0,1
1763243,1510899,2025-09-10 05:25:46 -0700,2025-09-10 05:25:46 -0700,<p>&gt; can't see how this would affect Thunderbird for Android </p><p>Totally unrelated. </p>,wsmwk,False,0,0
1744164,1510899,2025-06-23 02:17:01 -0700,2025-06-23 23:23:46 -0700,"<p>Latest edit </p><p>Using Thunderbird for Android from home - Using Wifi, going into server settings for Thunderbird and clicking on Verify, they get verified. Turning off WIFI and using mobile data, I do exactly the same and get SmtpResponseParser -exception Unexpected end of stream. </p><p>Final edit. Will have to stop using Android Thunderbird. It's the only email programme that is experiencing problems of all the ones I've tested and my ISP has no solution </p>",Tombarkas,False,0,0
1763227,1510899,2025-09-10 02:24:37 -0700,2025-09-10 02:24:37 -0700,"<p>And now Send is working! I've not made any changes in Thunderbird for Android. I did manage to remove the message Thunderbird is managed by your organisation (which turned out to be Bitdefender) in Thunderbird for Windows, but can't see how this would affect Thunderbird for Android </p>",Tombarkas,False,0,0
1733686,1510899,2025-05-16 22:04:58 -0700,2025-05-20 06:40:07 -0700,"<p>WiFi - that's why I said when connected to the Internet. I always use WiFi - it works at home, but, with exactly the same settings, does not work away from home. It's nothing to do with a VPN and is only a problem with Thunderbird, not Gmail, Proton Mail or Outlook. Am I really the only person with this problem? </p><p>Edit 20 May I have just tested sending by mobile data (Wi-Fi turned off). both in a cafe and at home, and Thunderbird for Android fails to send on either, while Gmail and Proton Mail do. Am now even more confused </p>",Tombarkas,False,0,0
1731896,1510902,2025-05-11 21:44:20 -0700,2025-05-11 21:44:20 -0700,"<p>Do you mean that you cannot remember the password of your email account? If the answer is yes, the following steps might be helpful: </p><p>1. Contact your email service provider in order to change the password of your email account. </p><p>2. Change the password stored in Thunderbird for Android. The following link might be helpful: <a href=""https://support.mozilla.org/en-US/questions/1494522#answer-1713975"" rel=""nofollow"">https://support.mozilla.org/en-US/questions/1494522#answer-1713975</a> </p>",Yu5tiqX9og,False,0,0
1731893,1511304,2025-05-11 21:21:11 -0700,2025-05-11 21:28:47 -0700,"<p>1. Are you talking about Thunderbird (desktop) or Thunderbird for Android? </p><p>(A) If you are talking about Thunderbird (desktop): Here is Thunderbird for Android Community Forum. You should post your question in Thunderbird Community Forum instead: <a href=""https://support.mozilla.org/en-US/questions/thunderbird"" rel=""nofollow"">https://support.mozilla.org/en-US/questions/thunderbird</a> </p><p>(B) If you are talking about Thunderbird for Android: As far as I know, Thunderbird for Android does not have add-ons. </p><p>2. I am sorry that I cannot understand the relation between ""viewing .mpeg files"" (.mpeg files are video files) and ""installing ImportExportTools NG"". </p>",Yu5tiqX9og,False,0,0
1731897,1511309,2025-05-11 21:49:11 -0700,2025-05-11 21:49:11 -0700,"<p>Thunderbird for Android does not have calendar of its own. </p><p>You can post feature request in the following forum: <a href=""https://connect.mozilla.org/t5/ideas/idb-p/ideas/label-name/thunderbird%20android"" rel=""nofollow"">https://connect.mozilla.org/t5/ideas/idb-p/ideas/label-name/thunderbird%20android</a> </p><p>There is the same feature request in the above forum already, and you can upvote it: Calendar support on Thunderbird mobile <a href=""https://connect.mozilla.org/t5/ideas/calendar-support-on-thunderbird-mobile/idi-p/76394"" rel=""nofollow"">https://connect.mozilla.org/t5/ideas/calendar-support-on-thunderbird-mobile/idi-p/76394</a> </p>",Yu5tiqX9og,False,0,0
1744141,1511309,2025-06-22 23:47:40 -0700,2025-06-22 23:47:40 -0700,<p>Yes Calender is indeed required on the android app too. </p>,junkboxtv,False,1,0
1732253,1511507,2025-05-12 22:23:34 -0700,2025-05-12 22:23:34 -0700,"<p>The following steps should show email headers: (Inside the email) tap three vertical dots on the top right corner &gt; tap ""Show headers"". </p>",Yu5tiqX9og,False,0,0
1732274,1511507,2025-05-12 23:53:55 -0700,2025-05-12 23:55:42 -0700,"<p>That only shows the headers, not the text of the msg When fishing spam arrives with links you can't see where that link would take you. What would be nice is to be able to review the complete message and even optionally save to a text file... Thanks for the reply though&nbsp;:) </p><p>Here is the results of the 'Show Headers' menu item from your reply, notice NO message text is included. </p><p>Return-Path: &lt;01010196c8192bdb-89017403-7719-47df-a7a7-43d53ff7232c-000000@us<a href=""http://-west-2.amazonses.com"" rel=""nofollow"">-west-2.amazonses.com</a>&gt; Delivered-To: greg@nwt.net.au Received: from <a href=""http://s143.syd3.hostingplatform.net.au"" rel=""nofollow"">s143.syd3.hostingplatform.net.au</a>	by <a href=""http://s143.syd3.hostingplatform.net.au"" rel=""nofollow"">s143.syd3.hostingplatform.net.au</a> with LMTP	id YLnbCoXXImg/CAYAIvZxJA	(envelope-from &lt;01010196c8192bdb-89017403-7719-47df-a7a7-43d53ff7232c-000000@us<a href=""http://-west-2.amazonses.com"" rel=""nofollow"">-west-2.amazonses.com</a>&gt;)	for &lt;greg@nwt.net.au&gt;; Tue, 13 May 2025 15:24:21 +1000 Return-path: &lt;01010196c8192bdb-89017403-7719-47df-a7a7-43d53ff7232c-000000@us<a href=""http://-west-2.amazonses.com"" rel=""nofollow"">-west-2.amazonses.com</a>&gt; Envelope-to: greg@nwt.net.au Delivery-date: Tue, 13 May 2025 15:24:21 +1000 Received: from <a href=""http://a27-128.smtp-out.us-west-2.amazonses.com"" rel=""nofollow"">a27-128.smtp-out.us-west-2.amazonses.com</a> ([54.240.27.128]:40925)	by <a href=""http://s143.syd3.hostingplatform.net.au"" rel=""nofollow"">s143.syd3.hostingplatform.net.au</a> with esmtps  (TLS1.2) tls TLS_ECDHE_RSA_WITH_AES_128_GCM_SHA256	(Exim 4.98.1)	(envelope-from &lt;01010196c8192bdb-89017403-7719-47df-a7a7-43d53ff7232c-000000@us<a href=""http://-west-2.amazonses.com"" rel=""nofollow"">-west-2.amazonses.com</a>&gt;)	id 1uEi7l-00000001pd5-2O96	for greg@nwt.net.au;	Tue, 13 May 2025 15:24:21 +1000 DKIM-Signature: v=1; a=rsa-sha256; q=dns/txt; c=relaxed/simple;	s=c443qvrmqzg374xy4ayfjtpvorw5iii7; d=<a href=""http://support.mozilla.org"" rel=""nofollow"">support.mozilla.org</a>;	t=1747113815;	h=Content-Type:MIME-Version:Subject:From:To:Date:Reply-To:Message-ID;	bh=H9/A75m3o+Cdy7Xed6Z85A3p1S01Yf9pcqxTvLBiRnM=;	b=eRPv7WBNKFUXKfUkhALaj4TpAyyU3bB/qrVVf/3skKJ0AhhKYRdQJ5tCkcpSMdG/	dvrfBwfHy2MwtbJ6azfWNchIh6vgLio0J2jn7VcUCBJbPxs9iL3mYUzSbeSYsBUXync	WqOeJznMKhj2JyiRzveuhQ0QLgJ3K9LVH9/WNmTY= DKIM-Signature: v=1; a=rsa-sha256; q=dns/txt; c=relaxed/simple;	s=gdwg2y3kokkkj5a55z2ilkup5wp5hhxx; d=<a href=""http://amazonses.com"" rel=""nofollow"">amazonses.com</a>; t=1747113815;	h=Content-Type:MIME-Version:Subject:From:To:Date:Reply-To:Message-ID:Feedback-ID;	bh=H9/A75m3o+Cdy7Xed6Z85A3p1S01Yf9pcqxTvLBiRnM=;	b=RP4kLb5+rLD5PgO7TOnIfF8dm7T1otfCHP/G0VfRA5uQkKRoNY0hPqabrMhG9tal	BV/4OHbr7M2xTanK+PyfdcNfyaXHnj3ZeUS+E6iQjHnnC0dMOgyWTwO9UzhGl1AVaVT	Ip67K4ta5fUMyeIyndodjp5BxtyY5ZMrI7ndUzrs= Content-Type: multipart/alternative; boundary=""===============5434947474157530183=="" MIME-Version: 1.0 Subject: Yu5tiqX9og posted an answer to your question ""How to view headers and complete text"" From: Mozilla Support Forum &lt;no-reply@support.mozilla.org&gt; To: greg@nwt.net.au Date: Tue, 13 May 2025 05:23:35 +0000 Reply-To: no-reply@mozilla.org Message-ID: &lt;01010196c8192bdb-89017403-7719-47df-a7a7-43d53ff7232c-000000@us<a href=""http://-west-2.amazonses.com"" rel=""nofollow"">-west-2.amazonses.com</a>&gt; Feedback-ID:&nbsp;::<a href=""http://1.us"" rel=""nofollow"">1.us</a>-west-2.55Fn+vAtbDnVeXugvv+YsUqxmqRyBI6wITuZhQVE8SU=:AmazonSES X-SES-Outgoing: 2025.05.13-54.240.27.128 X-Spam-Status: No, score=-7.7 X-Spam-Score: -76 X-Spam-Bar: ------- X-Ham-Report: Spam detection software, running on the system ""<a href=""http://s143.syd3.hostingplatform.net.au"" rel=""nofollow"">s143.syd3.hostingplatform.net.au</a>"", has NOT identified this incoming email as spam.  The original message has been attached to this so you can view it or label similar future email.  If you have any questions, see root\@localhost for details. Content preview:  Hi greg150, Yu5tiqX9og has posted an answer to your question    on <a href=""http://support.mozilla.org"" rel=""nofollow"">support.mozilla.org</a>: How to view headers and complete text Yu5tiqX9og   wrote: ""The following steps should show email headers: (Inside the email)   tap three vertical dots on the top right corner &gt; tap ""Show headers"".""  Content analysis details:   (-7.7 points, 5.0 required)  pts rule name              description ---- ---------------------- --------------------------------------------------  0.0 URIBL_BLOCKED          ADMINISTRATOR NOTICE: The query to URIBL was                             blocked.  See                             <a href=""http://wiki.apache.org/spamassassin/DnsBlocklists#dnsbl-block"" rel=""nofollow"">http://wiki.apache.org/spamassassin/DnsBlocklists#dnsbl-block</a>                              for more information.                             [URIs: <a href=""http://mozilla.org"" rel=""nofollow"">mozilla.org</a>]  0.0 HEADER_FROM_DIFFERENT_DOMAINS From and EnvelopeFrom 2nd level                             mail domains are different -0.0 SPF_PASS               SPF: sender matches SPF record -7.5 USER_IN_DEF_DKIM_WL    From: address is in the default DKIM                             welcome-list  0.0 HTML_FONT_LOW_CONTRAST BODY: HTML font color similar or                             identical to background  0.0 HTML_MESSAGE           BODY: HTML included in message  0.0 RCVD_IN_VALIDITY_RPBL_BLOCKED RBL: ADMINISTRATOR NOTICE: The                             query to Validity was blocked.  See                             <a href=""https://knowledge.validity.com/hc/en-us/articles/20961730681243"" rel=""nofollow"">https://knowledge.validity.com/hc/en-us/articles/20961730681243</a>                              for more information.                             [54.240.27.128 listed in <a href=""http://bl.score.senderscore.com"" rel=""nofollow"">bl.score.senderscore.com</a>]  0.1 DKIM_SIGNED            Message has a DKIM or DK signature, not necessarily                             valid -0.1 DKIM_VALID_EF          Message has a valid DKIM or DK signature from                             envelope-from domain -0.1 DKIM_VALID_AU          Message has a valid DKIM or DK signature from                             author's domain -0.1 DKIM_VALID             Message has at least one valid DKIM or DK signature  0.0 RCVD_IN_VALIDITY_SAFE_BLOCKED RBL: ADMINISTRATOR NOTICE: The                             query to Validity was blocked.  See                             <a href=""https://knowledge.validity.com/hc/en-us/articles/20961730681243"" rel=""nofollow"">https://knowledge.validity.com/hc/en-us/articles/20961730681243</a>                              for more information.                             [54.240.27.128 listed in <a href=""http://sa-accredit.habeas.com"" rel=""nofollow"">sa-accredit.habeas.com</a>] X-Spam-Flag: NO </p>",greg150,False,1,0
1777847,1511507,2025-11-08 19:02:51 -0800,2025-11-08 19:02:51 -0800,<p>可能なら下記の要件の機能追加を検討していただきたいです。 </p><p>スパムや詐欺メール報告を各国の行政機関や団体に簡単に報告できるように報告ボタンで連動してメールヘッダや報告先を個別登録したメールアドレスに簡単に送信できるようにできればありがたいです。 </p><p>現状のやり方は以下のステップが必要で手間がかかっています。 </p><p>1.スパム、詐欺メール受信をしたら、ヘッダ情報を表示してコピー 2.報告先の機関のメールアドレスを指定 3.本文にコピーしたヘッダ情報を貼り付ける 4.メール送信 5.受信メールからスパム、詐欺メールを詐欺メールフォルダに移動 6.送信済みメールフォルダから報告メールを移動 7.年単位や月単位でスパム、詐欺メールのフォルダ内を削除 </p>,tsuchiyatoshihiro,False,0,0
1732247,1511528,2025-05-12 22:08:39 -0700,2025-05-12 22:08:39 -0700,"<p>The following link might be helpful: <a href=""https://support.mozilla.org/en-US/questions/1508764#answer-1729119"" rel=""nofollow"">https://support.mozilla.org/en-US/questions/1508764#answer-1729119</a> </p>",Yu5tiqX9og,False,0,0
1733588,1511542,2025-05-16 14:58:08 -0700,2025-05-16 14:58:08 -0700,"<p>Hi, </p><p>The people who answer questions here, for the most part, are other users volunteering their time (like me), not Mozilla employees or developers. </p><p>I can see that you have asked a support question and will do my best to look at that next. </p>",plwt,False,1,0
1733687,1511542,2025-05-16 22:07:48 -0700,2025-05-16 23:58:11 -0700,"<p>I know that, but there seems to be no way whatsoever to get to Mozilla Support, if it exists. All links to ""Mozilla Support"" in a Google search bring me back here, hence my question how to contact actual Mozilla Support. Sorry - it won't let me mark your reply as Helpful! And now it does </p>",Tombarkas,False,0,0
1733702,1511542,2025-05-16 23:16:17 -0700,2025-05-16 23:16:17 -0700,"<p>Thanks - that saves me wasting more time looking. So, if noone replies, you're screwed.  Thunderbird for PC has never been a problem, as I've always had support, especially from one very helpful individual (can't remember name). One reason for posting was in case it was a design fault. </p>",Tombarkas,False,0,0
1733701,1511542,2025-05-16 23:04:03 -0700,2025-05-16 23:04:03 -0700,"<p>This community support forum is Mozilla support as there is no form of direct chat or ticket system for free to use products like the Firefox web browsers, the Thunderbird email clients. </p><p>However Mozilla does have direct ticket support here for their subscription based products as in Mozilla VPN, MDN Plus and the Plus/Premium versions of Firefox Relay, Pocket, Mozilla Monitor because you well paid for it as part of subscription. </p>",James,False,1,0
1763247,1511542,2025-09-10 05:33:04 -0700,2025-09-10 05:33:04 -0700,"<p>In fact, there is an event coming up where anyone can particpate. </p>",wsmwk,False,0,0
1763246,1511542,2025-09-10 05:32:33 -0700,2025-09-10 05:32:33 -0700,"<p>We're working on getting more responses to android issues.  Perhaps you could also help?  <a href=""https://support.mozilla.org/en-US/questions/thunderbird-android"" rel=""nofollow"">https://support.mozilla.org/en-US/questions/thunderbird-android</a> is a good starting point. </p>",wsmwk,False,0,0
1732309,1511545,2025-05-13 02:45:54 -0700,2025-05-13 02:45:54 -0700,<p>You question is not on topic in this forum.  So I will move it to the android forum and lock it as a duplicate.  I do not use or support Andriod.  That is why I never look in that forum. </p>,MattAuSupport,False,0,0
1732494,1511679,2025-05-13 14:33:21 -0700,2025-05-13 14:33:21 -0700,<p>I forgot to add that I installed non beta version 9 and send works. </p>,listmail,False,0,0
1732701,1511679,2025-05-14 07:36:16 -0700,2025-05-15 04:20:42 -0700,"<p>I think you should post your question in the following place: <a href=""https://github.com/thunderbird/thunderbird-android/issues"" rel=""nofollow"">https://github.com/thunderbird/thunderbird-android/issues</a> </p>",Yu5tiqX9og,False,0,0
1732703,1511782,2025-05-14 07:38:47 -0700,2025-05-14 07:38:47 -0700,"<p>The following steps might be helpful: ""Settings"" &gt; tap the email account you want to configure &gt; ""Reading mail"" &gt; ""Always show images"" &gt; select the option you prefer. </p>",Yu5tiqX9og,False,0,0
1732876,1511895,2025-05-14 16:37:21 -0700,2025-05-14 16:37:21 -0700,"<ul><li> * # <a href=""http://example.com"" rel=""nofollow"">Bulleted list item</a> </li></ul>",mansoorgill283,False,0,0
1732875,1511895,2025-05-14 16:33:17 -0700,2025-05-14 16:33:17 -0700,<p>I changed the process username for account signing up Android </p>,mansoorgill283,False,0,0
1733591,1512038,2025-05-16 15:02:50 -0700,2025-05-16 15:02:50 -0700,"<p>Hi John </p><p>Yes, you should be able to. </p> <ol><li> In the Inbox view in Thunderbird for Android, long press on the spam email to select it. </li><li> Select the three dot icon in the top right corner. </li><li> Select ""Spam"". </li></ol> <p>I hope that this helps. </p>",plwt,False,1,6
1733832,1512228,2025-05-17 09:11:06 -0700,2025-05-17 09:11:06 -0700,<p>Duplicate. do not respond. </p>,davidsk,False,0,0
1733945,1512288,2025-05-17 19:09:13 -0700,2025-05-17 19:09:13 -0700,"<p>A reminder, the problem only take place with Android version. </p><p>My PC app is working fine and yes it has the same SMTP config </p>",MarcBabin,False,1,0
1737552,1512288,2025-05-29 08:45:59 -0700,2025-05-29 08:45:59 -0700,"<p>Hello, exactly! There was an update which broke the SMTP protocol and even with the lastcK9bupdate. This was not resolved. I am hoping that someone from the development team look at this issue! </p>",MarcBabin,False,0,0
1737513,1512288,2025-05-29 05:16:17 -0700,2025-05-29 05:16:17 -0700,"<p>I have a similar problem using TB for android and Zen Internet as ISP. I set up TB for my ISP and it checks and says all the settings are fine. I then find I can send emails over WIFI from home, but not anywhere else. Using mobile data, I can't send emails from anywhere. I get a similar error ""SmtpResponseParserException. Unexpected end of stream"" I don't have this problem with Proton Mail, Outlook or GMail. I do with K9. </p>",Tombarkas,False,1,0
1733918,1512288,2025-05-17 16:21:08 -0700,2025-05-17 16:21:08 -0700,"<p><a href=""http://Smtp.videotron.ca"" rel=""nofollow"">Smtp.videotron.ca</a> </p>",MarcBabin,False,0,0
1735852,1512288,2025-05-23 14:55:11 -0700,2025-05-23 14:55:11 -0700,<p>Would be nice to have support from Mozilla team! In the mean while I am using Blue mail! </p>,MarcBabin,False,0,0
1733849,1512288,2025-05-17 10:28:16 -0700,2025-05-17 10:28:16 -0700,<p>SMTP.service provider SSL/TL Port 467 No certificate </p>,MarcBabin,False,0,0
1733845,1512288,2025-05-17 09:59:19 -0700,2025-05-17 09:59:19 -0700,<p>Here are the SMTP config: </p><p>It is just as simple. Went through with support on it.  </p><p>Since smtp config is working with Samsung mail it is not a problem with service provider. </p><p>Also note the K9 is no longer recognizing connection of the SMTP server. </p><p>It is in the app. </p>,MarcBabin,False,0,0
1733830,1512288,2025-05-17 09:04:50 -0700,2025-05-17 09:04:50 -0700,<p>It may prove helpful if you post all settings done for the SMTP server. </p>,davidsk,False,0,0
1733876,1512288,2025-05-17 13:04:58 -0700,2025-05-17 13:04:58 -0700,<p>You might get more assistance if you gave the name of the smtp server. </p>,davidsk,False,0,0
1733879,1512310,2025-05-17 13:07:39 -0700,2025-05-17 13:07:39 -0700,<p>It often helps to post the settings that are causing the error message. Seeing the full server settings may help others suggest suggestions. </p>,davidsk,False,0,0
1733881,1512310,2025-05-17 13:14:43 -0700,2025-05-17 13:14:43 -0700,"<em><p>david <a href=""#answer-1733879"" rel=""nofollow"">said</a></p></em> <blockquote>It often helps to post the settings that are causing the error message. Seeing the full server settings may help others suggest suggestions. </blockquote> <p>I'm trying the automatic settings </p>",samrezaxyz,False,0,0
1733882,1512310,2025-05-17 13:14:55 -0700,2025-05-17 13:16:12 -0700,<p>....... </p>,samrezaxyz,False,0,0
1733883,1512310,2025-05-17 13:15:00 -0700,2025-05-17 13:15:40 -0700,<p>...... </p>,samrezaxyz,False,0,0
