id,created,updated,locale,product,title,is_solved,solution,solved_by,is_spam,last_answer,answers,topic,tags,creator,content,involved,is_archived,is_locked,is_taken,metadata,num_answers,num_votes_past_week,num_votes,taken_until,taken_by,updated_by
1575776,2026-04-11 01:39:35 -0700,2026-04-11 01:39:35 -0700,en-US,thunderbird-android,Can't authenticate Outlook email due to suspected webpage issue,False,,,False,,,connectivity,android;thunderbird-android;connectivity;,a3times7,"<p>When trying to add my Outlook account, I am stuck at the authentication step. The webpage doesn't work. The screen recording I've attached is what happens on the second time and later; the first time it shows a different page (saying ""The app named Thunderbird will be granted these permissions [... a list of permissions]; allow?"" and I clicked ""Allow"") but it doesn't work either. </p><p>There is a ""在 浏览器 浏览器中打开"" option (""Open in browser browser"" haha; it refers to Xiaomi system browser"") but it opens a ""Cannot find this page"" error page. The ""在 Edge 中运行"" (""Run in Edge"") button is unclickable. </p><p>Translation of the screen recording: Trying to log in to Thunderbird Android? Only continue if downloaded the app from trusted app store or website. [Cancel/Continue] </p><p>Screen recording at <a href=""https://wwblo.lanzoub.com/itYge3mz8rlc"" rel=""nofollow"">https://wwblo.lanzoub.com/itYge3mz8rlc</a> (extract code: cnme) </p>",a3times7;,False,False,False,";useragent:Mozilla/5.0 (Linux; Android 10; K) AppleWebKit/537.36 (KHTML, like Gecko) Chrome/144.0.0.0 Mobile Safari/537.36 EdgA/144.0.0.0;tb_version:18.0b2;os:Android",0,0,0,,,
1575824,2026-04-11 10:38:58 -0700,2026-04-11 10:39:59 -0700,en-US,thunderbird-android,Jak ustawić automatyczną odpowiedź,False,,,False,1811198.0,1811198;,send-and-receive-email,android;thunderbird-android;send-and-receive-email;,kamzi1,<p>Jak ustawić automatyczną odpowiedź </p>,kamzi1;,False,False,False,";useragent:Mozilla/5.0 (Linux; Android 10; K) AppleWebKit/537.36 (KHTML, like Gecko) Chrome/146.0.0.0 Mobile Safari/537.36;tb_version:180bt;os:Android;kb_visits_prior:[""/pl/kb/thunderbird-8-android-faq""]",1,0,0,,,
1575929,2026-04-12 01:05:15 -0700,2026-04-12 01:33:25 -0700,en-US,thunderbird-android,how do I delete email messages from thunderbird android?,False,,,False,1811306.0,1811306;,send-and-receive-email,thunderbird-android;send-and-receive-email;,jimvan,<p>how can I delete email messages from within Thunderbird android app? </p>,jimvan;platform34;,False,False,False,";useragent:Mozilla/5.0 (Windows NT 10.0; Win64; x64) AppleWebKit/537.36 (KHTML, like Gecko) Chrome/145.0.0.0 Safari/537.36 OPR/129.0.0.0;tb_version:17.0;os:android 16;kb_visits_prior:[""/en-US/kb/getting-started-thunderbird-android""]",1,0,0,,,
1575962,2026-04-12 09:47:28 -0700,2026-04-12 11:20:55 -0700,en-US,thunderbird-android,No notification for recieved email when move by a line,False,,,False,1811366.0,1811366;,send-and-receive-email,thunderbird-android;send-and-receive-email;,bravoerman,"<p>In Thunderbird for Android, Thunderbird does not notify a received email, when: I have created a setting with a rule/line, where this email is moved to a underlaying folder. </p>",bravoerman;platform34;,False,False,False,";useragent:Mozilla/5.0 (Macintosh; Intel Mac OS X 10_15_7) AppleWebKit/605.1.15 (KHTML, like Gecko) Version/26.3 Safari/605.1.15 Ddg/26.3;tb_version:17.0;os:Android 13 ( /e/OS )",1,0,0,,,
1575977,2026-04-12 12:32:29 -0700,2026-04-12 19:24:07 -0700,en-US,thunderbird-android,K-9 Mail suddenly stopped to work.,True,1811422.0,platform34,False,1811427.0,1811422;1811427;,passwords-and-sign-in,mac-os-x-1015;thunderbird-android;passwords-and-sign-in;,JanAke,"<p>My K-9 in Android suddenly stopped to work a couple of days ago. The server asks for autentification. I haven't changed anything. I've uninstalled and reistalled  the app and restarted my phone a Samsung S22 ultra several times. The app is recognating some settings automatically but it doesn't accept my old password with 16 letters in a group of four with highfens in between. What shall I do, please? Something wrong with the server? The version of the app is 17.0 updated March 16th 2026. </p>",JanAke;platform34;,False,False,False,;useragent:Mozilla/5.0 (Macintosh; Intel Mac OS X 10.15; rv:140.0) Gecko/20100101 Firefox/140.0;tb_version:K-9 Mail 17.0;os:Mac OS x 10.15;solver_id:625557,2,0,0,,,
1575988,2026-04-12 14:18:56 -0700,2026-04-12 17:24:03 -0700,en-US,thunderbird-android,Trouble Syncing from phone with desktop getting OAuth 2.0 error,False,,,False,1811418.0,1811418;,passwords-and-sign-in,thunderbird-android;passwords-and-sign-in;,Nasshorn,"<p>I have installed Thunderbird on my Samsung phone and synced it with the desktop.  All three of my gmail accounts came up okay, but when I go into them I do not get the inbox, only outbox.  When I click on each account to try to sign in I get an error that says ""OAuth 2.0 is currently not supported with the provider"".  How can I sign in to my gmail accounts on my phone in Thunderbird?1 </p>",Nasshorn;platform34;,False,False,False,";useragent:Mozilla/5.0 (Windows NT 10.0; Win64; x64) AppleWebKit/537.36 (KHTML, like Gecko) Chrome/146.0.0.0 Safari/537.36;tb_version:17.0;os:Android version 16",1,0,0,,,
1575997,2026-04-12 15:48:43 -0700,2026-04-12 17:53:32 -0700,en-US,thunderbird-android,"Whenever I do something like delete a message, it stays there for up to 10 seconds before deleting",False,,,False,1811420.0,1811420;,crashing-and-slow-performance,thunderbird-android;crashing-and-slow-performance;,jack.dawson,"<p>I click on a message and select anything (Move, delete, etc) it can take up to 10 seconds to perform that requested task. </p>",jack.dawson;platform34;,False,False,False,;useragent:Mozilla/5.0 (Windows NT 10.0; Win64; x64; rv:149.0) Gecko/20100101 Firefox/149.0;tb_version:17.0,1,0,0,,,
1576121,2026-04-13 08:02:39 -0700,2026-04-13 08:02:39 -0700,en-US,thunderbird-android,No soy capaz de añadir una cuenta de outlook,False,,,False,,,send-and-receive-email,android;thunderbird-android;send-and-receive-email;,casala.csl,"<p>¡Hola a todos! </p><p>Llevo días intentando añadir una cuenta de outlook a la aplicación del móvil (en el ordenador, tras varios intentos, sí lo he conseguido).  </p><p>Se trata de una cuenta personal y aunque ya he habilitado IMAP, no me da la opción de habilitar SMTP, que es lo que me está fallando.  </p><p>El error que aparece es:  </p><p>""El servidor devolvió el siguiente mensaje: Authentication unsucessful, SmtpClientAuthentication is disabled for the mailbox."" </p><p>He probado también a cambiar el servidor por <a href=""http://smtp.office365.com"" rel=""nofollow"">smtp.office365.com</a>, pero tampoco lo consigo de esta forma. ¡Ah! y está con Oauth2 también. </p><p>Me tiene un poco desesperada el tema, así que toda ayuda es bienvenida. </p><p>¡Muchísimas gracias! </p><p>Saludos. </p>",casala.csl;,False,False,False,";useragent:Mozilla/5.0 (Windows NT 10.0; Win64; x64) AppleWebKit/537.36 (KHTML, like Gecko) Chrome/146.0.0.0 Safari/537.36;tb_version:17.0;os:Android",0,0,0,,,
1576163,2026-04-13 14:49:24 -0700,2026-04-13 18:24:41 -0700,en-US,thunderbird-android,Emails no longer synching on my Android Phone,False,,,False,1811580.0,1811580;,send-and-receive-email,thunderbird-android;send-and-receive-email;,john.priesterjr,"<p>On my Android phone, emails from my thunderbird account are no longer synching. I no longer get emails on the phone app. I currently have version 17 installed, and nothing happens when I tap on sync account. The only thing showing in the window is ""Load up to 100 more"". And nothing happens when I tap it. I'm lost and don't understand whats happening. </p>",john.priesterjr;platform34;,False,False,False,";useragent:Mozilla/5.0 (Windows NT 10.0; Win64; x64; rv:149.0) Gecko/20100101 Firefox/149.0;tb_version:17;kb_visits_prior:[""/en-US/kb/configure-push-email-thunderbird-android"", ""/en-US/kb/new-thunderbird-android-version-8""]",1,0,0,,,
1576355,2026-04-14 15:53:12 -0700,2026-04-14 19:07:53 -0700,en-US,thunderbird-android,Multipled critical emails vanished when moving from trash to inbox,False,,,False,1811752.0,1811752;,send-and-receive-email,thunderbird-android;send-and-receive-email;,11JD11,"<p>I'm using Thundebrird version 17.0 on Android 15. I sent last month an email (from Thundebrird Desktop) to multiple people and got from around 20 of them responses which I critically need to preserve. I deleted none of them (intentionally). Today I found out that 15 of them disappeared from my inbox, when checking on Thunderbird on my laptop. On my phone I can find those 15 in my trash folder grouped together. I was super relieved to find these critical responses but also confused since I definitely didn't delete 15 of those emails. Most likely they were grouped together and I swipe delete them by accident. I mark each of them and select ""move to"" -&gt; ""Inbox"". And now they just vanished. They are no longer in my trash and don't show up in my inbox. Normally when I move from deleted to inbox they move fine, same for spam. </p><p>Anything I could do? Anywhere I could look for these emails? </p>",11JD11;platform34;,False,False,False,;useragent:Mozilla/5.0 (X11; Ubuntu; Linux x86_64; rv:148.0) Gecko/20100101 Firefox/148.0;tb_version:17.0;os:Android 15,1,0,0,,,
1576370,2026-04-14 16:47:31 -0700,2026-04-14 19:32:00 -0700,en-US,thunderbird-android,Email notifications and updates,True,1811750.0,platform34,False,1811755.0,1811750;1811755;,send-and-receive-email,android;thunderbird-android;send-and-receive-email;,harriskepix,"<p>Hi team. Recently, I downloaded the app, but I noticed that the incoming emails are updated every 15 minutes. Could you please reduce the time into 1 min? Also is there any notification for incoming emails? I made folders for better correspondence with clients. Still there is no notification for incoming email. </p>",harriskepix;platform34;,False,False,False,;useragent:Mozilla/5.0 (X11; Ubuntu; Linux x86_64; rv:149.0) Gecko/20100101 Firefox/149.0;tb_version:17.0;os:Android;solver_id:6446359,2,0,0,,,
1576380,2026-04-14 17:49:18 -0700,2026-04-14 17:49:18 -0700,en-US,thunderbird-android,Tailored Financing Solutions for Your Projects with Mark Davson Financial Loan Firm +447300935913.,False,,,True,,,settings,thunderbird-android;settings;,bonifacealejandrofernandez,"<p>Tailored Financing Solutions for Your Projects with Mark Davson Financial Loan Firm +447300935913. </p><p>Attention </p><p>We are pleased to introduce Mark Davson Financial Loan Firm, a trusted financial institution committed to supporting your real estate, business, and personal projects. </p><p>Do you have a project that requires funding? Our finance investment on a short term loan is  $10,000,000.00 USD to $100,000,000.00 USD. Our long term loan investment is from $100,000,000.00 USD to 800,000,000.00 USD and above We offer loans to Individuals from the range of $ 10,000.00 USD  to $ 50,000,000.00 USD. Our loan interest rate is 2% and the Loan repayment duration ranges from 1 year to 35 years. duration. Once customer's receive our loan offers, the loan repayment starts after a 1 year grace period. </p><p>Our financing solutions cover: •Real Estate Loans: property purchase, land acquisition, construction, renovation. •Business Loans: business start-up, expansion, equipment, working capital. •Personal Loans: education, wedding, travel, and other personal needs. </p><p>Why choose Mark Davson Financial Loan Firm? ✅ Personalized assessment of your application ✅ Fast and simple procedures ✅ Tailored support at every step ✅ Transparency, confidentiality, and reliability </p><p>📩 To learn more or submit your loan application, please contact us today at emails: <a href=""mailto:markdavsonfinancialloanfirm@consultant.com"" rel=""nofollow"">markdavsonfinancialloanfirm@consultant.com</a> Now our company is also looking for a person that can be our company representative in your country. If you are interest to be our company representative in your country, kindly contact us via below emails. </p><p>We look forward to helping you bring your projects to life. </p><p>Sincerely, Management </p><p>Thank you C.E.O. Rev. Mark Davson MARK DAVSON FINANCIAL LOAN FIRM United Kingdom, England (UK) Email: <a href=""mailto:markdavsonfinancialloanfirm@consultant.com"" rel=""nofollow"">markdavsonfinancialloanfirm@consultant.com</a> Email:<a href=""mailto:markdavsonfinancialloanfirm@gmail.com"" rel=""nofollow"">markdavsonfinancialloanfirm@gmail.com</a> Email: <a href=""mailto:markdavsonfinancialloanservice@gmail.com"" rel=""nofollow"">markdavsonfinancialloanservice@gmail.com</a> Email: <a href=""mailto:markdavsonloanfirm@hotmail.com"" rel=""nofollow"">markdavsonloanfirm@hotmail.com</a> WhatsApp:+447300935913 Website: <a href=""https://markdavsonfinancialloanfirm.com/"" rel=""nofollow"">https://markdavsonfinancialloanfirm.com/</a> </p>",bonifacealejandrofernandez;,False,False,False,";useragent:Mozilla/5.0 (Windows NT 10.0; Win64; x64) AppleWebKit/537.36 (KHTML, like Gecko) Chrome/147.0.0.0 Safari/537.36;tb_version:17.0",0,0,0,,,
1576382,2026-04-14 18:21:36 -0700,2026-04-14 18:21:36 -0700,en-US,thunderbird-android,Email stuck in outbox,False,,,False,,,send-and-receive-email,thunderbird-android;send-and-receive-email;,catweazle883311,"<p>Hello, this problem is driving me mad and I am at the point where I give up with Thunderbird  </p><p>What's happening is ""random"" emails go into the outbox and stay there,  I have no choice but to delete them.  </p><p>There is no rhyme or reason for this. </p><p>The majority of emails send, even to the address that will randomly stay in outbox. !! </p><p>I have deleted the account and reinstalled it, used the same settings that are on another account that I don't have a problem with. </p><p>I am using android on galaxy tablet. </p><p>Anyone have any ideas  </p><p>Thanks </p>",catweazle883311;,False,False,False,";useragent:Mozilla/5.0 (X11; Linux x86_64) AppleWebKit/537.36 (KHTML, like Gecko) Chrome/146.0.0.0 Safari/537.36;tb_version:17.0",0,0,0,,,
1576502,2026-04-15 11:09:23 -0700,2026-04-15 19:37:36 -0700,en-US,thunderbird-android,outmail folder only,False,,,False,1811966.0,1811966;,send-and-receive-email,android;thunderbird-android;send-and-receive-email;,skwalsh30,<p>Gmail account only had outmail folder </p>,skwalsh30;platform34;,False,False,False,;useragent:Mozilla/5.0 (Android 16; Mobile; rv:149.0) Gecko/149.0 Firefox/149.0;tb_version:17.0;os:Android,1,0,0,,,
1576505,2026-04-15 11:41:47 -0700,2026-04-15 15:13:24 -0700,en-US,thunderbird-android,"Can I format text (bold, italic, underlined) in Thunderbird?",False,,,False,1811920.0,1811920;,customization,android;thunderbird-android;customization;,cpoticha,"<p>When composing emails in Thunderbird for Android, I can't find any options to format text.  </p><p>I can't select a typeface (even the most basic html tags for serif/sans-serif/monospace aren't available) or even make text bold, italic or underlined.  </p><p>This makes it very hard to create emphasis where necessary, and it feels like ancient emails from before HTML formatting.  </p><p>Is there something I am missing, or does this depend on the phone?  </p><p>NB: I can do this with my messaging apps and the Gmail app, which I prefer not to use.  </p><p>Sony Xperia 10 V Android 14 </p>",cpoticha;platform34;,False,False,False,";useragent:Mozilla/5.0 (Linux; Android 10; K) AppleWebKit/537.36 (KHTML, like Gecko) Chrome/146.0.0.0 Mobile Safari/537.36;tb_version:17.0;os:Android",1,0,0,,,
1576535,2026-04-15 15:12:13 -0700,2026-04-15 19:24:05 -0700,en-US,thunderbird-android,How to transfer emails from Thunderbird Desktop to Thunderbird Android?,False,,,False,1811962.0,1811926;1811958;1811962;,import-and-export-email,thunderbird-android;import-and-export-email;needsinfo;,lafargeotte,"<p>Hi, </p><p>How do I transfer emails from Thunderbird Desktop to Thunderbird Android? </p><p>I have successfully imported my settings, but I want to add all my emails that are currently on my desktop. </p><p>How do I do it please? </p>",lafargeotte;platform34;,False,False,False,";useragent:Mozilla/5.0 (Windows NT 10.0; Win64; x64; rv:149.0) Gecko/20100101 Firefox/149.0;tb_version:Android 17;os:Android 16, Windows 11;kb_visits_prior:[""/en-US/kb/thunderbird-android-import"", ""/en-US/kb/thunderbird-android-8-faq""]",3,0,0,,,
1576543,2026-04-15 15:58:43 -0700,2026-04-15 22:28:15 -0700,en-US,thunderbird-android,Android installation of TB 'stuck' in outboxes,False,,,False,1811981.0,1811965;1811970;1811979;1811981;,send-and-receive-email,thunderbird-android;send-and-receive-email;,dalemwebb12181,<p>Imported desktop settings to TB Android on my phone.  Used your instructions and seemed to go well (done it before).  Android install of both Gmail accounts I imported are 'stuck' showing ONLY the outboxes.  Can't get anywhere else.  What do I need to do to correct the install on my phone.  Desktop install was done manually and seems to work. </p>,dalemwebb12181;platform34;,False,False,False,";useragent:Mozilla/5.0 (Windows NT 10.0; Win64; x64) AppleWebKit/537.36 (KHTML, like Gecko) Chrome/147.0.0.0 Safari/537.36;tb_version:Desktop is 149;os:Android 16, OneUI 8,5;kb_visits_prior:[""/en-US/kb/thunderbird-android-import""]",4,0,0,,,
1576601,2026-04-15 22:19:50 -0700,2026-04-16 02:08:12 -0700,en-US,thunderbird-android,Successful OAuth2 login doesn't auto-return to Thunderbird Android; app remains logged in as if in browser,False,,,False,1812013.0,1811992;1812013;,account-management,thunderbird-android;account-management;,maguster,"<p>Hello everyone, </p><p><strong>Summary:</strong> I am trying to set up my gmail account on my new phone, but after (what appears to be) successfully logging in, the Thunderbird for Android application does not pull me back out of gmail. Instead, I remain logged in to my gmail account as if in a browser. As you can see from my photos, it takes me to the point where I am truly into my gmail inbox, but I am checking it as if in some sort of outdated browser and not as if in Thunderbird. I am stuck; sitting in my gmail account, logged in; able to view email, check and change account settings, even get onto other parts of my google account. Unfortunately, I cannot find a way to get back out of my gmail account that returns me to the Thunderbird for Android accounts setup process with a successfully login to gmail. I end up having to hit exit or to close the app, which causes the account setup to fail. </p><p><strong>Expected Behavior:</strong> Open the Thunderbird for Android App. Setup new account (gmail which produces an automatically detected OAuth 2.0 method). Give login credentials, gain access to gmail, and then be auto-redirected back to accounts setup process in Thunderbird for Android with full IMAP + SMTP access to my gmail. </p><p><strong>Problematic Behavior:</strong> Same as above, except I am stuck as if in browser mode. When I exit and thus am returned back to the accounts setup page, I receive a failed notice (see photo). Immediately afterward, I tried to setup an account for the same gmail address on an old android phone and successfully logged in as expected. How do I get back to the main accounts dialog with a success? </p><p><strong>Notes:</strong> The new phone is a linux-based phone (Furilabs FLX1s) on which I have found Android apps to function without hiccup. It seems like  In fact, the Thunderbird for Android app itself seems to function fine. It doesn't crash. It allows me to navigate through the app menus flawlessly.  </p><p><br> Thanks for the help! </p>",maguster;platform34;,False,False,False,";useragent:Mozilla/5.0 (X11; Linux x86_64) AppleWebKit/537.36 (KHTML, like Gecko) Chrome/145.0.0.0 Safari/537.36;tb_version:TB forAndroid 17.0;os:Linux Mobile (debian-based FuriOS)",2,0,0,,,
1576647,2026-04-16 05:00:08 -0700,2026-04-16 05:00:08 -0700,en-US,thunderbird-android,my received emails disappear when messages are synchronized,False,,,False,,,send-and-receive-email,thunderbird-android;send-and-receive-email;,daniel13506,"<p>I am having a configuration problem on my Android phone, configure it from the application installed on my Windows laptop. I receive my emails but they are periodically completely deleted during message synchronization. how to resolve this malfunction? THANKS </p>",daniel13506;,False,False,False,";useragent:Mozilla/5.0 (Linux; Android 10; K) AppleWebKit/537.36 (KHTML, like Gecko) Chrome/146.0.0.0 Mobile Safari/537.36 OPR/97.0.0.0;tb_version:17.0;os:Android 10",0,0,0,,,
