id,created,updated,locale,product,title,is_solved,solution,solved_by,is_spam,last_answer,answers,topic,tags,creator,content,involved,is_archived,is_locked,is_taken,metadata,num_answers,num_votes_past_week,num_votes,taken_until,taken_by,updated_by
1579532,2026-05-01 21:58:18 -0700,2026-05-01 21:58:18 -0700,en-US,thunderbird,Help recovering emails and my folders after changing server settings,False,,,False,,,import-and-export-email,thunderbird-115101;thunderbird-11510;windows-11;thunderbird;import-and-export-email;,marullo33,<p>I had to update my server settings in Thunderbird since I changed my email hosting provider. I had no idea I would lose all my emails and folders I created. Is there any way to get these recovered? </p>,marullo33;,False,False,False,";useragent:Mozilla/5.0 (Windows NT 10.0; Win64; x64) AppleWebKit/537.36 (KHTML, like Gecko) Chrome/147.0.0.0 Safari/537.36;tb_version:115.10.1;os:Windows 11",0,0,0,,,
1579540,2026-05-01 23:16:36 -0700,2026-05-02 04:43:37 -0700,en-US,thunderbird,"when I delete an email from my inbox, it disappears, it does not go in my trash folder",False,,,False,1815274.0,1815274;,junk-mail-and-spam,thunderbird-15001;thunderbird-1500;windows-11;thunderbird;junk-mail-and-spam;,jennifermcclellan53,<p>My deleted emails do not go in my trash folder.  Where are they going? </p>,jennifermcclellan53;rednoise;,False,False,False,";useragent:Mozilla/5.0 (Windows NT 10.0; Win64; x64) AppleWebKit/537.36 (KHTML, like Gecko) Chrome/147.0.0.0 Safari/537.36 Edg/147.0.0.0;tb_version:150.0.1;os:Windows 11",1,0,0,,,
1579546,2026-05-02 00:04:29 -0700,2026-05-02 00:40:28 -0700,en-US,thunderbird,I'm having trouble setting up a new email in Thunderbird,False,,,False,1815268.0,1815268;,account-management,thunderbird-15001;thunderbird-1500;windows-11;thunderbird;account-management;,mwkolber,<p>i've set up an email on zoho and I wanted to set it up in thunderbird but I'm having trouble and keep getting an Authentication error </p>,mwkolber;Fylvara;,False,False,False,";useragent:Mozilla/5.0 (Windows NT 10.0; Win64; x64) AppleWebKit/537.36 (KHTML, like Gecko) Chrome/147.0.0.0 Safari/537.36 Edg/147.0.0.0;tb_version:150.0.1 (64-bit);os:Windows 11",1,0,0,,,
1579552,2026-05-02 01:15:49 -0700,2026-05-02 05:11:47 -0700,en-US,thunderbird,email address are not showing up in new email when you type in the name,False,,,False,1815277.0,1815277;,contacts,thunderbird-15001;thunderbird-1500;windows-11;thunderbird;contacts;,wdefour,"<p>'<em>bold text'</em><strong>create new email and type name in address box and no email address shows up </strong> ALSO, SEARCH ON THE SIDE DOES NOT SHOW THE ADDRESS WHEN YOU DO THE SEARCH. </p>",wdefour;rednoise;,False,False,False,";useragent:Mozilla/5.0 (Windows NT 10.0; Win64; x64) AppleWebKit/537.36 (KHTML, like Gecko) Chrome/147.0.0.0 Safari/537.36;tb_version:150.0.1 (64-bit);os:Windows 11",1,0,0,,,
1579556,2026-05-02 02:46:05 -0700,2026-05-02 05:21:31 -0700,en-US,thunderbird,zoom meeting add-on not working,False,,,False,1815279.0,1815273;1815276;1815279;,extensions,thunderbird-1500;windows-11;thunderbird;extensions;,Rodney.III,"<p>After installing the zoom meeting add-on, it's not working. Entered my credentials, clicked login with Zoom button and get an error: {""status"":false,""errorCode"":4702,""errorMessage"":""Invalid client_id: <a href=""mailto:rodney.arbona@thegratefulagency.com"" rel=""nofollow"">rodney.arbona@thegratefulagency.com</a>"",""result"":null} </p><p>This ID is used all the time and I tested it again prior to sending this message </p>",Rodney.III;rednoise;,False,False,False,";useragent:Mozilla/5.0 (Windows NT 10.0; Win64; x64) AppleWebKit/537.36 (KHTML, like Gecko) Chrome/147.0.0.0 Safari/537.36;tb_version:150.0;os:Windows 11;kb_visits_prior:[""/en-US/kb/thunderbird-add-ons-frequently-asked-questions""]",3,0,0,,,
1579563,2026-05-02 04:08:55 -0700,2026-05-02 08:55:39 -0700,en-US,thunderbird,I can't click the green lock icon in the URL bar of the web browser that launches within Thunderbird.,False,,,False,1815301.0,1815293;1815301;,encryption,thunderbird-140101;thunderbird-14010;windows-11;thunderbird;encryption;,shirokuma,"<p>When adding a new email account, the built-in web browser launches and displays the OAuth screen. To verify the security of the destination site, I want to click the green lock icon in the URL bar to check the details, but I can’t click it.  </p><p>Does a green lock icon mean a secure connection has been established? </p>",shirokuma;siffemoz;,False,False,False,;useragent:Mozilla/5.0 (Windows NT 10.0; Win64; x64; rv:150.0) Gecko/20100101 Firefox/150.0;tb_version:140.10.1esr 64bit;os:Windows 11,2,1,1,,,
1579573,2026-05-02 07:09:27 -0700,2026-05-02 07:45:15 -0700,en-US,thunderbird,Why is login credentials suddenly asked for?,True,1815290.0,seth.pylad,False,1815290.0,1815290;,account-management,thunderbird-140100;thunderbird-14010;thunderbird;account-management;,seth.pylad,"<p><strong>Hello</strong> from Sweden, and I'm sorry if any grammar or expression is incorrect. </p><p>All of a sudden login credentials is asked for (see attached image), for an <strong>old</strong> account that I've already (a couple of weeks ago) deleted <em>both</em> in Thunderbird and <em>also</em> on the server (on <a href=""http://sethpylad.se"" rel=""nofollow"">sethpylad.se</a>). I always click the Cancel button when this comes up, but I don't understand this at all because when I try to send an email to the <strong>existing</strong> new account on the same server it all works as it should? So it seems like it only ask for credentials for the old/deleted account? </p><p>Is there any way I can change any setting to not be annoyed by this from here on? </p><p>I'm using a HP laptop. And on my desktop computer I can't really recall having this problem at all. </p><p><strong>Edit:</strong> I just deleted an Address Book that was associated with that old account, but the problem prevails. <strong>/edit</strong> </p><p>Thanx in advance! <em>Seth Pylad from Sweden</em> </p>",seth.pylad;,False,False,False,;useragent:Mozilla/5.0 (X11; Linux x86_64; rv:150.0) Gecko/20100101 Firefox/150.0;tb_version:140.10.0esr;os:Linux Mint 22.3 (Cinnamon);solver_id:7609534,1,0,0,,,seth.pylad
1579578,2026-05-02 07:33:55 -0700,2026-05-02 07:51:36 -0700,en-US,thunderbird,"With 150.0 when I go Help/About it comes up with restart to update and when clicked on it restarts but does not update and simply repeats without updating, so the question is how to fix it?",True,1815292.0,vk7rb,False,1815292.0,1815291;1815292;,update,thunderbird-1500;windows-11;thunderbird;update;,vk7rb,"<p>Very simply as per the summary, every time I hit restart to update and then do another Help/About it ends up back with exactly the same result every time and while I downloaded the latest version available for download and installed it, it does not come up with 150.0.1 but the same as above. </p>",vk7rb;siffemoz;,False,False,False,";useragent:Mozilla/5.0 (Windows NT 10.0; Win64; x64) AppleWebKit/537.36 (KHTML, like Gecko) Chrome/147.0.0.0 Safari/537.36 Edg/147.0.0.0;tb_version:150.0;os:Windows 11;kb_visits_prior:[""/en-US/kb/thunderbird-software-update-failed""];solver_id:7609587",2,0,0,,,
1579583,2026-05-02 08:35:57 -0700,2026-05-02 08:35:57 -0700,en-US,thunderbird,Spam Filter Issue,False,,,False,,,junk-mail-and-spam,thunderbird-15001;thunderbird-1500;windows-10;thunderbird;junk-mail-and-spam;,pietro.borgogno,"<p>Hello, I get oftem spam mails with a header like the following: from:Singles50 subject:Momenti speciali insieme per gli over 50 Reply-To:<a href=""mailto:reply_to@miracel001.entrydns.org"" rel=""nofollow"">reply_to@miracel001.entrydns.org</a>&gt; </p><p>I tried to create a filter adding as personalized condition ""Reply-to"" that Thunderbird saves in the msgFilterRules.dat as: condition=""OR (\""reply-to\"",contains,@miracel001.entrydns.org)"" </p><p>There is no way to get any filter working, do you have a suggestion on how to fix this issue ? </p><p>Thanks </p>",pietro.borgogno;,False,False,False,";useragent:Mozilla/5.0 (Windows NT 10.0; Win64; x64) AppleWebKit/537.36 (KHTML, like Gecko) Chrome/147.0.0.0 Safari/537.36;tb_version:150.0.1 (64 bit);os:Windows 10",0,0,0,,,
