id,created,updated,locale,product,title,is_solved,solution,solved_by,is_spam,last_answer,answers,topic,tags,creator,content,involved,is_archived,is_locked,is_taken,metadata,num_answers,num_votes_past_week,num_votes,taken_until,taken_by,updated_by
1559682,2026-01-11 10:00:10 -0800,2026-01-11 10:26:10 -0800,tr,thunderbird,Thunderbird attığım bir maile cevap yazılmadı ise bunun takibini yapmak,false,,,false,1793127,1793127;,extensions,windows-11;thunderbird;extensions;,ali.aydogdu,<p>Merhaba; </p><p>thunderbird bir mail attığımda bu maillerin üzerinden zaman geçtikten sonra  hangisine cevap gelmemiş ve ne kadar süre geçmiş bunu görebildiğim bir ekran veya eklenti hatırlatıcı varmı? </p><p>örnek 2 hafta önce önemli bir mail attım ama bu maile yanıt gelmemiş bunu gözden kaçırdım. böyle durumlarda attığım önemli maillere cevap gelmedi ise bana hatırlatması için bir eklenti varmı? </p>,ali.aydogdu;maxcoder;,false,false,false,";useragent:Mozilla/5.0 (Windows NT 10.0; Win64; x64) AppleWebKit/537.36 (KHTML, like Gecko) Chrome/143.0.0.0 Safari/537.36;os:Windows 11",1,0,0,,,
1559684,2026-01-11 10:10:09 -0800,2026-01-11 10:10:09 -0800,fi,thunderbird,"Miten voin kirjoittaa uuden viestin. Windows surface koneella thunderbirdissä ei ole ""nappulaa"" josta voisi käynnistää uuden kirjeen kirjoittamisen",false,,,false,,,send-and-receive-email,thunderbird;send-and-receive-email;,heimo3,"<p>Windows surface laptop ja thunderbird - en löydä ""nappulaa"" jolla voisin avata uuden postin kirjoitettavaksi. en saa kyseistä nappulaa millään esille - eikä ohjelmalla näin ollen voi lähettää uusia viestejä - ainoastaan lukea vastaanotettuja viestejä - nko jokin keino tämän ""kirjoita"" - nappulan löytämiseksi </p>",heimo3;,false,false,false,";useragent:Mozilla/5.0 (Windows NT 10.0; Win64; x64) AppleWebKit/537.36 (KHTML, like Gecko) Chrome/143.0.0.0 Safari/537.36 Edg/143.0.0.0;os:windows surface 11;kb_visits_prior:[""/fi/kb/thunderbirdin-nappainkomennot""]",0,0,0,,,
1559685,2026-01-11 10:22:17 -0800,2026-01-16 12:16:05 -0800,en-US,thunderbird,emails from one folder disappeared,false,,,false,1794260,1793194;1793406;1793410;1793433;1793434;1793613;1794168;1794216;1794260;,email-and-messaging,windows;thunderbird;email-and-messaging;,whoisthis,"<p>I was working with thunderbird today. Was in a specific email folder I had named ""reference"" that I use to store various emails, probably around 50 emails in there. Suddenly they all deleted from the folder as I was watching the screen. Checked spam/trash folders and nothing. Also logged into my webmail provider and nothing there either. Any idea what could have happened here? They just seem to have literally vanished. Have used Thunderbird a number of years and never experienced anything like this. </p>",whoisthis;rednoise;Toad-Hall;wsmwk;,false,false,false,";useragent:Mozilla/5.0 (Windows NT 10.0; Win64; x64) AppleWebKit/537.36 (KHTML, like Gecko) Chrome/143.0.0.0 Safari/537.36;os:windows",9,0,1,,,
1559690,2026-01-11 10:50:24 -0800,2026-01-18 15:13:38 -0800,en-US,thunderbird,Thunderbird - passwort change after wrong input,false,,,false,1794751,1793234;1794685;1794751;,passwords-and-sign-in,thunderbird;passwords-and-sign-in;,km.extra,"<p>Hi, I use thunderbird 140.6.0 esr for Linux (Debian 12 with KDE 5). After opening Thunderbird, I am asked for the password to retrieve mail. If I make a mistake when typing it in, I have no chance to correct the password and have to restart TB. There is a correction window for the SENT password. </p>",km.extra;siffemoz;,false,false,false,;useragent:Mozilla/5.0 (X11; Linux x86_64; rv:140.0) Gecko/20100101 Firefox/140.0;os:Debian Linux 12 KDE 5,3,0,0,,,
1559694,2026-01-11 11:01:50 -0800,2026-01-12 00:16:32 -0800,it,thunderbird,configurazione email,false,,,false,1793228,1793228;,account-management,windows-7;thunderbird;account-management;,manuelmora704,<p>gentile thunderbird chiedo gentilmente  indicazione per configurare  come cliente email </p>,manuelmora704;@next;,false,false,false,";useragent:Mozilla/5.0 (Windows NT 10.0; Win64; x64) AppleWebKit/537.36 (KHTML, like Gecko) Chrome/143.0.0.0 Safari/537.36;os:windows 7",1,0,0,,,
1559704,2026-01-11 12:08:52 -0800,2026-01-12 00:17:32 -0800,it,thunderbird,scaricare le email da google e da pec,false,,,false,1793229,1793229;,send-and-receive-email,windows;thunderbird;send-and-receive-email;needsinfo;,simonetta.ruju,"<p>mi sembra di aver collegato correttamente i due account di google e della pec aruba, ma thunderbird mi ha scaricato i messaggi di google solo fino al 2011 e non ha scaricato nulla dalla pec.  cosa devo fare? c'è un tutorial? </p>",simonetta.ruju;@next;,false,false,false,";useragent:Mozilla/5.0 (Windows NT 10.0; Win64; x64) AppleWebKit/537.36 (KHTML, like Gecko) Chrome/143.0.0.0 Safari/537.36;os:windows",1,0,0,,,
1559707,2026-01-11 12:17:24 -0800,2026-01-11 12:25:11 -0800,en-US,thunderbird,Send Email,false,,,false,1793146,1793146;,send-and-receive-email,thunderbird;send-and-receive-email;,frankcamilla,"<p>Hi Earlier we have been able to send many up to at least 100 Email at the same time. Now we get, even if we only want to send one adress we get the message like here under. </p><p>""The message could not be sent. An error occurred while sending the email. The server responded: Too many messages. Please check the message and try again."" </p><p>Way? Thanks in advance </p><p>Frank and Camilla Mattsson </p>",frankcamilla;davidsk;,false,false,false,";useragent:Mozilla/5.0 (Windows NT 10.0; Win64; x64) AppleWebKit/537.36 (KHTML, like Gecko) Chrome/143.0.0.0 Safari/537.36;os:Telia",1,0,0,,,
1559722,2026-01-11 14:08:11 -0800,2026-01-11 15:59:34 -0800,en-US,thunderbird,now getting gibberish on one of our email names when trying to forward.,true,1793180,mozilla98,false,1793180,1793180;,send-and-receive-email,thunderbird;send-and-receive-email;,charles116,"<p>Here it is...what now? </p><p>X-Mozilla-Status: 	0001 X-Mozilla-Status2: 	00000000 Received: 	from <a href=""http://BN5PR01MB9384.prod.exchangelabs.com"" rel=""nofollow"">BN5PR01MB9384.prod.exchangelabs.com</a> (2603:10b6:408:2ac::13) by <a href=""http://LV8PR01MB9283.prod.exchangelabs.com"" rel=""nofollow"">LV8PR01MB9283.prod.exchangelabs.com</a> with HTTPS; Sun, 11 Jan 2026 14:27:54 +0000 ARC-Seal: 	i=2; a=rsa-sha256; s=arcselector10001; d=<a href=""http://microsoft.com"" rel=""nofollow"">microsoft.com</a>; cv=pass; b=exM0PqApGiVxdsqGwnNNaEjVk2Eujs4NuZMKbzvblLBk6iI499CKV4UJcRecK3r9trFs5lH2Z0m+kmqqfntGd80SJGtHkJ/dzf0c/WMUCdOPlhsgMtgMEScJBuqkpMspk3v+Fgy6HcEGSOJUmnEfJO0j76vWEP+Jm8Dj5v2tV+YbxArtZSwfDW++QcVR5K7zkgQkthRjGWELTOWn26lCgDEK3uFgrEkpS9HXfmxjW1oBwimQs1ozNzt0JQZWl5G2GQ5BHbWWiCIb7/TqhYwfaCL0AX6tti+WgV/vposo2g5xBUALUsXLKFuoaMkVCSAoU4aDeNlxNGtkl+dfB/y46w== ARC-Message-Signature: 	i=2; a=rsa-sha256; c=relaxed/relaxed; d=<a href=""http://microsoft.com"" rel=""nofollow"">microsoft.com</a>; s=arcselector10001; h=From:Date:Subject:Message-ID:Content-Type:MIME-Version:X-MS-Exchange-AntiSpam-MessageData-ChunkCount:X-MS-Exchange-AntiSpam-MessageData-0:X-MS-Exchange-AntiSpam-MessageData-1; bh=I9hS8gR0ZjIJwnW+qJRgV1nn+c1Jje4ELFwz+OrLwPo=; b=l2VpVZOCfFFEKi+qRFfWOrdp5eZrJLG4JUlc+mmz3AOpjQ3o3tt9cb6RF9Z19A+PxtesiUR4fb65wGUqBytH95J8HBKVDyPY0wPRQ9RWEa45OiBst/XXcceniQxwdB46zui89gnGQVeLropzhxBQWTk4P2XjMpg8E6TWsKz5SacCVeffK466Zo90u64aCRPb2b5MeCb7eHcNP/ndSMh43hXSgjPaivQuUqjXNtjz8+ccYadRUOqTwbFHgBDPRMwH4PwtSYEvCjKd8vmZRldchgIqqHd46ayNxfGM2cTwsJOf+YNPkPpMQAqkfuPZBU1MjDhNySpEskcDLSvZudySzw== ARC-Authentication-Results: 	i=2; <a href=""http://mx.microsoft.com"" rel=""nofollow"">mx.microsoft.com</a> 1; spf=pass (sender ip is 2607:f8b0:4864:20::b12f) smtp.rcpttodomain=<a href=""http://apaltd.com"" rel=""nofollow"">apaltd.com</a> smtp.mailfrom=<a href=""http://gmail.com"" rel=""nofollow"">gmail.com</a>; dmarc=pass (p=none sp=quarantine pct=100) action=none header.from=<a href=""http://gmail.com"" rel=""nofollow"">gmail.com</a>; dkim=pass (signature was verified) header.d=<a href=""http://gmail.com"" rel=""nofollow"">gmail.com</a>; arc=pass (0 oda=0 ltdi=1) Received: 	from <a href=""http://BYAPR05CA0052.namprd05.prod.outlook.com"" rel=""nofollow"">BYAPR05CA0052.namprd05.prod.outlook.com</a> (2603:10b6:a03:74::29) by <a href=""http://BN5PR01MB9384.prod.exchangelabs.com"" rel=""nofollow"">BN5PR01MB9384.prod.exchangelabs.com</a> (2603:10b6:408:2ac::13) with Microsoft SMTP Server (version=TLS1_2, cipher=TLS_ECDHE_RSA_WITH_AES_256_GCM_SHA384) id 15.20.9499.7; Sun, 11 Jan 2026 14:27:53 +0000 Received: 	from <a href=""http://SJ5PEPF000001E9.namprd05.prod.outlook.com"" rel=""nofollow"">SJ5PEPF000001E9.namprd05.prod.outlook.com</a> (2603:10b6:a03:74:cafe::54) by <a href=""http://BYAPR05CA0052.outlook.office365.com"" rel=""nofollow"">BYAPR05CA0052.outlook.office365.com</a> (2603:10b6:a03:74::29) with Microsoft SMTP Server (version=TLS1_3, cipher=TLS_AES_256_GCM_SHA384) id 15.20.9520.3 via Frontend Transport; Sun, 11 Jan 2026 14:27:50 +0000 Authentication-Results: 	spf=pass (sender IP is 2607:f8b0:4864:20::b12f) smtp.mailfrom=<a href=""http://gmail.com"" rel=""nofollow"">gmail.com</a>; dkim=pass (signature was verified) header.d=<a href=""http://gmail.com"" rel=""nofollow"">gmail.com</a>;dmarc=pass action=none header.from=<a href=""http://gmail.com"" rel=""nofollow"">gmail.com</a>;compauth=pass reason=100 Received-SPF: 	Pass (<a href=""http://protection.outlook.com"" rel=""nofollow"">protection.outlook.com</a>: domain of <a href=""http://gmail.com"" rel=""nofollow"">gmail.com</a> designates 2607:f8b0:4864:20::b12f as permitted sender) receiver=<a href=""http://protection.outlook.com"" rel=""nofollow"">protection.outlook.com</a>; client-ip=2607:f8b0:4864:20::b12f; helo=<a href=""http://mail-yx1-xb12f.google.com"" rel=""nofollow"">mail-yx1-xb12f.google.com</a>; pr=C Received: 	from <a href=""http://mail-yx1-xb12f.google.com"" rel=""nofollow"">mail-yx1-xb12f.google.com</a> (2607:f8b0:4864:20::b12f) by <a href=""http://SJ5PEPF000001E9.mail.protection.outlook.com"" rel=""nofollow"">SJ5PEPF000001E9.mail.protection.outlook.com</a> (2603:10b6:a0f:fc02::1c5) with Microsoft SMTP Server (version=TLS1_3, cipher=TLS_AES_256_GCM_SHA384) id 15.20.9520.1 via Frontend Transport; Sun, 11 Jan 2026 14:27:52 +0000 Received: 	by <a href=""http://mail-yx1-xb12f.google.com"" rel=""nofollow"">mail-yx1-xb12f.google.com</a> with SMTP id 956f58d0204a3-644752b3105so686485d50.3 for &lt;penny@apaltd.com&gt;; Sun, 11 Jan 2026 06:27:52 -0800 (PST) ARC-Seal: 	i=1; a=rsa-sha256; t=1768141671; cv=none; d=<a href=""http://google.com"" rel=""nofollow"">google.com</a>; s=arc-20240605; b=C3nOJhnprYQDjpmynTC0hdLG7z3Ox5hAWzqyEZFgsW1TwF2xPtNY+JVfSOjvAbx7iv 6WD5hPZjiqgkcjN4zeyqN9B2i2rw5meoNnzcJpogy7l3hWTnz3F3hNOFkKaewMaNkanV VWr73BKEsm9R2DzjXYAeRO67By9nobIJkHCCkFLRS5Mwi3p844qdnUmJyg6HiE5kA9AL /RU6674E9p/tE1NukjCZibh5wI5bwGvDl0VW5eJAN6PhTqp3Al/kgtW15dATPYAUqcBI axhH8RxsggdY7XflZGdcRni5p7cghLPDIVv7fds3pS0yshLIS6sQT375yjvuBtU8bmJ0 gxqQ== ARC-Message-Signature: 	i=1; a=rsa-sha256; c=relaxed/relaxed; d=<a href=""http://google.com"" rel=""nofollow"">google.com</a>; s=arc-20240605; h=to:subject:message-id:date:from:in-reply-to:references:mime-version&nbsp;:dkim-signature; bh=I9hS8gR0ZjIJwnW+qJRgV1nn+c1Jje4ELFwz+OrLwPo=; fh=wWQP2TV7cIPIrlKC+dec5WyAEE4LzTpvveL2UYwHKsI=; b=DdAI3ijdOzBm9eAX9IVqmyHJ0+vDHt8D9MCj/OtuPGBtEO4Px1NJN1vFCawhgDt61k zL3wjRAcWevxlwFEVZVNeP1+hg0kU2z2dakG6vk8OEyvBKliuLJLki8TlWjJXHGAq1g8 XlyzYsnIKLQAji1zSAD3Xe6MfehOjQ+cOmVBaaTdEjmsLZtR4pwU/Zyhm46TipyFNVpn 56tL6EzFLnb8EzX6F9HdTOcsObc6tbAgqxgqt2n5DIaNvY16afJ40wY3G4fBGuATTWPl 99g6HkiDobYh44V5zCeU9w/a7OpJdvm7y6mgaZCNmWQMsg9jxQjPe1gdjlAhcoPPPRT9 0AUw==; darn=<a href=""http://apaltd.com"" rel=""nofollow"">apaltd.com</a> ARC-Authentication-Results: 	i=1; <a href=""http://mx.google.com"" rel=""nofollow"">mx.google.com</a>; arc=none DKIM-Signature: 	v=1; a=rsa-sha256; c=relaxed/relaxed; d=<a href=""http://gmail.com"" rel=""nofollow"">gmail.com</a>; s=20230601; t=1768141671; x=1768746471; darn=<a href=""http://apaltd.com"" rel=""nofollow"">apaltd.com</a>; h=to:subject:message-id:date:from:in-reply-to:references:mime-version&nbsp;:from:to:cc:subject:date:message-id:reply-to; bh=I9hS8gR0ZjIJwnW+qJRgV1nn+c1Jje4ELFwz+OrLwPo=; b=TqUwJIXN4RkKXGGdWx6eviLnpFsHpBLW5dW+WqJ7E6fL43S8KfzwokbEbsN2tQt3zD zWePhI2NiIZQdqOC3zjJuvC01FCTpHx+2l0wkOsyWo3g3AYWDRBqC4JgacoFDpQPOZGj jwRqKBgpP7C1hwvEZsa0uldtYzngbfvV7iMgt/1nJmxOeMJXfdx0KRh3rNqQQC63lgoh K/K5rQ6zyIaknCPySyD/P5Y7T8OdPw3zawh7ihEVaPbKTg5YOt93tHuZtn0RuFKyzxjd nL6aIdBv2tUeVsKUcGmg/U/pGmed2awKVEF7tYCAfqRfcv+gO7X8ps+8fJLV4K5qrEna NfIA== X-Google-DKIM-Signature: 	v=1; a=rsa-sha256; c=relaxed/relaxed; d=<a href=""http://1e100.net"" rel=""nofollow"">1e100.net</a>; s=20230601; t=1768141671; x=1768746471; h=to:subject:message-id:date:from:in-reply-to:references:mime-version&nbsp;:x-gm-gg:x-gm-message-state:from:to:cc:subject:date:message-id&nbsp;:reply-to; bh=I9hS8gR0ZjIJwnW+qJRgV1nn+c1Jje4ELFwz+OrLwPo=; b=RZ6HgnvcN3Or59XFxkLQKGRT8kSAWxENnjp0tpgCPqBN2xyhD6/orFLfnz5IYrjUWG NSyfgzD0ZFD41pJpDka866cnB5y6OoeaqdLoaDG+2L9Rfld5J1NQge/A+cUku2aKMOGe HWqs5PSqHAEEatGhut+p1HGyHe6XfQy27HZufFk/ygxk6pdpyftrs1EQBTLqxMVjVrzf JFGwUwhIJNwif5Tlesnm6EyG1L8l5ITh3TIYf+BXZZg9g/c6APY+2BcIydlHXeaKbwcR V9NSP8+AE8X6gNbNxaNwO/OBKZrNTTGCVm3/kqQ2CbKg5Kk/XfnV5eS2aObgGGk4PhiE PpEg== X-Forwarded-Encrypted: 	i=1; AJvYcCUe7WvvCAbHQgxpSbgTLZhWwZA68S77Acx35LKBUzfuJthk7KdyHuXSErljl8enFjzjKVtzNQ==@apaltd.com X-Gm-Message-State: 	AOJu0YzmHRywhLhx+iWykX0EZZpbR9/D5Onu5j+vd389Oplk94lZq6mD GtXTRuWC0DfIu+cDwy1nVpdhL9J8fG387c0h8fX3OD0jJUBJy0X/1/MO+ym2EjRdYxPtmj9LkJj yRb/akEzvENCPrfj9JBI3Y1jCjwA6dQ8= X-Gm-Gg: 	AY/fxX5fs7LkXiIzVTlAy6UlLI2zgBxlMwkouQABANKzS4FLg8v2hwERfYvbMGp9h1g 2OaQv4qQ84Kb/RXgxmo9Jw8KhQk5Fa+XpC+pzvS/IRid+Lp/WWPhj/hTUFSB1KXZAJLXu7ies4E yJ/D60oX2EaDuSg4uJpW/Zy7WFbnWCuIdGkA52+LlFtaBqdjmKfNrThjXLMT0LElQkeU0ibrZFG aZjvmmIlldUuDtRsSs75PR4tAIoKGp/fptxScsZQZG0hWo2ZIPEOcpKavBdwr5YYAUCbd+5VFlr k6lTXWE= X-Google-Smtp-Source: 	AGHT+IGy/q43AqdCVIOrnol4c3Joug1q1FpIy8/4NqsZYzZPg2lZZPf1NE8BB/45cmVo2KN+V5yjHb82TjqRiXeezdQ= X-Received: 	by 2002:a05:690e:400a:b0:644:45a9:c0d1 with SMTP id 956f58d0204a3-647169b02c7mr10801916d50.0.1768141671048; Sun, 11 Jan 2026 06:27:51 -0800 (PST) References: 	&lt;MN2PR19MB3327BA032853EC28DE4CCDFDA183A@MN2PR19MB3327.namprd19.prod.outlook.com&gt; In-Reply-To: 	&lt;MN2PR19MB3327BA032853EC28DE4CCDFDA183A@MN2PR19MB3327.namprd19.prod.outlook.com&gt; From: 	Vicki Howe &lt;vicbillh@gmail.com&gt; Date: 	Sun, 11 Jan 2026 09:27:41 -0500 X-Gm-Features: 	AZwV_QhSQQ5ONt-uhPK8_jFyLUJN2HsmQVirOlBJxTr_o_FdSXiDXwqtJaDiHOU Message-ID: 	&lt;CAMur-o=V2Ln5fsGh5T=P5xx3PxX1qHqAfjxcX=puMoNYgvc=CQ@mail.gmail.com&gt; Subject: 	Fwd: Spot on To: 	 Content-Type: 	multipart/alternative; boundary=""000000000000372c1906481d9074"" Return-Path: 	vicbillh@gmail.com X-MS-Exchange-Organization-ExpirationStartTime: 	11 Jan 2026 14:27:52.4297 (UTC) X-MS-Exchange-Organization-ExpirationStartTimeReason: 	OriginalSubmit X-MS-Exchange-Organization-ExpirationInterval: 	1:00:00:00.0000000 X-MS-Exchange-Organization-ExpirationIntervalReason: 	OriginalSubmit X-MS-Exchange-Organization-Network-Message-Id: 	e4063c3f-27f3-472d-b6f4-08de511d9aaf X-EOPAttributedMessage: 	0 X-EOPTenantAttributedMessage: 	1104c033-cb35-46ef-a4c1-f732496e1cc1:0 X-MS-Exchange-Organization-MessageDirectionality: 	Incoming X-MS-PublicTrafficType: 	Email X-MS-TrafficTypeDiagnostic: 	SJ5PEPF000001E9:EE_|BN5PR01MB9384:EE_|LV8PR01MB9283:EE_ X-MS-Exchange-Organization-AuthSource: 	<a href=""http://SJ5PEPF000001E9.namprd05.prod.outlook.com"" rel=""nofollow"">SJ5PEPF000001E9.namprd05.prod.outlook.com</a> X-MS-Exchange-Organization-AuthAs: 	Anonymous X-MS-Office365-Filtering-Correlation-Id: 	e4063c3f-27f3-472d-b6f4-08de511d9aaf X-MS-Exchange-Organization-SCL: 	-1 X-Microsoft-Antispam: 	BCL:0;ARA:13230040|7093399015|8096899003|13003099007; X-Forefront-Antispam-Report: 	CIP:2607:f8b0:4864:20::b12f;CTRY:;LANG:en;SCL:-1;SRV:;IPV:NLI;SFV:SFE;H:<a href=""http://mail-yx1-xb12f.google.com"" rel=""nofollow"">mail-yx1-xb12f.google.com</a>;PTR:<a href=""http://mail-yx1-xb12f.google.com"" rel=""nofollow"">mail-yx1-xb12f.google.com</a>;CAT:NONE;SFS:(13230040)(7093399015)(8096899003)(13003099007);DIR:INB; X-MS-Exchange-CrossTenant-OriginalArrivalTime: 	11 Jan 2026 14:27:52.1713 (UTC) X-MS-Exchange-CrossTenant-Network-Message-Id: 	e4063c3f-27f3-472d-b6f4-08de511d9aaf X-MS-Exchange-CrossTenant-Id: 	1104c033-cb35-46ef-a4c1-f732496e1cc1 X-MS-Exchange-CrossTenant-AuthSource: 	<a href=""http://SJ5PEPF000001E9.namprd05.prod.outlook.com"" rel=""nofollow"">SJ5PEPF000001E9.namprd05.prod.outlook.com</a> X-MS-Exchange-CrossTenant-AuthAs: 	Anonymous X-MS-Exchange-CrossTenant-FromEntityHeader: 	Internet X-MS-Exchange-Transport-CrossTenantHeadersStamped: 	BN5PR01MB9384 X-MS-Exchange-Transport-EndToEndLatency: 	00:00:02.3977947 X-MS-Exchange-Processed-By-BccFoldering: 	15.20.9499.005 X-Microsoft-Antispam-Mailbox-Delivery: 	wl:1;pcwl:1;ucf:0;jmr:0;auth:0;dest:I;ENG:(910005)(944506478)(944626604)(920097)(811242)(255002)(410001)(930201)(20251009114)(140003); X-Microsoft-Antispam-Message-Info: 	/PUy3smgAoR680XGmoNOFqbBpnc9RjXBQjR4vmaic/zynqv3F0QK35t3E1vVlsNPyg2DEt/TJkGp9pwHPgTi1g02ZkM3aOsGuaePIzRK+KmW6yELaxacVImjvI53vetsfyKgz4oD2XgSvED+JQH4E07N3Foay4wOrrcPXymOLiqp5zFzgai+RmLNalfshy+v56402vDoeI4Ywpjg7LOJhM1lwCmIR8YP6/boAZnlLybCb/RLyDodnqUXyPZ5uX+BI9/xxFXpHlBEzS8rSJDn0GJ0QhkniarZkuZo4nElfnHlUKknK24GZTUuSVmGW17vNoL1EZ6nAEe5HC83bZFO6Wd4Fyp60nfB06Vfgv8hFq0nDK8hKIEJtRp8sFyP/3qvZ8cTa9GlgtENiFxB6GtDZI+X7fyEmn1bwXzWqT0Dza+/T4EQhisiCE0ypKuKLcj7w1TMJwemW0L5AUwJ+z5IyghG6NexodHRu+xmK0aTNIOlUAE4z2fOhUmjVQ2/O1xr0DB0lSN8oVB9aQ+LYUv5hSzd+nV79pWkdg/x2ztwdcC8L8StI2ycRwyoyML6Xgdwtec5Hd2r+3kwrUSw/+5bUWsHzZoOOG/HEHM0X2uVaiBocckBiW30zSaT9h8w2FqOOHUl6OL86Pam32TjL47bclj2X7eiW1H/kv9rqSvds9Zl7bcIwRg5nPR8X5/W/dDHzDgLzlSx8LJMFr05S1LjzR2h8wCl6y0I4pT+cDvAXDteN76GFJH0RI/Pyax0GKuwqf54AZmyiQtuNEvk8+huqdRk9pZWTkUn30NvIW1vyAFW1xvPvXC2l74KihgxRg0riaAgP6rxtgrqWZaapRZfwvJfalh8LmuddCI+iS4x2VHboyo7hfLLrVtkp/uJGu7YOfY8oaANKCdLx1yznqWXkAMftnQ+bkhYXPAc76m5MIbHP1kRKy8DgQoi1OE9/7MKklt6MYGsuk6ECje839jrVGDXToVAkaUxYBzBEq+lVhF/+blHSHS0bHOOlDAdiEO8DCj3IMXJZKXUefFMWynshK5ghBCXJ9MX/C3wkXaRs1QSrV24Qa7brbfrKioLiCApyCw2xYcaTKYJRRrSAK1pa3OmxxZ4vqCaGW3Df30+mdYNxUI5+rL32GUsnQiJJgF5TR/2C1zYDbFAv3rB7xA3Fhxqcadd8DMEbwNeATeRtJPml6qQmd2aF0Q2I6CZSVENVB3DwAzCN3vWV8rMpNamvH7F9y2KnO1kEC477xcqRjDAn7eIXhfUV2XzY8sihrBwCtN6g8M0q+/YEnlSt7h4CxBIUzFlkK83hB+zP3Kx4Vy8R65RpFI6PK5zy2OsLecxtC5Jbh8SQphfHLsfchpaNF7L/lqeDr0BJHMM88cyQOnjIMIAuKXS+V2fB9kpVEneyoxoVcLYeKsF/1QO2eVyghCisPykeg+nfck6y1qjWMhOPjw5H4xCP/BOqPnrEUSsrCRdemGYG/5cfae073hlylGzps2xU2iSyADpOGYWrosCx84F3gTyd5Wb2psN4jPJunJ6Zo2tVz/TagMUxNWPk45U8+J+hBF5GiyKM4CLUjD9t6h9aQf0+uK57mpK8MKBN7bcHws+Dt56kIDSvLgDkaz37mpUvGvKCutLKU9zs3GkaLBBbFOvirDUEQhXsr2b4d6eDgzMMA17HBGT6bt+4wowXhDdAgFeY2ruyn2lx5OclLOYrIeciVrF1+ysSoG/zMl8ugmxeJOaPsCLO3oq1NhANt9XkgKa6mQsSiKEoJYBpR8IV73HbfXk666N2Ip6BHvJeVRg1Jx6BX4NYDpsVrXoDaQO+4OBOc3kkSee0yz1ohW6VVq650klLexgp7jEHVW/xP9Z3yuU/fiFwDAgLWVuu8vAr3nQgEnTGh7lK9rCkNDmOXwSLYQ9jz4cZ6tDzx6dPMlqqjJtJwWqN4eAj3zuyz9yoMDw42y0BRHpRVsvjOVFiWx18pPsGuAoYVAKrOIxc1xJxMPl0KnNtMiFtgtqk4Ie0i3ru2EItCBFg2nJb5dyukvnnoNshF+vmZVaAoAx7sWXOsPg6b/IQhVgl0iskZrrxEubPMk02J3mjqqXiJfOV10LeTofCzSaOnDcRsflPE0/KQIptalbuoNizbVTWXUmaPJvouJKUZWCYWUVsTj02ugekVXuKg+kUO8Nbf6V1goNerX6wn1BY+oVtCRL8CsTmJJqXEW2xlg10PyG7mG6LyTyIqG5eZHGXqbMbprYJXi+if/7Nds1/qr+jPNuwh7YjXcTgyZuJAEusZH+JIN9gqZfWo0JetDUHUjTIyFyC7rBd1U2dw8I5QnRSdc15KdaItPE5gtrrr94Q/YHDM2x5lM4bV/04SPDt8dG3urGIJNeGXH1QToEWAE2wfceG815LPqaerTUGJfzMuuewtJGHMBjawNCfBKingUV MIME-Version: 	1.0 X-Antivirus: 	AVG (VPS 260111-2, 1/11/2026), Inbound message X-Antivirus-Status: 	Clean </p><p><br> Excellent analysis, indeed... </p><p>Date: Sat, Jan 10, 2026 at 2:54 PM Subject: Spot on To: </p><p><br> <a href=""https://x.com/Dempaslotteborn/status/2009722"" rel=""nofollow"">https://x.com/Dempaslotteborn/status/2009722</a> </p>",charles116;mozilla98;,false,false,false,";useragent:Mozilla/5.0 (Windows NT 10.0; Win64; x64) AppleWebKit/537.36 (KHTML, like Gecko) Chrome/143.0.0.0 Safari/537.36 Edg/143.0.0.0;solver_id:5279461",1,0,0,,,
1559727,2026-01-11 15:15:19 -0800,2026-01-11 15:15:19 -0800,en-US,thunderbird,EWS not finding all folders,false,,,false,,,send-and-receive-email,windows-11;thunderbird;send-and-receive-email;,clamb2411,"<p>Just installed version 146 and deleted all my old profiles because there were too many errors with TB syncing renamed folders and not the new versions.  </p><p>Selected EWS to attach our Office365 account which all seemed to work well, but it only finds a few of my folders (luckily all correct), but doesn't find Inbox, Trash etc.  </p><p>It also doesn't seem to want to download all the email, despite selecting that in the Account Settings.  </p><p>The Subscribe option is not available under the File menu.  </p><p>Been using it for 25 years or so, but may have to give up if I can't get my inbox.  </p><p>Screenshots attached showing what Thunderbird shows vs. OWA.  </p><p>Thanks for any ideas. </p>",clamb2411;,false,false,false,;useragent:Mozilla/5.0 (Windows NT 10.0; Win64; x64; rv:146.0) Gecko/20100101 Firefox/146.0;os:Windows 11,0,0,0,,,
1559735,2026-01-11 16:40:43 -0800,2026-01-11 20:58:44 -0800,en-US,thunderbird,Thunderbird istallation,true,1793190,rednoise,false,1793199,1793190;1793199;,install,windows;thunderbird;install;,johnwvanlint,<p>I am trying to download Thunderbird on my PC. I donated to Mozilla yesterday. When I try to install it asks for another donation. </p>,johnwvanlint;rednoise;Yu5tiqX9og;,false,false,false,;useragent:Mozilla/5.0 (Windows NT 10.0; Win64; x64; rv:146.0) Gecko/20100101 Firefox/146.0;os:windows;solver_id:7326549,2,0,0,,,
1559776,2026-01-12 00:52:47 -0800,2026-01-22 05:53:23 -0800,en-US,thunderbird,"Using Delete in Menu Bar, I can only delete from Unified Inbox, not individual accounts",false,,,false,1795514,1793306;1793331;1793364;1793462;1795514;,email-and-messaging,thunderbird;email-and-messaging;,Tombarkas,"<p>Sorry - I feel as though I'm monopolising this forum at the moment! </p><p>In my Menu bar, I have Delete, but, using this, I can only delete emails from the Unified list, not individual accounts. I CAN delete from individual accounts if I select the email, right click and select delete. Seems odd </p>",Tombarkas;davidsk;Toad-Hall;,false,false,false,";useragent:Mozilla/5.0 (Windows NT 10.0; Win64; x64) AppleWebKit/537.36 (KHTML, like Gecko) Chrome/143.0.0.0 Safari/537.36 Edg/143.0.0.0",5,0,0,,,
1559782,2026-01-12 02:10:02 -0800,2026-01-13 03:18:55 -0800,nl,thunderbird,Genereren van e-mails (merge),false,,,false,1793467,1793467;,send-and-receive-email,thunderbird;send-and-receive-email;,agemajm,<p>Kun je emails genereren door velden in te vullen vanuit Excel (merge)? </p><p>Johan </p>,agemajm;markh2;,false,false,false,;useragent:Mozilla/5.0 (Windows NT 10.0; Win64; x64; rv:146.0) Gecko/20100101 Firefox/146.0,1,0,0,,,
1559784,2026-01-12 02:11:03 -0800,2026-01-12 06:52:53 -0800,it,thunderbird,Thunderbird  Lingua Cartelle account,false,,,false,1793326,1793289;1793311;1793317;1793323;1793324;1793326;,account-management,thunderbird;account-management;,psaemail,"<p>ho creato dei nuovi account e-mail e pur avendoli creati come gli altri esistenti, in alcuni manca la cartella bozze ed uno e` in lingua inglese e non in  italiano </p>",psaemail;@next;,false,false,false,;useragent:Mozilla/5.0 (Windows NT 10.0; Win64; x64; rv:146.0) Gecko/20100101 Firefox/146.0;os:win11,6,0,0,,,
1559798,2026-01-12 04:10:43 -0800,2026-01-12 08:12:15 -0800,en-US,thunderbird,"Comment réduire le bandeau dans ma boîte, ou le supprimer partiellement ?",true,1793307,psyphilo,false,1793348,1793277;1793281;1793292;1793303;1793304;1793307;1793316;1793345;1793348;,customization,thunderbird;customization;,psyphilo,"<p>Comment réduire le bandeau dans ma boîte, ou le supprimer partiellement&nbsp;? Merci </p>",psyphilo;davidsk;,false,false,false,";solver_id:3433491;useragent:Mozilla/5.0 (Windows NT 10.0; Win64; x64) AppleWebKit/537.36 (KHTML, like Gecko) Chrome/143.0.0.0 Safari/537.36;os:W11 Pro;kb_visits_prior:[""/fr/kb/compacter-les-dossiers""]",9,0,0,,,
1559800,2026-01-12 04:19:31 -0800,2026-01-12 04:42:37 -0800,en-US,thunderbird,"imap fragt ständig nach Passwort ,läßt sich nicht ändern",false,,,false,1793279,1793279;,passwords-and-sign-in,thunderbird;passwords-and-sign-in;,magdalenawinkels,"<p>imap fragt ständig nach Passwort ,läßt sich nicht ändern, was soll ich tun???? </p>",magdalenawinkels;davidsk;,false,false,false,;useragent:Mozilla/5.0 (Windows NT 10.0; Win64; x64; rv:146.0) Gecko/20100101 Firefox/146.0,1,0,0,,,
1559805,2026-01-12 05:10:24 -0800,2026-01-12 05:42:12 -0800,en-US,thunderbird,emails,false,,,false,1793302,1793302;,send-and-receive-email,thunderbird;send-and-receive-email;,enquiries22,<p>I am not getting any emails as of the 7th of January 2026. Can you help please/ </p>,enquiries22;davidsk;,false,false,false,";useragent:Mozilla/5.0 (Windows NT 10.0; Win64; x64) AppleWebKit/537.36 (KHTML, like Gecko) Chrome/143.0.0.0 Safari/537.36",1,0,0,,,
1559807,2026-01-12 05:14:54 -0800,2026-01-12 05:31:45 -0800,en-US,thunderbird,imap will plötzlich immer mein Passwort,false,,,false,1793294,1793294;,send-and-receive-email,thunderbird;send-and-receive-email;,magdalenawinkels,<p>imap will plötzlich immer mein Passwort </p>,magdalenawinkels;davidsk;,false,false,false,;useragent:Mozilla/5.0 (Windows NT 10.0; Win64; x64; rv:146.0) Gecko/20100101 Firefox/146.0;os:imap will plötzlich immer mein Passwort,1,0,0,,,
