id,created,updated,locale,product,title,is_solved,solution,solved_by,is_spam,last_answer,answers,topic,tags,creator,content,involved,is_archived,is_locked,is_taken,metadata,num_answers,num_votes_past_week,num_votes,taken_until,taken_by,updated_by
1574674,2026-04-04 18:06:42 -0700,2026-04-06 14:13:02 -0700,en-US,thunderbird,Unable to send msg. Error: The server responded:  RBL restriction: Blacklisted by Internal Reputation Service - 73.62.119.4.,False,,,False,1810468.0,1810140;1810163;1810164;1810165;1810289;1810318;1810321;1810331;1810334;1810384;1810391;1810398;1810459;1810466;1810468;,send-and-receive-email,windows-11;thunderbird;send-and-receive-email;,pheczko,<p>Cannot send messages. I get an error code: </p><p>Sending of the message failed. An error occurred while sending mail: Outgoing server (SMTP) error. The server responded:  RBL restriction: Blacklisted by Internal Reputation Service - 73.62.119.4. </p><p>This is a recent abberation. I've updated to the latest version of TBird. But cannot understand this message or why I get it. Please help as I forward/send many messages daily. </p><p>Thank you </p>,pheczko;rednoise;davidsk;mozilla98;MattAuSupport;,False,False,False,";useragent:Mozilla/5.0 (Windows NT 10.0; Win64; x64) AppleWebKit/537.36 (KHTML, like Gecko) Chrome/146.0.0.0 Safari/537.36;tb_version:140.9.0esr;os:Windows 11",15,0,0,,,
1574693,2026-04-04 19:33:19 -0700,2026-04-07 15:26:42 -0700,en-US,thunderbird,New messages number remains upon TB icon on taskbar after messages read,False,,,False,1810622.0,1810167;1810173;1810198;1810622;,customization,linux;thunderbird;customization;,tamjk,"<p>I'm on Thunderbird version 140.9.0esr at present. </p><p>Machine: Dell Inspiron 15 Series laptop </p><p>Monitor: Viewsonic 27"" </p><p>System: Ubuntu 24.04.4 LTS </p><p>RAM: 16 GB </p><p>For the last 2 versions of Thunderbird, I have seen that even after reading the new messages, the green new messages indicator remains on the TB icon in the taskbar. </p><p>Refer to screenshot. </p><p>It should of course disappear as soon as the new messages are all opened. Otherwise one thinks that there is an unread message somewhere among the mail folders, even though on checking there is not. </p><p>This remains so until TB is closed and re-opened. After re-opening the green circled number is gone. </p><p>Of course, this is more a nuisance than a serious problem. </p><p>But it would be nice to have it sorted by the next version. </p>",tamjk;rednoise;,False,False,False,;useragent:Mozilla/5.0 (X11; Ubuntu; Linux x86_64; rv:149.0) Gecko/20100101 Firefox/149.0;tb_version:140.9.0esr;os:Linux,4,0,0,,,
1574702,2026-04-04 20:37:28 -0700,2026-04-05 05:13:41 -0700,en-US,thunderbird,"emails time out when addressed to ""@shaw.ca""",False,,,False,1810235.0,1810207;1810234;1810235;,send-and-receive-email,thunderbird;send-and-receive-email;,aball2,"<p>Using an iMac running vs. 140.9.0esr(aarch64) ""up to date"", emails addressed to ""<a href=""mailto:***@shaw.ca"" rel=""nofollow"">***@shaw.ca</a>"" I receive error reports that says  ""Server <a href=""http://shaw.ca"" rel=""nofollow"">shaw.ca</a> returned""  ""message reached max retries"".  Example:  Email was sent at 04/01  13:31  and the error msg was dated 04/02  02:16:11.  This is not a one-off trial; similar errors are obtained with different ""<a href=""mailto:@shaw.ca"" rel=""nofollow"">@shaw.ca</a>"" addresses. </p><p>Using Thunderbird vs. 149.0.1 (aarch64) on a Mac Pro, running on the same local network and same telco connection as the iMac, messages to ""<a href=""mailto:***@shaw.ca"" rel=""nofollow"">***@shaw.ca</a>"" are processed in normal time without error msg. </p>",aball2;rednoise;,False,False,False,";useragent:Mozilla/5.0 (Macintosh; Intel Mac OS X 10_15_7) AppleWebKit/605.1.15 (KHTML, like Gecko) Version/18.6 Safari/605.1.15;tb_version:140.9.0esr(aarch64;os:Mac OS Sequoia 15.13.1 on the iMac  with 15.15.1 on the Mac Pro",3,0,0,,,
1574740,2026-04-05 00:39:26 -0700,2026-04-05 07:59:46 -0700,en-US,thunderbird,"Bug Report: Auto-Account Setup generates invalid SMTP hostname ("".gmail.com"") causing OAuth2 authorization loop to freeze",False,,,False,1810243.0,1810243;,account-management,windows-11;thunderbird;account-management;,peter.kurt,"<p>To: Thunderbird Development &amp; Support Team Subject: Gmail Account Wizard incorrectly configures SMTP, causing OAuth2 window completion failure </p><p>Dear Thunderbird Team, </p><p>I am writing to politely report a critical bug we recently identified during the automated account creation process for a Google Mail (Gmail) account. The bug prevents the Google OAuth2 authentication window from closing and ultimately halts the account setup process. </p><p>Environment Context Account Type: IMAP/SMTP (Gmail) Authentification: OAuth2 Description of the Issue When using the Thunderbird Account Setup Wizard to connect a new @gmail.com email address, the wizard automatically pulls configuration data for Google services. However, the configuration pulled for the outgoing server (SMTP) is consistently corrupted. </p><p>Specifically, the following variables are written to the prefs.js file: </p><p>IMAP Configuration: Generates correctly as <a href=""http://imap.gmail.com"" rel=""nofollow"">imap.gmail.com</a> with authMethod: 10 (OAuth2). SMTP Configuration: Incorrectly generates the hostname as literally "".<a href=""http://gmail.com"" rel=""nofollow"">gmail.com</a>"" (missing the ""smtp"" prefix) and assigns authMethod: 0 (None) instead of 10 (OAuth2). (e.g., user_pref(""mail.smtpserver.smtpX.hostname"", "".<a href=""http://gmail.com"" rel=""nofollow"">gmail.com</a>"");) Symptoms and Behavior OAuth2 Window Hang: Because the SMTP server address is malformed (.<a href=""http://gmail.com"" rel=""nofollow"">gmail.com</a>) and cannot be resolved, when the user successfully authenticates in the Google OAuth2 pop-up and grants all permissions, Thunderbird attempts to finalize the setup against the non-existent SMTP gateway. This silent background failure results in the OAuth2 pop-up window spinning/hanging indefinitely with the message ""Waiting for authorization"". It never closes. UI Blank Dropdown Bug: If the user forces the wizard closed and attempts to view the new IMAP profile in Account Settings -&gt; Server Settings, the ""Authentication Method"" dropdown is entirely blank (no text, no selectable options). This occurs because the crashing wizard also fails to inject user_pref(""mail.server.serverX.is_gmail"", true); into prefs.js. Without the is_gmail flag, the legacy UI is unable to map the internal authMethod: 10 integer to the ""OAuth2"" string in the dropdown menu. Working Solution / Workaround Used The issue is definitively tied to the automated wizard's database fetch/parsing mechanism. We were able to completely bypass this bug by closing Thunderbird and manually injecting the pristine configuration directly into the core prefs.js file: </p><p>Fixing the SMTP hostname to <a href=""http://smtp.gmail.com"" rel=""nofollow"">smtp.gmail.com</a>. Setting mail.smtpserver.smtpX.authMethod to 10. Supplying user_pref(""mail.server.serverX.is_gmail"", true); to fix the UI rendering. Defining proper directory and directory-rel paths for the storeContractID. Upon restarting Thunderbird with the manual internal configuration applied, the OAuth2 pop-up window appeared on the first sync, processed the Google token instantly, and closed successfully without any hangs. </p><p>Conclusion Please investigate the ISP auto-configuration database logic that is currently generating .<a href=""http://gmail.com"" rel=""nofollow"">gmail.com</a> as the SMTP hostname. This flaw breaks the entire OAuth2 token routing mechanism and creates a highly confusing infinite loop for everyday users trying to add their Google accounts. </p><p>Thank you for your hard work and for keeping Thunderbird an incredible email client! </p><p>Best regards. </p>",peter.kurt;siffemoz;,False,False,False,;useragent:Mozilla/5.0 (Windows NT 10.0; Win64; x64; rv:149.0) Gecko/20100101 Firefox/149.0;tb_version:149.0.1;os:Windows 11,1,0,0,,,
1574775,2026-04-05 05:57:13 -0700,2026-04-05 15:36:18 -0700,en-US,thunderbird,再インストールしたところ本文が表示されなくなりました。,True,1810304.0,davidsk,False,1810304.0,1810304;,email-and-messaging,windows-11;thunderbird;email-and-messaging;,noboru528,<p>設定の確認方法、および対処方法を教えてください。 </p>,noboru528;davidsk;,False,False,False,";useragent:Mozilla/5.0 (Windows NT 10.0; Win64; x64; rv:149.0) Gecko/20100101 Firefox/149.0;tb_version:Thunderbird　149.;os:Windows 11;kb_visits_prior:[""/ja/kb/thunderbird-import""];solver_id:7533499",1,1,1,,,
1574780,2026-04-05 07:15:38 -0700,2026-04-05 07:51:31 -0700,en-US,thunderbird,Import/Export der Kalenderdaten,False,,,False,1810241.0,1810241;,calendar,windows-1011;thunderbird;calendar;,detlef28,<p>On my home computer and my lap top I have Thunderbird installed. Both profiles are identical. The emails on both systems are updated by just downloading them from the provider account.  My calender is normaly used on my home computer as well all appointments are saved there. </p><p>Going on longer trips away from home I would like to import all my calendar data from my home computer to my lap top. Copying the complete profile takes too much time. By just copying the calendar-data file to my lap top I do not get a working result. What do I miss? </p><p>Thanks for help Detlef </p>,detlef28;siffemoz;,False,False,False,;useragent:Mozilla/5.0 (Windows NT 10.0; Win64; x64; rv:149.0) Gecko/20100101 Firefox/149.0;os:Windows 10/11,1,0,0,,,
1574794,2026-04-05 08:49:42 -0700,2026-04-05 15:20:16 -0700,en-US,thunderbird,Identified spam messages are not moved to spam folder,False,,,False,1810301.0,1810280;1810301;,junk-mail-and-spam,thunderbird;junk-mail-and-spam;,buchanan.varclin,<p>Settings have been set to move Spam to my spam folder. Although Spam is identified it does not get moved to my Spam folder.  It used to happen but an upgrade a while back seemed to stop it happening. I have tried undoing and re-doing settings to no avail. Can someone help please? </p>,buchanan.varclin;Mapenzi;,False,False,False,";useragent:Mozilla/5.0 (Windows NT 10.0; Win64; x64) AppleWebKit/537.36 (KHTML, like Gecko) Chrome/146.0.0.0 Safari/537.36;tb_version:149.0.1 (64 bit);os:Windows 11 Pro",2,0,0,,,
1574798,2026-04-05 09:27:25 -0700,2026-04-08 16:49:10 -0700,en-US,thunderbird,Export Decktop Thunderbird to Mobile,True,1810807.0,davidsk,False,1810807.0,1810277;1810795;1810807;,import-and-export-settings,windows-11;thunderbird;import-and-export-settings;,sealion,<p>My Thunderbird Desktop Version 140.9.0esr 64 bit. <strong>Help please.</strong> Installed Mobile T'bird on android mobile. On Desktop (MS Win11) T'Bird followed Settings - Export to Mobile - included all email accounts and Passwords - Export resulting in pop up box requesting Pin number. Don’t know a Pin  nor can find a Pin nor find Settings - Accounts - Sign in options to change it. </p>,sealion;davidsk;,False,False,False,;solver_id:1061508;useragent:Mozilla/5.0 (Windows NT 10.0; Win64; x64; rv:149.0) Gecko/20100101 Firefox/149.0;tb_version:Version 140.9.0esr;os:Windows 11,3,0,0,,,
1574807,2026-04-05 10:18:25 -0700,2026-04-05 11:33:34 -0700,nl,thunderbird,Veilige afzenders toevoegen.,True,1810267.0,Mad_Maks,False,1810267.0,1810267;,junk-mail-and-spam,windows-11;thunderbird;junk-mail-and-spam;,nico34,"<p>Ik ontvang van <a href=""http://marktplaats.nl"" rel=""nofollow"">marktplaats.nl</a> voortdurend e-mail in mijn map Ongewenst. Marktplaats adviseert de volgende vier e-mailadressen met de extensie  @marktplaats.nl, @em.marktplaats.nl, @mail.marktplaats en <a href=""mailto:automatisch@marktplaats.nl"" rel=""nofollow"">automatisch@marktplaats.nl</a> aan de adressenlijst toe te voegen. Ik hoor graag van u hoe ik dat voor elkaar kan krijgen. Met vriendelijke groet, Nico Hoogzaad </p>",nico34;Mad_Maks;,False,False,False,;useragent:Mozilla/5.0 (Windows NT 10.0; Win64; x64; rv:149.0) Gecko/20100101 Firefox/149.0;tb_version:140.9.0esr (64 bit;os:Windows 11;solver_id:5765833,1,0,0,,,
1574808,2026-04-05 10:27:46 -0700,2026-04-05 11:53:51 -0700,en-US,thunderbird,Carnets d adresses sous thundbird,False,,,False,1810274.0,1810274;,contacts,windows-11;thunderbird;contacts;,d.babarit,"<p>Monsieur, Je voudrais envoyer un mail et ... plus de carnet d'adresse !? D ou ma colere et ma surprise, j espere que la nouvelle vertion de Thunderbird n a pas écrase mon carnet d adresse ! Ou le trouver ? et le mettre en lien la nouvelle vertion pour l utiliser comme avant ! si c'est possible ! Merci de votre boulot pour cette vertion mais prevenez que le carnet d adresse est ... !!!!!!!!!!!!!!!!!!! Cordialement David </p>",d.babarit;davidsk;,False,False,False,;useragent:Mozilla/5.0 (Windows NT 10.0; Win64; x64; rv:149.0) Gecko/20100101 Firefox/149.0;os:Windows 11,1,0,0,,,
1574820,2026-04-05 13:22:12 -0700,2026-04-07 14:44:41 -0700,nl,thunderbird,e-mail verkeer van en naar **privacy**@hccnet.nl geblokkeerd bij Thb en Firefox geblokkeerd,False,,,False,1810605.0,1810605;,send-and-receive-email,thunderbird;send-and-receive-email;,w.j.de.lange,"<p>kpnplanet en <a href=""http://gmail.com"" rel=""nofollow"">gmail.com</a> werken wel onderling, maar niet van en naar hccnet Berichten niet via hccnet doen </p>",w.j.de.lange;markh2;,False,False,False,;useragent:Mozilla/5.0 (X11; Linux x86_64; rv:149.0) Gecko/20100101 Firefox/149.0;os:Linux mint cinnamon,1,0,0,,,markh2
1574822,2026-04-05 13:41:56 -0700,2026-04-05 18:08:03 -0700,en-US,thunderbird,How do I add a outlook account.,True,1810303.0,davidsk,False,1810319.0,1810303;1810313;1810319;,account-management,linux;thunderbird;account-management;,ralkey,"<p>I have been trying to add my Outlook account for about 30 minutes now. Normally, I would use the beloved legacy account creator, but that doesn't exist anymore. </p><p>But no matter what I do, I can't log in to my account. And I am pretty damn sure I got my login correct since I managed to log in to the website and all other devices with it. </p><p>And the error message is also seriously amiguous. <em>I just need someone to help me through this..</em> </p>",ralkey;davidsk;,False,False,False,";useragent:Mozilla/5.0 (X11; Linux x86_64) AppleWebKit/537.36 (KHTML, like Gecko) Chrome/138.0.0.0 Safari/537.36;tb_version:149.0.1;os:Linux;solver_id:7534448",3,0,0,,,ralkey
1574837,2026-04-05 15:35:37 -0700,2026-04-06 15:18:02 -0700,en-US,thunderbird,Unable to delete message header in the Message List Header pane,True,1810464.0,Toad-Hall,False,1810479.0,1810309;1810448;1810464;1810479;,email-and-messaging,windows-11;thunderbird;email-and-messaging;,thewyzard,"<p>I have Thunderbird version 149.0.1 installed and set up to display the Classic View, showing the Folder pane, Message List Header pane, and the Message pane. I have two accounts - my email account and Local Folders. All my email is routed to the Local Folders for storage on the PC. I have a number of messages in the Local Folders Inbox, and the headers show in the Message List Header pane. This message header is marked as read, and as spam, but I can not do anything with it. I can not change the status (either to unread, or not span), nor can I delete it. The actual message appears to have been deleted - if I select the header, the Message pane is either blank, or displays the message previously selected. If I open the message a new tab, the contents are blank, and if I select View Message Source, that window is empty (blank). I have restarted Thunderbird several, once in Windows safe mode, and that header remains. I can read all the other messages in the Inbox, change their status, or delete them. The attached image shows the shows the message in question as selected.  </p><p>How do I delete that (@#$I*@%#@$%) message header? Thanks to anyone who can help! </p>",thewyzard;MattAuSupport;Toad-Hall;,False,False,False,";useragent:Mozilla/5.0 (Windows NT 10.0; Win64; x64) AppleWebKit/537.36 (KHTML, like Gecko) Chrome/146.0.0.0 Safari/537.36;tb_version:149.0.1;os:Windows 11;solver_id:7534628",4,0,0,,,
1574879,2026-04-05 19:12:11 -0700,2026-04-05 19:12:11 -0700,nl,thunderbird,geen post ophaal knop bij overzetten thunderbird op nieuwe laptop,False,,,False,,,send-and-receive-email,windows-11;thunderbird;send-and-receive-email;,magdigit,<p>Ik heb mijn Thunderbird met alle inhoud via Mozilla Backup kunnen overzetten op mijn nieuwe Lenovo laptop. Ik kan ook post versturen. Maar er zit bovenaan opeens geen knop meer voor 'post binnenhalen'. Hoe kan ik die weer tevoorschijn halen? </p>,magdigit;,False,False,False,;useragent:Mozilla/5.0 (Windows NT 10.0; Win64; x64; rv:149.0) Gecko/20100101 Firefox/149.0;os:Windows 11,0,0,0,,,
1574886,2026-04-05 20:05:58 -0700,2026-04-06 02:39:14 -0700,en-US,thunderbird,Cannot migrate Thunderbird from Win 11 to MAC,False,,,False,1810390.0,1810353;1810359;1810363;1810365;1810390;,import-and-export-settings,thunderbird;import-and-export-settings;,rtmick,"<p>Having tried more than a dozen sets of downloaded instructions, including those from Mozilla Thunderbird and Apple, I have become increasingly frustrated and convinced that Thunderbird doesn't work on a MAC.  Can you offer any ""official"" instructions?  Thank you! </p>",rtmick;mozilla98;MattAuSupport;,False,False,False,;useragent:Mozilla/5.0 (Macintosh; Intel Mac OS X 10.15; rv:149.0) Gecko/20100101 Firefox/149.0;tb_version:149.0.1;os:macOS Tahoe Version26.3.1 (a),5,0,0,,,
1574888,2026-04-05 20:34:43 -0700,2026-04-05 20:34:43 -0700,en-US,thunderbird,Search folder keeps disappearing,False,,,False,,,search,windows-1011;thunderbird;search;,ThunderbirdUser23987,<p>I have a search saved as a folder.  I use it on my Gmail many times a day and have for a long time.  But in the past week or two it has started disappearing.  I recreate it and it disappears again a few days later.  Any idea what I can do about this? </p><p>Win11 140.9.0esr-bb20 (64-bit) </p>,ThunderbirdUser23987;,False,False,False,;useragent:Mozilla/5.0 (Windows NT 10.0; Win64; x64; rv:140.0) Gecko/20100101 Firefox/140.0;tb_version:140.9.0esr-bb20;os:Windows 10/11,0,0,0,,,
1574889,2026-04-05 20:59:29 -0700,2026-04-05 21:45:18 -0700,en-US,thunderbird,Some emails from certain senders are not getting to me.,False,,,False,1810361.0,1810361;,send-and-receive-email,windows-11;thunderbird;send-and-receive-email;,cmorgan7760,"<p>I have had at least two service providers (travel agent and a pool service) that when they send me an email on my <a href=""http://comcast.net"" rel=""nofollow"">comcast.net</a> address they disappear.  They don't go to junk (I'm very careful about that and always check).  They will try again to resend and still... nothing.  The only work around I have found is to use my <a href=""http://gmail.com"" rel=""nofollow"">gmail.com</a> address and for some reason that seems to work.  Is there a Thunderbird setting that is blocking these emails?  Is it a Comcast issue?  Thanks for your help and at least thinking about the problem. </p>",cmorgan7760;rednoise;,False,False,False,;useragent:Mozilla/5.0 (Windows NT 10.0; Win64; x64; rv:149.0) Gecko/20100101 Firefox/149.0;os:Windows 11,1,0,0,,,
1574896,2026-04-05 21:36:16 -0700,2026-04-06 03:31:40 -0700,en-US,thunderbird,unable to connect to hotmail - error: account authorised but cannot connect,False,,,False,1810397.0,1810397;,send-and-receive-email,linux;thunderbird;send-and-receive-email;,markpotts6,<p>i today installed linux mint and managed to  get everything setup exect for 1 email account </p><p>i keep getting a message something like account authorised but cant connect but the other accounts that i setup are working fine </p><p>if anyone can help that would be great </p>,markpotts6;wsmwk;,False,False,False,;useragent:Mozilla/5.0 (X11; Linux x86_64; rv:149.0) Gecko/20100101 Firefox/149.0;os:Linux,1,1,1,,,wsmwk
1574900,2026-04-05 22:18:06 -0700,2026-04-06 02:52:04 -0700,en-US,thunderbird,Configuring Outlook email with Thunderbird,False,,,False,1810394.0,1810394;,email-and-messaging,windows-11;thunderbird;email-and-messaging;,pasteve99,"<p>I have followed all instructions I can find through many searches online but cannot get my outlook email to configure in Thunderbird. First, I have no option to chose OAuth2 even though I have deleted any outlook passwords, email accounts, and Thunderbird is up to date. I have received so many error messages I cant keep track. Bottom line, all my other email accounts configure find except for outlook. Any help would be appreciated Steven Pecoraro </p>",pasteve99;MattAuSupport;,False,False,False,";useragent:Mozilla/5.0 (Windows NT 10.0; Win64; x64) AppleWebKit/537.36 (KHTML, like Gecko) Chrome/146.0.0.0 Safari/537.36 Edg/146.0.0.0;tb_version:149.0 64 bit;os:Windows 11",1,0,0,,,
1574901,2026-04-05 22:38:42 -0700,2026-04-05 23:58:22 -0700,en-US,thunderbird,Reset TB Message Fields,False,,,False,1810366.0,1810366;,send-and-receive-email,thunderbird;send-and-receive-email;,ThunderbirdUserKen,"<p>For 4 days, I have been unable to send an email.  There is no ""send"" option.  Also, in past, when composing an EM, my complete address book as been available in a column on page left. Sorry to bother.  I have just grown too old (84) to search out answers  on my own.  Thank you!  Kenneth Fincher  <a href=""mailto:kfincher9999@att.net"" rel=""nofollow"">kfincher9999@att.net</a>, a long-time TB user and supporter. </p>",ThunderbirdUserKen;MattAuSupport;,False,False,False,";useragent:Mozilla/5.0 (Windows NT 10.0; Win64; x64) AppleWebKit/537.36 (KHTML, like Gecko) Chrome/146.0.0.0 Safari/537.36;tb_version:TB Ver 149.01 (64B;os:Windows 11 Pro",1,0,0,,,
1574907,2026-04-05 23:38:15 -0700,2026-04-05 23:38:15 -0700,en-US,thunderbird,Jonathan,False,,,True,,,email-and-messaging,thunderbird;email-and-messaging;,jonathanstar278,<p>Happy USA </p>,jonathanstar278;,False,False,False,;useragent:Mozilla/5.0 (Android 14; Mobile; rv:148.0) Gecko/148.0 Firefox/148.0;os:USA,0,0,0,,,
1574908,2026-04-05 23:39:23 -0700,2026-04-05 23:39:23 -0700,en-US,thunderbird,jonathanstar278@gmail.com,False,,,True,,,accessibility,thunderbird;accessibility;,jonathanstar278,<p>Happy </p>,jonathanstar278;,False,False,False,;useragent:Mozilla/5.0 (Android 14; Mobile; rv:148.0) Gecko/148.0 Firefox/148.0;tb_version:99224;os:USA,0,0,0,,,
1574914,2026-04-06 00:29:00 -0700,2026-04-06 03:06:42 -0700,en-US,thunderbird,All the emails has been deleted after I have emty the trash,False,,,False,1810396.0,1810393;1810396;,email-and-messaging,mac-os-x-1015;thunderbird;email-and-messaging;,alex.makhinko,"<p>Hello, </p><p>I had an issue with my Thundebrid 148.0 (aarch64) running on Mac OS Squoia. I am using it since 2012 and had no issies. But last week when I was trying to empty the trash in the app, it got deleted everything! I had my saved local folder intact. But all IMAP data was errased.  Luckily my hostng company were able to restore the back up, but I lost almost a day of emails. Please look into that issue and let me know. </p><p>Thank you  Alexey </p>",alex.makhinko;MattAuSupport;,False,False,False,;useragent:Mozilla/5.0 (Macintosh; Intel Mac OS X 10.15; rv:148.0) Gecko/20100101 Firefox/148.0;tb_version:148.0 (aarch64);os:Mac OS x 10.15,2,1,1,,,
1574929,2026-04-06 03:31:04 -0700,2026-04-06 03:31:04 -0700,en-US,thunderbird,Message Seperator Line,False,,,False,,,customization,windows-11;thunderbird;customization;,lsingh,"<p>Hi, </p><p>I am trying to edit my message separator line (which I added many years ago). Now there is a big gap in the line and messages. How can I reduce this gap please? Any advice? </p><p><br> </p><p>Regards, </p><p>LS </p>",lsingh;,False,False,False,;useragent:Mozilla/5.0 (Windows NT 10.0; Win64; x64; rv:149.0) Gecko/20100101 Firefox/149.0;tb_version:Latest version.;os:Windows 11,0,0,0,,,
1574939,2026-04-06 06:01:04 -0700,2026-04-06 10:36:25 -0700,en-US,thunderbird,Determining which emails have been synchronized?,False,,,False,1810445.0,1810445;,customization,thunderbird;customization;,shaddy,"<p>Is there a way to determine which emails, from a list view, have been synchronized/made available offline? </p><p>I always assumed there would be a column that flagged the ""offline availability"" in the Table view, but I could not find anything. </p><p>And I can confirm my implicit understanding, that headers can be listed in offline mode, but if the email itself hasn't been downloaded, you will see the following if you try to open the email: </p><p>"""""" Go Online to View This Message </p><p>The body of this message has not been downloaded from the server for reading offline.  ... """""" </p><p>But I have come across circumstances where the complete email is available offline. Would be good to be able to readily identify/determine which emails are and aren't. </p>",shaddy;davidsk;,False,False,False,;useragent:Mozilla/5.0 (Windows NT 10.0; Win64; x64; rv:140.0) Gecko/20100101 Firefox/140.0;tb_version:140.9esr,1,0,0,,,
1574943,2026-04-06 07:02:37 -0700,2026-04-06 07:02:37 -0700,en-US,thunderbird,I add second yahoo account but it shows e-mails of the first one,False,,,False,,,account-management,windows-10;thunderbird;account-management;,aleksey.tkachenko,<p>I just get the copy of the first yahoo account when I try to create second one </p><p>I insert another e-mail but Thunderbird even does not ask me for password. </p>,aleksey.tkachenko;,False,False,False,";useragent:Mozilla/5.0 (Windows NT 10.0; Win64; x64) AppleWebKit/537.36 (KHTML, like Gecko) Chrome/146.0.0.0 Safari/537.36;tb_version:140.2.0esr 64-bit;os:Windows 10",0,0,0,,,
