id,created,updated,locale,product,title,is_solved,solution,solved_by,is_spam,last_answer,answers,topic,tags,creator,content,involved,is_archived,is_locked,is_taken,metadata,num_answers,num_votes_past_week,num_votes,taken_until,taken_by,updated_by
1575143,2026-04-07 13:51:21 -0700,2026-04-07 19:06:48 -0700,en-US,thunderbird,French spell checking not loading,True,1810641.0,christ1,False,1810651.0,1810623;1810641;1810651;,languages,windows-11;thunderbird;languages;,stephenjefferson941,"<p>Hello, I am on the latest version of Thunderbird on a Windows 11 computer. Previously with a Windows 10 computer I had no problem spell checking e-mails in French. However with a new Windows 11 laptop the French dictionary although installed shows as not loaded on the dashboard and unsurprisingly does not function. I have restarted both Thunderbird and the laptop. No result. Any advice most welcome. </p><p>Best wishes, </p><p>Stephen Jefferson </p>",stephenjefferson941;Googlethunderbird.;christ1;,False,False,False,;solver_id:6890359;useragent:Mozilla/5.0 (Windows NT 10.0; Win64; x64; rv:149.0) Gecko/20100101 Firefox/149.0;tb_version:149.0.1;os:Windows 11,3,0,0,,,
1575161,2026-04-07 15:29:14 -0700,2026-04-08 07:08:06 -0700,en-US,thunderbird,l'agenda revenir à la présentation habituelle ?,True,1810633.0,sfhowes,False,1810730.0,1810631;1810633;1810730;,calendar,windows-11;thunderbird;calendar;,lionel.lechevalier,<p>l'agenda se présente avec les heures en horizontal et les jours en vertical comment revenir à la présentation habituelle ? </p>,lionel.lechevalier;ahmedreyd76;sfhowes;,False,False,False,;useragent:Mozilla/5.0 (Windows NT 10.0; Win64; x64; rv:149.0) Gecko/20100101 Firefox/149.0;tb_version:149.0.1 (64 bits);os:Windows 11;solver_id:4659291,3,0,0,,,
1575166,2026-04-07 16:11:42 -0700,2026-04-09 15:21:34 -0700,en-US,thunderbird,Thunderbird will load but immediately os 'Not Responding',False,,,False,1810961.0,1810682;1810684;1810689;1810932;1810944;1810950;1810954;1810957;1810961;,app-crash,windows-1011;thunderbird;app-crash;,Silverspur,"<p>Whilst using TB the screen went white with dozens of little tabs along the top of the screeen with what look like page icons, as the app became 'not responding'. Re-loading didn't help - same screen. Re-starting didn't help. I uninstalled and re-installed TB but it is stil the same. Opening in Windows (11) safe mode produced virtually the same result except for a few seconds I was able to open the hamburger menu and select trouble shooting.  Opened in trouble shooting mode showed several alerts of 'failed to connect with servers' (<a href=""http://outlook.office365.com"" rel=""nofollow"">outlook.office365.com</a>  <a href=""http://imap.gmail.com"" rel=""nofollow"">imap.gmail.com</a>  and Yahoo).  Then it shut down as before 'not responding'. When open, TB is using some 80% of available memory., and I can only close it by using Task Manager. I'm a complete dunce at this stuff so, if anyone knows a way out of this hole, please use simple English! Thanks,  Jeff </p>",Silverspur;Mapenzi;wsmwk;,False,False,False,;useragent:Mozilla/5.0 (Windows NT 10.0; Win64; x64; rv:149.0) Gecko/20100101 Firefox/149.0;os:Windows 10/11,9,0,0,,,
1575172,2026-04-07 16:50:39 -0700,2026-04-07 16:50:39 -0700,en-US,thunderbird,How do I finish installation,False,,,True,,,installation-and-updates,thunderbird;installation-and-updates;,nickbogledesign,<p>I am trying to finish the installation. </p>,nickbogledesign;,False,False,False,";useragent:Mozilla/5.0 (iPhone; CPU iPhone OS 26_3_1 like Mac OS X) AppleWebKit/605.1.15 (KHTML, like Gecko) GSA/414.0.890628820 Mobile/15E148 Safari/604.1",0,0,0,,,
1575176,2026-04-07 17:14:21 -0700,2026-04-07 17:51:09 -0700,en-US,thunderbird,Scammer has sent me an e-mail both from and to my e-mail address,False,,,False,1810642.0,1810642;,junk-mail-and-spam,windows-11;thunderbird;junk-mail-and-spam;,kirby.w.hansen,"<p>I'm pretty sure the scammer doesn't have my e-mail password. But how can they do this? The e-mail looked very real; it was from me and to me. The e-mail itself accused me of something, demanded a payment, and threatened to flood my e-mail with more scam messages if I didn't pay up. </p>",kirby.w.hansen;davidsk;,False,False,False,";useragent:Mozilla/5.0 (Windows NT 10.0; Win64; x64) AppleWebKit/537.36 (KHTML, like Gecko) Chrome/146.0.0.0 Safari/537.36;os:Windows 11",1,0,0,,,
1575184,2026-04-07 18:04:19 -0700,2026-04-07 20:22:13 -0700,en-US,thunderbird,Import of Messages from  another Thunderbird failed.  Where is the error defined?,False,,,False,1810664.0,1810664;,import-and-export-email,windows-11;thunderbird;import-and-export-email;,reking66,"<p>Import worked fine for address books, but the messages failed.  It says the error console might help.  WHERE IS THAT? </p>",reking66;davidsk;,False,False,False,";useragent:Mozilla/5.0 (Windows NT 10.0; Win64; x64) AppleWebKit/537.36 (KHTML, like Gecko) Chrome/145.0.0.0 Safari/537.36 Avast/145.0.34271.162;os:Windows 11;kb_visits_prior:[""/en-US/kb/profiles-where-thunderbird-stores-user-data""]",1,0,0,,,
1575186,2026-04-07 18:14:59 -0700,2026-04-07 21:06:18 -0700,en-US,thunderbird,"I no longer see the ""Options"" box or the Notifications Bar on my Incoming Messages for Remote content",True,1810668.0,Mapenzi,False,1810668.0,1810668;,customization,windows-1011;thunderbird;customization;,aclam,"<p>The Notifications Bar seems to be missing from the top of an email message that is being shown below the list of messages. So there is no ""Options"" box where it is usually shown, on the Notifications Bar, so that I can manage Remote Content in the message being shown. </p>",aclam;Mapenzi;,False,False,False,;useragent:Mozilla/5.0 (Windows NT 10.0; Win64; x64; rv:140.0) Gecko/20100101 Thunderbird/140.9.0;os:Windows 10/11;solver_id:7538053,1,0,0,,,
1575188,2026-04-07 18:20:45 -0700,2026-04-07 19:16:57 -0700,it,thunderbird,non riesco a capire se ho ricevuto una risposta dalle mie mail inviate. Non ce un tutorial che spiega dove cliccare?,False,,,False,1810653.0,1810653;,send-and-receive-email,thunderbird;send-and-receive-email;,info4226,<p><strong>testo in grassetto</strong> sto provando ad adoperare thunderbird per rispondere ai miei ospiti. non trovo un supporto che mi aiuti a capire come funziona thunderbird </p>,info4226;@next;,False,False,False,;useragent:Mozilla/5.0 (Macintosh; Intel Mac OS X 10.15; rv:149.0) Gecko/20100101 Firefox/149.0;tb_version:l ultima versione;os:Mac OS x 15.7.3,1,0,0,,,
1575191,2026-04-07 18:45:09 -0700,2026-04-07 22:01:18 -0700,en-US,thunderbird,HOW get back in email with yahoo,False,,,False,1810680.0,1810680;,email-and-messaging,windows-11;thunderbird;email-and-messaging;,sildar1,<p>I need to use thunderbird with yahoo keep my old email contacts </p>,sildar1;rednoise;,False,False,False,;useragent:Mozilla/5.0 (Windows NT 10.0; Win64; x64; rv:149.0) Gecko/20100101 Firefox/149.0;os:Windows 11,1,0,0,,,
1575199,2026-04-07 19:21:36 -0700,2026-04-08 11:29:17 -0700,es,thunderbird,Recuperar correos eliminados de papelera,False,,,False,1810764.0,1810714;1810764;,email-and-messaging,windows-10;thunderbird;email-and-messaging;,info13809,"<p>Buenas tardes: </p><p>De un momento a otro todos mis mensajes de Papelera se borraron (yo no los he borrado ni accidentalmente tampoco) (esto fue hoy, es decir aun no transcurrieron 24 hs) </p><p>Necesitaría restaurar todos los correos de la papelera, intente con un programa que creo que es oficial, se llama Recovery Tool for Mozilla Thunderbird, pero si bien me marcaba todos los mails ahí, es pago el programa por lo que no me permitió guardar/descargar. Es decir en algún lado de la PC están los mails. </p><p>Intente otra opción que dice con el notepad++ hay que modificar el texto X-Mozilla-Status: 0009 en el archivo MBOX, pero cuando abro en ningún lado esta esa linea/código. </p><p>(tampoco se movieron de carpeta, ya busque el resto de carpetas, Y en local folders tenia un backup pero es viejo tiene casi un año, de los correos que tenia en papelera nuevos no tengo nada) </p><p>No se que otra opción hay? si me pueden ayudar ya que realmente necesito todos los correos que desaparecieron porque son del trabajo. </p><p>Desde ya muchas gracias por el tiempo. Saludos. </p>",info13809;pcp04;,False,False,False,";useragent:Mozilla/5.0 (Windows NT 10.0; Win64; x64) AppleWebKit/537.36 (KHTML, like Gecko) Chrome/146.0.0.0 Safari/537.36;os:Windows 10",2,2,2,,,
1575214,2026-04-07 20:39:40 -0700,2026-04-07 21:16:34 -0700,en-US,thunderbird,"Trouble Sending EMs After TB update 03/27/26 No ""SEND"" field available",False,,,False,1810669.0,1810669;,send-and-receive-email,windows-11;thunderbird;send-and-receive-email;,ThunderbirdUserKen,"<p>ThunderbirdUserKen </p><p>Apr 7, 2026, 12:27 CST </p><p>After TB update V. 149.01 (64 en-US), I am unable to send an EM. No ""send"" field is in a field, even after composing a message. Is it possible to un-do this update, to check if it is indeed the source of this problem? Thank you very much! TB user: <a href=""mailto:kfincher9999@att.net"" rel=""nofollow"">kfincher9999@att.net</a> </p>",ThunderbirdUserKen;davidsk;,False,False,False,";useragent:Mozilla/5.0 (Windows NT 10.0; Win64; x64) AppleWebKit/537.36 (KHTML, like Gecko) Chrome/146.0.0.0 Safari/537.36;tb_version:149.01 X 64 en-US;os:Windows 11;kb_visits_prior:[""/en-US/kb/sending-and-receiving-messages-thunderbird""]",1,0,0,,,
1575215,2026-04-07 20:46:25 -0700,2026-04-07 21:44:37 -0700,en-US,thunderbird,"having trouble sending out email using yahoo.com, had to leave xfinity and using comcast.net is now supported by yahoo.com",False,,,False,1810674.0,1810674;,send-and-receive-email,linux;thunderbird;send-and-receive-email;,formula9,"<p>need help connecting to <a href=""http://yahoo.com"" rel=""nofollow"">yahoo.com</a> from my xfinity <a href=""http://Comcast.net"" rel=""nofollow"">Comcast.net</a> environment </p>",formula9;rednoise;,False,False,False,;useragent:Mozilla/5.0 (X11; Linux x86_64; rv:149.0) Gecko/20100101 Firefox/149.0;tb_version:thunderbird;os:Linux,1,0,0,,,
1575218,2026-04-07 21:15:39 -0700,2026-04-08 13:31:10 -0700,en-US,thunderbird,How do I get rid of a bar displaying previous emails?,True,1810673.0,rednoise,False,1810770.0,1810673;1810770;,customization,windows-11;thunderbird;customization;,hfarring,<p>Using the desktop version I have a bar just above the Inbox which shows 9 messages. How can I toggle this ribbon off so it doesn't show messages that I have read or put into folders. See bar that is highlighted in image #2. </p>,hfarring;rednoise;,False,False,False,";solver_id:181052;useragent:Mozilla/5.0 (Windows NT 10.0; Win64; x64) AppleWebKit/537.36 (KHTML, like Gecko) Chrome/146.0.0.0 Safari/537.36;os:Windows 11;kb_visits_prior:[""/en-US/kb/getting-started-thunderbird"", ""/en-US/kb/how-change-thunderbird-layout""]",2,0,0,,,
1575221,2026-04-07 21:40:03 -0700,2026-04-09 05:30:54 -0700,hu,thunderbird,"Hol találom az e-mail címhez tartozó jelszót, mert elfelejtettem",False,,,False,1810884.0,1810747;1810884;,reset-passwords,windows-11;thunderbird;reset-passwords;,sipitibi147,<p>Where can I find the password for my email address because I forgot it? </p>,sipitibi147;meskobalazs;,False,False,False,;useragent:Mozilla/5.0 (Windows NT 10.0; Win64; x64; rv:149.0) Gecko/20100101 Firefox/149.0;tb_version:149.0.1;os:Windows 11,2,0,0,,,
1575227,2026-04-07 22:05:47 -0700,2026-04-09 23:54:46 -0700,en-US,thunderbird,A regular correspondent's email is ALWAYS placed in SPAM no matter how many times I say it isn't spam,True,1810993.0,Mapenzi,False,1811026.0,1810740;1810973;1810993;1810999;1811000;1811006;1811011;1811014;1811020;1811026;,junk-mail-and-spam,windows-11;thunderbird;junk-mail-and-spam;,slbrown3,<p>I need to know how to tell Thunderbird that the email is NOT SPAM.  I have tried everything suggested and nothing works. </p>,slbrown3;harry.green;Mapenzi;,False,False,False,;solver_id:6961221;useragent:Mozilla/5.0 (Windows NT 10.0; Win64; x64; rv:149.0) Gecko/20100101 Firefox/149.0;os:Windows 11,10,0,0,,,
1575230,2026-04-07 22:14:39 -0700,2026-04-08 02:35:49 -0700,en-US,thunderbird,how do i sign into my email account,False,,,False,1810706.0,1810706;,passwords-and-sign-in,windows-11;thunderbird;passwords-and-sign-in;,blaufrank174,<p>how doi sign into my email account </p>,blaufrank174;wxie2016;,False,False,False,;useragent:Mozilla/5.0 (Windows NT 10.0; Win64; x64; rv:149.0) Gecko/20100101 Firefox/149.0;os:Windows 11,1,0,0,,,
1575236,2026-04-07 22:41:45 -0700,2026-04-08 03:00:58 -0700,en-US,thunderbird,Unable to re-install gmail account in thunderbird. Error 400 malformed server.,True,1810708.0,rednoise,False,1810708.0,1810708;,connectivity,windows-11;thunderbird;connectivity;,CRMORINICO,"<p>Unable to re-install gmail account in Thunderbird. Error 400 malformed server. </p><p>Two gmail accounts could not access the server. deleted one and tried to re install it without success.The accounts and passwords were not in the ""saved passwords"" in settings. The accounts and passwords for comcast are there and those accounts work fine. </p>",CRMORINICO;rednoise;,False,False,False,;solver_id:3108098;useragent:Mozilla/5.0 (Windows NT 10.0; Win64; x64; rv:149.0) Gecko/20100101 Firefox/149.0;tb_version:140.9.1esr (64-bit;os:Windows 11,1,0,0,,,
1575240,2026-04-07 23:12:07 -0700,2026-04-07 23:12:07 -0700,en-US,thunderbird,"No longer see ALL messages, including spam after upgrade to TB 128.14 Oesr (64, Win 10)",False,,,False,,,junk-mail-and-spam,windows-10;thunderbird;junk-mail-and-spam;,druw,"<p>I recently upgraded to TB 128.14 Oesr (64, Win 10). I’m a bit conservative about upgrading anything – as upgrades often waste a lot of time – if not risk justified.   </p><p>Basically, If it’s workin’ well enough (cost vs benefit) …… well … “don’t fix it” – even though … “if it ain’t broke, doesn’t mean it isn’t sub-optimal”. Here, it seemed worth the risk.  </p><p>My prior TB version – nope, I don’t remember which it was (is that in a log?) incorrectly identified bookoo normal e-messages as “junk” (junk filter deactivated) wasting a LOT of  my time to move them back to the “indox”.  </p><p>It also – CORRECTLY ID’ed – a big lot of data sucking spam as “junk” (junk filter still deactivated) for my PUBLIC e-address (expected spam magnet) – alerting me of the quantity of (expected) spam I was actually getting (my free Omaha steaks are on the way).  </p><p>After upgrading (to TB 128.14) I don’t get any, well much of that spam any more (got a couple today) – hurrah (maybe)!! I don’t see it any more. It is gone completely (mostly, ostensibly) and the problem is – I do want to SEE it – all of it – in a “spam folder / directory” nd not in trash–  wherever it is – to make sure it is NOT mis-ID’ed as spam – when actually an important message maybe telling me I’ve won the FIFA email prize!  </p><p>So … “the game is a’foot! Holmes! How can I track down that missing spam – to see ALL of it – to verify it’s identity? </p><p>I suspect my hosting company – Hostinger – may be involved – as I did verify, previously, with my previous TB version – that they COULD see into my TB account structure. Can’t find it now, but previous did see MY TB account named “Aviation”. They, Hostinger, said THEY aren’t “moving” anything anywhere – not into  “Junk”, anyway. Are they lying (as popular as that has become recently)? </p><p>I’m not smart enough to understand DKIM (though I could get that way) just want to see ALL email sent to ALL my e-addresses that didn’t get there – wherever it is (not immediately, I would hope)! </p><p>Merci, </p><p>Dru </p>",druw;,False,False,False,;useragent:Mozilla/5.0 (Windows NT 10.0; Win64; x64; rv:149.0) Gecko/20100101 Firefox/149.0;tb_version:128.14 Oesr (64);os:Windows 10,0,0,0,,,
1575273,2026-04-08 06:08:55 -0700,2026-04-08 08:47:02 -0700,en-US,thunderbird,"""esp"" becomes ""Esp"" -- why?",False,,,False,1810745.0,1810732;1810733;1810741;1810742;1810745;,customization,thunderbird;customization;,Barubiito,"<p>In both Firefox and Thunderbird, if I type ""esp"", it changes to ""Esp"". Likewise, ""especially"" -- in the middle of a sentence! -- becomes ""Especially"". How can I turn this off? </p>",Barubiito;harry.green;,False,False,False,;useragent:Mozilla/5.0 (Macintosh; Intel Mac OS X 10.15; rv:149.0) Gecko/20100101 Firefox/149.0;tb_version:140.9.0esr;os:Mac OS x 26.4,5,0,0,,,
1575279,2026-04-08 07:26:28 -0700,2026-04-08 09:42:55 -0700,en-US,thunderbird,userchrome for Thunderbird 149 today panel in monthly calendar,False,,,False,1810750.0,1810750;,customization,windows-11;thunderbird;customization;,harry.green,"<p>Using <a href=""https://support.mozilla.org/en-US/questions/1544905"" rel=""nofollow"">https://support.mozilla.org/en-US/questions/1544905</a> as an example I placed this in my profile's userchrome.css and restarted thunderbird: </p><p>.calendar-month-day-box-current-month[relation=""today""] { </p><pre>   border: 10px solid red; </pre> <p>} </p><p>It seems not to be working in thunderbird 148.0.1 (64-bit on windows 11). </p><p>So I found the today panel in the debugger and added <strong>border: 10px solid red;</strong> to its element. That worked perfectly, as the attached image confirms. It also confirms the class is correct and that it contains the today relation. </p><p>I can't see the userchrome.css file in the debugger, which seems strange. But I edited the body colour in userchrome.css and that worked, so I know the file is being used. So why is the change to the today panel being ignored? </p><p>To confirm that I had the correct userchrom </p>",harry.green;Mapenzi;,False,False,False,;useragent:Mozilla/5.0 (Windows NT 10.0; Win64; x64; rv:149.0) Gecko/20100101 Firefox/149.0;tb_version:148.0.1;os:Windows 11,1,0,0,,,
1575283,2026-04-08 07:48:08 -0700,2026-04-08 09:03:00 -0700,en-US,thunderbird,I dont have a reply button on my email address for sunshinetrio,False,,,False,1810746.0,1810746;,send-and-receive-email,windows-10;thunderbird;send-and-receive-email;,sunshine3trio,<p>'I dont have a reply button on my email address for sunshinetrio <em></em> </p>,sunshine3trio;harry.green;,False,False,False,";useragent:Mozilla/5.0 (Windows NT 10.0; Win64; x64) AppleWebKit/537.36 (KHTML, like Gecko) Chrome/146.0.0.0 Safari/537.36 Edg/146.0.0.0;os:Windows 10",1,0,0,,,
1575284,2026-04-08 07:49:33 -0700,2026-04-09 09:38:08 -0700,en-US,thunderbird,How do I back-up the online folders (IMAP),False,,,False,1810912.0,1810761;1810762;1810887;1810912;,import-and-export-email,ubuntu;thunderbird;import-and-export-email;,prld,"<p>I want to make a local back-up not only of my local Thunderbird folders, but also on the on-line folders. I am using IMAP and as far as I get, using the ""export options"", you only  back-up data in the local folder. How do I ensure that I get a local copy of also the on-line inbox (and all of its sub folders) </p>",prld;Toad-Hall;,False,False,False,;useragent:Mozilla/5.0 (X11; Ubuntu; Linux x86_64; rv:148.0) Gecko/20100101 Firefox/148.0;os:Ubuntu,4,0,0,,,
1575286,2026-04-08 07:52:10 -0700,2026-04-08 07:52:10 -0700,en-US,thunderbird,Downloads old messages,False,,,False,,,connectivity,windows-11;thunderbird;connectivity;,tommy2k14,"<p>Yesterday, downloading emails got stuck because it couldn't download an email. I tried this multiple times and then it said it couldn't connect to my email server. I tried Repairing the individuals folders but the problem persisted. I looked the problem up, and one of the recommendations was to uninstall Thunderbird, the profile folder, and install it again. When I launched it again, it told me it couldn't find a profile, so I went to the app data folder and restored the folder containing my emails etc. I reconnected it to my Yahoo Mail server. I started TB this morning, and it does the same thing. It tries to download 205 emails, when I know I haven't got that many from yesterday. It still gets stuck on email 21, so I close it, open it, close it, open it, in which it checks again, and I go round and round in circles. It is now telling me that it has failed to connect to the Yahoo server. Checking mail through the Yahoo site works fine. I am using TB 149.0.1 on Wiindows 11. </p>",tommy2k14;,False,False,False,;useragent:Mozilla/5.0 (Windows NT 10.0; Win64; x64; rv:149.0) Gecko/20100101 Firefox/149.0;tb_version:149.0.1;os:Windows 11,0,0,0,,,
1575290,2026-04-08 08:02:49 -0700,2026-04-08 08:02:49 -0700,en-US,thunderbird,Why does thunderbird sometimmes not continue after I enter email address and subject.,False,,,False,,,app-crash,windows-10;thunderbird;app-crash;,annesweetman49,"<p>I sometimes find that after I have filled in the email address and subject of the email and sometimes start writing the email, it goes back to the original page and I have to start again. </p>",annesweetman49;,False,False,False,;useragent:Mozilla/5.0 (Windows NT 10.0; Win64; x64; rv:149.0) Gecko/20100101 Firefox/149.0;os:Windows 10,0,0,0,,,
1575292,2026-04-08 08:15:56 -0700,2026-04-09 08:15:27 -0700,en-US,thunderbird,Messages could not be written to the mailbox file.,True,1810904.0,mary.siggi.guhl,False,1810904.0,1810904;,send-and-receive-email,windows-1011;thunderbird;send-and-receive-email;,mary.siggi.guhl,<p>see images </p>,mary.siggi.guhl;,False,False,False,;useragent:Mozilla/5.0 (Windows NT 10.0; Win64; x64; rv:149.0) Gecko/20100101 Firefox/149.0;tb_version:149.0.2 (32-Bit;os:Windows 10/11;solver_id:5798131,1,0,0,,,
1575293,2026-04-08 08:28:04 -0700,2026-04-08 13:39:22 -0700,it,thunderbird,quando inserisco un evento in calendario (google) di durata più giorni es. dal 13 al 17  non conferma il 17 ma riporta in automatico il giorno di data inizio 13 ho provato a disconnettere il calendario e reinstallarlo ma il bug persiste,False,,,False,1810771.0,1810771;,events,windows-11;thunderbird;events;,tobiaecurt,"<p>Inserimento date nuovo evento, non è possibile selezionare più giorni dopo aver inserito data inizio, al momento di inserire data fine riporta in automatico la data fine uguale a quella di inizio. </p><p>Grazie per l'assistenza Claudio </p><p><br> </p><p>Allego screenshot </p>",tobiaecurt;@next;,False,False,False,";useragent:Mozilla/5.0 (Windows NT 10.0; Win64; x64) AppleWebKit/537.36 (KHTML, like Gecko) Chrome/146.0.0.0 Safari/537.36;tb_version:149.0.2;os:Windows 11",1,0,0,,,
1575306,2026-04-08 10:29:16 -0700,2026-04-08 10:29:16 -0700,en-US,thunderbird,Duplicated emails in unified folder,False,,,False,,,email-and-messaging,windows-11;thunderbird;email-and-messaging;,OrbitPost,"<p>New emails to some accounts appear as duplicates in the unified folder.  I suspected it may be connected to the fact I use ""All Mail"" as the archive folder for a Gmail account, but now the problem is happening with a Proton account as well. When I restart Thunderbird, or deactivate and reactivate the Unified folders view, they no longer appear as duplicates. </p><p>I am using Thunderbird 149.0.2 on Windows 11. The issue started a few weeks ago. Any help would be much appreciated! </p>",OrbitPost;,False,False,False,;useragent:Mozilla/5.0 (Windows NT 10.0; Win64; x64; rv:149.0) Gecko/20100101 Firefox/149.0;tb_version:149.0.2;os:Windows 11,0,1,1,,,
1575311,2026-04-08 11:59:13 -0700,2026-04-10 10:34:51 -0700,en-US,thunderbird,I have a costumer in my store that has random emails saved on his desktop.,False,,,False,1811066.0,1810826;1811054;1811066;,install,windows-11;thunderbird;install;,danielmu,"<p>I have a costumer in my store that uses Thunderbird, it has worked fine for him for years without any issues. </p><p>But now for some reason random emails get saved to his desktop, and has no idea why that is happening. </p><p>I have checked settings to make sure it doesnt save anything to the desktop, the folder is set to save inside appdata/roaming </p><p>We have tried updating the program with no luck so far, just updated it again today. Costumer is nervous towards deleting the program and setting up his email again, I have told him that his emails and folders wont be effected. But still doesnt want us to do it. </p><p>So unless you can give confirmation that nothing will happen to his files and folders he wont let us reinstall the program. </p><p>Can you let us know if its a known bug or better yet, give us a solution, we would both be very grateful. </p><p><br> Kind regards </p>",danielmu;davidsk;Mapenzi;,False,False,False,";useragent:Mozilla/5.0 (Windows NT 10.0; Win64; x64) AppleWebKit/537.36 (KHTML, like Gecko) Chrome/146.0.0.0 Safari/537.36 Edg/146.0.0.0;tb_version:149.0.2 (32bit);os:Windows 11",3,0,0,,,
1575317,2026-04-08 12:32:59 -0700,2026-04-09 10:51:05 -0700,en-US,thunderbird,THUNDERBIRD: I CANNOT RECEIVE MESSAGES FRON POP AFTER CHANGES.,True,1810877.0,iizkjp2,False,1810929.0,1810811;1810877;1810929;,account-management,windows-11;thunderbird;account-management;,iizkjp2,<p>FROM POP TO IMAP CHANGED AFTER I CANNOT RECEIVE MASSAGES. The sent mail folders in the webmail and Thunderbird are synchronized. Account password is correct. My iphone is received mail messages. </p>,iizkjp2;davidsk;,False,False,False,";useragent:Mozilla/5.0 (Windows NT 10.0; Win64; x64) AppleWebKit/537.36 (KHTML, like Gecko) Chrome/146.0.0.0 Safari/537.36;tb_version:40.9.0esr 64bit;os:Windows 11;solver_id:7538142",3,0,0,,,
