id,created,updated,locale,product,title,is_solved,solution,solved_by,is_spam,last_answer,answers,topic,tags,creator,content,involved,is_archived,is_locked,is_taken,metadata,num_answers,num_votes_past_week,num_votes,taken_until,taken_by,updated_by
1573881,2026-03-31 17:30:43 -0700,2026-04-03 07:33:13 -0700,en-US,thunderbird,cannot receive E Mailes,False,,,False,1809791.0,1809246;1809791;,send-and-receive-email,windows-10;thunderbird;send-and-receive-email;,sedlockdavid9,<p>cannot get E Mails </p>,sedlockdavid9;christ1;wsmwk;,False,False,False,";useragent:Mozilla/5.0 (Windows NT 10.0; Win64; x64) AppleWebKit/537.36 (KHTML, like Gecko) Chrome/146.0.0.0 Safari/537.36 Edg/146.0.0.0;os:Windows 10",2,0,0,,,
1573882,2026-03-31 17:33:04 -0700,2026-03-31 17:33:04 -0700,en-US,thunderbird,cannot get EMails,False,,,True,,,email-and-messaging,windows-10;thunderbird;email-and-messaging;,sedlockdavid9,<p>cannot get E mails </p>,sedlockdavid9;,False,True,False,";useragent:Mozilla/5.0 (Windows NT 10.0; Win64; x64) AppleWebKit/537.36 (KHTML, like Gecko) Chrome/146.0.0.0 Safari/537.36 Edg/146.0.0.0;os:Windows 10",0,0,0,,,
1573887,2026-03-31 17:58:22 -0700,2026-03-31 17:58:22 -0700,en-US,thunderbird,Subscriptions,False,,,False,,,accounts,windows-11;thunderbird;accounts;,vealch,"<p>Got a message that my VPN auto pay failed (I just got a new card since my old card was compromised). Went into my account and changed the credit card. I also have Thunderbird, so I wanted to change that auto pay, but it's not viewable in my account. Do I have to wait until my next auto pay for Thunderbird fails to get a notice with a link to fix it? </p>",vealch;,False,False,False,;useragent:Mozilla/5.0 (Windows NT 10.0; Win64; x64; rv:149.0) Gecko/20100101 Firefox/149.0;os:Windows 11,0,0,0,,,
1573894,2026-03-31 18:35:23 -0700,2026-04-06 18:45:18 -0700,en-US,thunderbird,"General Thunderbird help, including the background developer toolbox, also appeared as ips",False,,,False,1810507.0,1809266;1809269;1809354;1810507;,security,windows-1011;thunderbird;security;,aaaaa,"<p>Thank you for your help and answer. I hope I can continue writing to you in German as well? </p><p>I can't find a contact person and the name of my Mozilla account has been changed; is that normal? </p><p>Thunderbird Portable Help </p><p>Question: A number appeared after my email address, so ""email"" and ""1954"". Who is that? Is that normal? </p><p>Question: Thunderbird Developer Toolbox: Can you see in the program? Can you see my emails? </p><p>Question: Are there any Thunderbird users left who speak German? </p><p>Questions: Thunderbird Portable The archive option isn't updating? How long does the backup take? </p><p>Different Thunderbird versions display a programmed year date in the archive option. For example, 2021 in one version and 2024 in another. Is that normal? I can't change anything. </p><p>It's as if it's accessing some kind of backup and maybe even sharing it, and I don't know what's correct. </p><p>Question: Update Channel Ellipse Update Channel esr. Previously, there were different channels. Isn't another channel better? I've read that it's more stable than switching. Is that true? Information regarding the question below? </p><p>140.9.0esr (64-bit) Thunderbird is up to date. </p><p>You are currently on the esr update channel. I'm experiencing stability issues with this one. </p><p>Thunderbird, Portable Edition portableapps - 1.0 Thunderbird is up to date. You are currently on the release update channel. New Download </p><p>General Information In Thunderbird Portable, there is a help page: </p><p><a href=""https://support.mozilla.org/de/products/thunderbird"" rel=""nofollow"">https://support.mozilla.org/de/products/thunderbird</a> </p><p>Please reply and thank you very much for your help. </p>",aaaaa;davidsk;wsmwk;,False,False,False,;useragent:Mozilla/5.0 (Windows NT 10.0; Win64; x64; rv:149.0) Gecko/20100101 Firefox/149.0;tb_version:140.9.0esr (64-Bit;os:Windows 10/11,4,0,1,,,
1573897,2026-03-31 18:53:09 -0700,2026-04-09 14:27:11 -0700,en-US,thunderbird,scan local folders when starting up,True,1810124.0,mozilla98,False,1810951.0,1809611;1809616;1809778;1809834;1809915;1809945;1809948;1809954;1809960;1810030;1810053;1810121;1810124;1810951;,customization,linux;thunderbird;customization;,rdmyers.42,"<p>had the need to start a fresh thunderbird profile. </p><p>now I forget which setting(s) allow for thunderbird to scan the local folders, NOT the internet, for new mail. </p><p>any suggestions? </p><p>thank you </p>",rdmyers.42;davidsk;MattAuSupport;mozilla98;,False,False,False,;useragent:Mozilla/5.0 (X11; Linux x86_64; rv:147.0) Gecko/20100101 Firefox/147.0;tb_version:148.0 (amd64);os:Linux;solver_id:7522176,14,0,0,,,
1573898,2026-03-31 19:00:43 -0700,2026-04-06 18:46:26 -0700,en-US,thunderbird,"I can't find a contact person, and the Mozilla account name has been changed. Is that normal? (locked duplicate)",False,,,False,1809268.0,1809268;,update,windows-1011;thunderbird;update;,aaaaa,"<p>I can't find a contact person, and the Mozilla account name has been changed. Is that normal? </p><p>Thank you for your help and answers. I hope I can continue writing to you in German as well? </p><p>Thunderbird Portable Help </p><p>Question: There was a number after my email address, like ""Email"" and ""1954."" Who is that? Is that normal? </p><p>Question: Thunderbird Developer Toolbox: Can you see my emails in the program? </p><p>Question: Are there any German-speaking Thunderbird users left? </p><p>Questions: Thunderbird Portable The archive option isn't updating? How long does the backup take? </p><p>Different Thunderbird versions display a programmed year date in the archive option. For example, 2021 in one program and 2024 in another. Is that normal? I can't change anything. </p><p>It's as if it's accessing some kind of backup and maybe even sharing it, and I don't know what's correct. </p><p>Question: </p><p>Update Channel Ellipse Update Channel esr. Previously, there were different channels. Isn't another channel better? I've read that it's more stable than switching. Is that true? Information regarding the question below? </p><p>140.9.0esr (64-bit) Thunderbird is up to date. </p><p>You are currently on the esr update channel. I'm experiencing stability issues with this one. </p><p>Thunderbird, Portable Edition portableapps - 1.0 Thunderbird is up to date. You are currently on the release update channel. New Download </p><p>General Information In Thunderbird Portable, there is a help page: </p><p><a href=""https://support.mozilla.org/de/products/thunderbird"" rel=""nofollow"">https://support.mozilla.org/de/products/thunderbird</a> </p><p>Please reply and thank you very much for your help. </p>",aaaaa;davidsk;,False,True,False,;useragent:Mozilla/5.0 (Windows NT 10.0; Win64; x64; rv:149.0) Gecko/20100101 Firefox/149.0;tb_version:140.9.0esr (64-Bit;os:Windows 10/11,1,0,0,,,wsmwk
1573905,2026-03-31 19:31:00 -0700,2026-04-07 00:52:56 -0700,en-US,thunderbird,Add User Agent with correct platform information,False,,,False,1810553.0,1809267;1810311;1810526;1810553;,customization,linux;thunderbird;customization;,egger.roland,"<p>Hello, </p><p>I am using Thunderbird on my arm64 Linux machines (Raspberry Pi 4 and 5 and my Odroid  C2) and I want Thunderbird to send the correct platform information in the User-Agent line. After enabling Thunderbird to sent the full User-Agent line the following information is currently sent: </p><p>User agent:Mozilla/5.0 (X11; Linux x86_64; rv:140.0) Gecko/20100101 Firefox/140.0 Thunderbird/140.9.0 </p><p>Everything is correct except for  'x86_64'. I would like to have sent the actual  'arm64' information because I'm proud using my small ARM64 machines as workstations and as a replacement for classic PCs and I do want to have this information distributed with every mail I am sending with Thunderbird.  </p><p>Is there an easy way to get the correct information about my arm64 machines into the User agent line? </p><p>I am happy for any advice and help. </p><p>Kind regards, </p><pre>     Roland </pre>",egger.roland;rednoise;,False,False,False,";useragent:Mozilla/5.0 (X11; Linux x86_64) AppleWebKit/537.36 (KHTML, like Gecko) Chrome/146.0.0.0 Safari/537.36;tb_version:140.9.0;os:Linux",4,0,0,,,
1573910,2026-03-31 19:41:16 -0700,2026-03-31 19:41:16 -0700,en-US,thunderbird,login to serverconnection failed,False,,,False,,,email-and-messaging,windows-1011;thunderbird;email-and-messaging;,pgenbuy,<p>'<em><strong>bold text'</strong></em> </p>,pgenbuy;,False,False,False,;useragent:Mozilla/5.0 (Windows NT 10.0; Win64; x64; rv:149.0) Gecko/20100101 Firefox/149.0;os:Windows 10/11,0,1,1,,,
1573912,2026-03-31 20:08:15 -0700,2026-03-31 20:08:15 -0700,en-US,thunderbird,Thunderbird cant get email that it could get two days ago,False,,,False,,,send-and-receive-email,windows-11;thunderbird;send-and-receive-email;,SHAWN.FOURG,"<p>Two days ago my Thunderbird was working perfectly.  Since then, something happened and I have no idea what it could have been. </p><p>When I go to the CenturyLink ISP website, I can get my email.  When Thunderbird worked two days ago, it could get my messages from 4 different email accounts at <a href=""http://centurylink.net"" rel=""nofollow"">centurylink.net</a> with Thunderbird. </p><p>Now, when I attempt to connect it says ""Login to server <a href=""http://pop.centurylink.net"" rel=""nofollow"">pop.centurylink.net</a> with username <a href=""mailto:khalmeigh@centurylink.net"" rel=""nofollow"">khalmeigh@centurylink.net</a> failed.""  It offers the option to enter a password, which I tried repeatedly.  Same thing.  No ability to retrieve email, and again, nothing changed.  </p><p>If I go to <a href=""http://centurylink.net"" rel=""nofollow"">centurylink.net</a>, I can retrieve my email.  There is no problem with the email address, nor is there a problem with the password, or the host.  </p><p>I've been using this program for a year and it suddenly stopped working.  There is nothing wrong with <a href=""http://centurylink.net"" rel=""nofollow"">centurylink.net</a>. </p>",SHAWN.FOURG;,False,False,False,";useragent:Mozilla/5.0 (Windows NT 10.0; Win64; x64) AppleWebKit/537.36 (KHTML, like Gecko) Chrome/146.0.0.0 Safari/537.36;os:Windows 11",0,0,1,,,
1573913,2026-03-31 20:17:16 -0700,2026-03-31 20:17:16 -0700,en-US,thunderbird,"Calendar will not print out date information, just prints blank calendar",False,,,False,,,calendar,windows-11;thunderbird;calendar;,wthwolf1,"<p>I am trying to print out the April 2026 calendar with all my scheduled information. It only prints out a blank calendar with the days marked, but no information, </p>",wthwolf1;,False,False,False,";useragent:Mozilla/5.0 (Windows NT 10.0; Win64; x64) AppleWebKit/537.36 (KHTML, like Gecko) Chrome/146.0.0.0 Safari/537.36 Edg/146.0.0.0;os:Windows 11",0,0,0,,,
1573914,2026-03-31 20:31:47 -0700,2026-04-02 05:23:09 -0700,cs,thunderbird,Nejde mi přesunout data na nový počítač,True,1809400.0,Ansamb,False,1809534.0,1809400;1809534;,import-and-export-settings,windows-11;thunderbird;import-and-export-settings;,roman.nosek,"<p>Dobrý den, nedaří se mi přesunout data na nový počítač. Podle návodu na <a href=""https://support.mozilla.org/cs/kb/presunuti-dat-thunderbirdu-na-novy-pocitac"" rel=""nofollow"">https://support.mozilla.org/cs/kb/presunuti-dat-thunderbirdu-na-novy-pocitac</a> jsem postupně přesunul všechny složky se soubory, ale po spuštění Thunderbirdu na novém počítači se mi pokaždé spustí jen dialog pro zadání nastavení nového profilu. Bohužel na starém počítači mám starší verzi Thunderbird. Když dám aktualizovat, nainstalovala se mi verze 115.10.1, ale na novém počítači je nainstalovaná verze 149.0.1 (stažená nová verze). Thunderbird mi nejdříve psal, že je aktuální verze, zkusil jsem nainstalovat novou verzi (149.0.1) do jiného adresáře. Pokud spustím program z tohoto adresáře, chová se stejně jako v novém počítači (nepřevzal nastavení z původního programu). Původní program jde spustit s původními daty, ale píše, že ""Kontrola aktualizace se nezdařila"". </p><p>Jak mohu postupovat, abych zachoval svá data? Bohužel odkaz na import nastavení (<a href=""https://support.mozilla.org/cs/kb/import-nastaveni-a-dat-do-thunderbirdu"" rel=""nofollow"">https://support.mozilla.org/cs/kb/import-nastaveni-a-dat-do-thunderbirdu</a>) již nefunguje. Předem děkuji za odpověď. </p>",roman.nosek;Ansamb;,False,False,False,";useragent:Mozilla/5.0 (Windows NT 10.0; Win64; x64) AppleWebKit/537.36 (KHTML, like Gecko) Chrome/146.0.0.0 Safari/537.36 Edg/146.0.0.0;tb_version:149.0.1 a 115.10.1;os:Windows 11;kb_visits_prior:[""/cs/kb/presunuti-dat-thunderbirdu-na-novy-pocitac"", ""/cs/kb/profily-thunderbirdu""];solver_id:7522300",2,0,0,,,
1573923,2026-03-31 21:27:51 -0700,2026-04-05 03:30:52 -0700,en-US,thunderbird,I need real HELP connecting gmx to Thunderbird or any other email client,False,,,False,1809736.0,1809340;1809493;1809494;1809653;1809670;1809685;1809687;1809736;,installation-and-updates,windows-10;thunderbird;installation-and-updates;,rdoty1,"<p>1)  Firstly, I posted earlier because I needed to add a second app-specific password to my account.  What I discovered was that my Account Settings tab had disappeared.  I got a response from someone that I had to change my email password, and it would reappear.  IT DIDN'T.  So I've changed my password and I still have no access to my Account Settings!  What do I do?  I really don't understand why, if I could log in with my old password, what the point is to change the password to correct the Account Settings problem.  I need HELP! </p><p>2)  I need HELP getting either Thunderbird (my normal email client) connected or change to a new email client that will actually work.  The problem is that Thunderbird for some reason can't connect even with an app-specific password!  I have been struggling with this for more than two days and there is NO HELP from GMX that solves the problem.  And it's not just GMX, there's no help from Thunderbird.  My sole source of help has been to post queries on the internet and follow what AI tells me which has been only part right.  At least it's something.  But now I can't even change my account settings!!!! </p><p>Can somebody PLEASE help me? [edited email from community support forum] </p>",rdoty1;rednoise;,False,False,False,";useragent:Mozilla/5.0 (Windows NT 10.0; Win64; x64) AppleWebKit/537.36 (KHTML, like Gecko) Chrome/146.0.0.0 Safari/537.36;os:Windows 10",8,0,2,,,wsmwk
1573938,2026-03-31 23:49:05 -0700,2026-04-01 03:51:34 -0700,en-US,thunderbird,"Can I return to using Thunderbird after having to change my email account to ""gmail.com""?",True,1809324.0,rednoise,False,1809324.0,1809324;,send-and-receive-email,windows-11;thunderbird;send-and-receive-email;,URsmith84,"<p>I stopped using Thunderbird after having to change my email account to ""<a href=""http://Gmail.com"" rel=""nofollow"">Gmail.com</a>"".  I don't like the <a href=""http://gmail.com"" rel=""nofollow"">gmail.com</a> format, can I return to using Thunderbird for my gmail account email? </p>",URsmith84;rednoise;,False,False,False,";useragent:Mozilla/5.0 (Windows NT 10.0; Win64; x64) AppleWebKit/537.36 (KHTML, like Gecko) Chrome/146.0.0.0 Safari/537.36;os:Windows 11;solver_id:7522630",1,0,0,,,
1573943,2026-04-01 00:51:01 -0700,2026-04-02 01:31:51 -0700,en-US,thunderbird,"Thunderbird is blocked, I cannot receive or send emails.",True,1809516.0,ampinwa,False,1809516.0,1809473;1809516;,connectivity,windows-11;thunderbird;connectivity;,ampinwa,"<p>I am now unable to send or receive email, it comes up 'Thunderbird could not connect to mail server <a href=""http://imap.gmail.com"" rel=""nofollow"">imap.gmail.com</a>, the connection was refused'. I am unsure if it is Thunderbird or other causing the issue.  I have NordVPN with split tunnelling for Thunderbird. I have Avast Premium Security which I have uninstalled and reinstalled with no change. I have Malwarebytes too.  I have 2 computers, one is just a laptop for travel which I turned on and I am having the same issue with. </p>",ampinwa;davidsk;,False,False,False,";useragent:Mozilla/5.0 (Windows NT 10.0; Win64; x64) AppleWebKit/537.36 (KHTML, like Gecko) Chrome/146.0.0.0 Safari/537.36;tb_version:149.01;os:Windows 11;solver_id:7522691",2,0,0,,,
1573945,2026-04-01 01:08:42 -0700,2026-04-02 03:04:40 -0700,en-US,thunderbird,thunderbird opens then the screen locks with a rotating colour circle.,False,,,False,1809522.0,1809521;1809522;,app-crash,mac-os-x-1015;thunderbird;app-crash;,jyo64877,"<p>good morning , I am using a mac mini 8 gb ram and the latest ios, avg antivirus and vpn. Following the latest ios update in feb/2026 thunderbird opens then locks with a rotating color circle and force quit is needed to close it. Emails are via the imap and smtp protocols, with both not being recognised by the server. Can you help, I need access to files from thunderbird. Can this be done offline, avoiding the server problem. thank you for your help. Jeff </p>",jyo64877;mozilla98;,False,False,False,";useragent:Mozilla/5.0 (Macintosh; Intel Mac OS X 10.15; rv:149.0) Gecko/20100101 Firefox/149.0;os:Mac OS x 10.15;kb_visits_prior:[""/en-US/kb/difference-between-imap-and-pop3"", ""/en-US/kb/automatic-account-configuration""]",2,0,0,,,
1573962,2026-04-01 05:38:50 -0700,2026-04-01 18:49:11 -0700,en-US,thunderbird,Starred emails indication,False,,,False,1809452.0,1809445;1809448;1809452;,customization,linux;thunderbird;customization;,theking2,<p>Is it possible to change the appears of the header of starred emails? Unread are bold but can I set starred to italic? </p>,theking2;sfhowes;,False,False,False,;useragent:Mozilla/5.0 (X11; Linux x86_64; rv:149.0) Gecko/20100101 Firefox/149.0;os:Linux,3,0,0,,,
1573968,2026-04-01 06:32:35 -0700,2026-04-08 12:10:12 -0700,en-US,thunderbird,Unable to Get Messages on my Thunderbird email,True,1809386.0,nielsike,False,1810767.0,1809380;1809386;1810697;1810767;,send-and-receive-email,windows-11;thunderbird;send-and-receive-email;,nielsike,"<p>When I try to Get Messages, I get this coming up (see attached) and cannot go any further. I don't know if this a scam or safe to click on any of it. </p><p>I can send emails but not receive because of this in my Thunderbird.   I also have email setup on my mobile phone and can receive and send on that one and received your code number on my mobile phone.  </p><p>Regards  Ike </p>",nielsike;davidsk;,False,False,False,";solver_id:7523112;useragent:Mozilla/5.0 (Windows NT 10.0; Win64; x64) AppleWebKit/537.36 (KHTML, like Gecko) Chrome/146.0.0.0 Safari/537.36 Edg/146.0.0.0;os:Windows 11",4,1,1,,,
1573974,2026-04-01 07:18:17 -0700,2026-04-01 15:20:23 -0700,en-US,thunderbird,emails automatically deleted after Thunderbird update,False,,,False,1809409.0,1809409;,send-and-receive-email,windows-10;thunderbird;send-and-receive-email;,IanLove,"<p>This started happening about a month ago, without me (or the update) changing my settings, which are to retain all emails unless manually deleted. Probably relatedly, copies of sent emails are not saved in the Sent folder. This is my account on <a href=""http://yahoo.co.uk"" rel=""nofollow"">yahoo.co.uk</a> - all the emails are available when I go to yahoo through my browser, so it is just Thunderbird that is not retaining them. I automatically accept Thuderbird software updates (now 149.0.1) </p>",IanLove;Toad-Hall;,False,False,False,;useragent:Mozilla/5.0 (Windows NT 10.0; Win64; x64; rv:149.0) Gecko/20100101 Firefox/149.0;os:Windows 10,1,0,0,,,
1573979,2026-04-01 08:02:55 -0700,2026-04-06 22:56:48 -0700,en-US,thunderbird,Thunderbird Thunderbird Pro,False,,,False,1810537.0,1809376;1809476;1810509;1810537;,settings,windows-1011;thunderbird;settings;,aaaaa,"<p>What are the exact differences between Thunderbird and Thunderbird Pro? Pro includes GB of storage. I want to know if this is only the case with Thunderbird, and if all other Thunderbird versions, for example, on the channel Relies Eser, do not include storage. I'm also interested in the topic of encryption, so please provide as much detail as possible. </p><p>Where can I find information about this in German? </p>",aaaaa;davidsk;James;wsmwk;Googlethunderbird.;,False,False,False,;useragent:Mozilla/5.0 (Windows NT 10.0; Win64; x64; rv:149.0) Gecko/20100101 Firefox/149.0;tb_version:140.9.0esr (64-Bit;os:Windows 10/11,4,0,0,,,
1573999,2026-04-01 10:47:54 -0700,2026-04-01 16:56:06 -0700,en-US,thunderbird,Thunderbird Still Syncs Gmail Contacts Even Though I have no Gmail Account in TB,False,,,False,1809425.0,1809398;1809413;1809415;1809417;1809418;1809425;,contacts,windows-11;thunderbird;contacts;,JamesJ,<p>Thunderbird still syncs Gmail contacts even though I have no Gmail account in TB. I imported a Vcard into TB and deleted a couple contacts. Went back into Gmail contacts and had to restore them. </p><p>Why does this happen?? James </p>,JamesJ;davidsk;,False,False,False,";useragent:Mozilla/5.0 (Windows NT 10.0; Win64; x64) AppleWebKit/537.36 (KHTML, like Gecko) Chrome/146.0.0.0 Safari/537.36 Edg/146.0.0.0;os:Windows 11",6,0,0,,,
1574000,2026-04-01 10:50:14 -0700,2026-04-01 10:50:14 -0700,en-US,thunderbird,mail si aprono automaticamente,False,,,False,,,email-and-messaging,windows-11;thunderbird;email-and-messaging;,luca26,<p>Buon giorno. Da qualche giorno le mail ricevute in thunderbird si aprono (e spesso si replicano come impazzite) senza aver dato il comando (click) di apertura. Devo rivedere qualcosa? </p>,luca26;,False,False,False,";useragent:Mozilla/5.0 (Windows NT 10.0; Win64; x64) AppleWebKit/537.36 (KHTML, like Gecko) Chrome/146.0.0.0 Safari/537.36;tb_version:Version 140.9.0esr;os:Windows 11",0,0,0,,,
1574029,2026-04-01 14:48:37 -0700,2026-04-01 14:48:37 -0700,en-US,thunderbird,i imported outlook and everything works except my gmx email client,False,,,False,,,send-and-receive-email,windows-1011;thunderbird;send-and-receive-email;,taosgn,<p>The new Outlook gets my gmx emails but thunderbird won't.  I made a 993 test and it failed </p>,taosgn;,False,False,False,";useragent:Mozilla/5.0 (Windows NT 10.0; Win64; x64; rv:149.0) Gecko/20100101 Firefox/149.0;os:Windows 10/11;kb_visits_prior:[""/en-US/kb/thunderbird-import""]",0,0,0,,,
1574031,2026-04-01 14:51:27 -0700,2026-04-01 14:51:27 -0700,en-US,thunderbird,Thunderbird access denied if NAS archive is disconnected,False,,,False,,,connectivity,windows-11;thunderbird;connectivity;,Lozzerdude,"<p>I have an Archive location set up through my network on my NAS. One of the disks failed and the NAS was turned off until the faulty disk could be replaced. When I then tried to open Thunderbird it stalled, presumably because it couldn't find the archive location. Once the disk had been replaced and the NAS powered up, Thunderbird opened straightforwardly as expected. </p><p>Would it not be better to open Thunderbird with a suitable timeout, without the NAS connection,  but provide a pop-up to advise that ""the archive location has not been found - you are unable to archive at this time"". That would allow emails to be read and sent in the usual way and also warn users of other issues that would affect archiving. Any archiving could be left until the connection to the archive location is restored. </p>",Lozzerdude;,False,False,False,";useragent:Mozilla/5.0 (Windows NT 10.0; Win64; x64) AppleWebKit/537.36 (KHTML, like Gecko) Chrome/146.0.0.0 Safari/537.36 Edg/146.0.0.0;tb_version:149.0.1 (64-bit);os:Windows 11",0,0,0,,,
1574039,2026-04-01 15:23:36 -0700,2026-04-01 15:23:36 -0700,en-US,thunderbird,"Google, Gmail Hotmail fails all the time",False,,,False,,,send-and-receive-email,linux;thunderbird;send-and-receive-email;,dave473,"<p>When i email to google, gmail ,hotmail i always get a failed post master reply this has been going on for months and i can't seem to resolve it. If I send through BT email they get the massages ? </p>",dave473;,False,False,False,";useragent:Mozilla/5.0 (X11; Linux x86_64) AppleWebKit/537.36 (KHTML, like Gecko) Chrome/146.0.0.0 Safari/537.36;os:Linux",0,0,1,,,
1574041,2026-04-01 15:41:58 -0700,2026-04-02 16:01:06 -0700,tr,thunderbird,Hesap eklerken hata alıyorum,False,,,False,1809637.0,1809637;,connectivity,windows-10;thunderbird;connectivity;,gurupiti,<p>Son 2-3 aydır yeni hesap ekliyemiyorum. Sürekli kullandığım Yahoo ve Gmail hesaplarıma girmeye çalıştığımda açılan auth pop upları sürekli hata veriyor. Gmail 400 hata kodu veriyor Yahoo 429 too many requests hatası veriyor Yardımcı olursanız sevinirim. </p>,gurupiti;maxcoder;,False,False,False,;useragent:Mozilla/5.0 (Windows NT 10.0; Win64; x64; rv:149.0) Gecko/20100101 Firefox/149.0;tb_version:149.0.1 64 bit;os:Windows 10,1,0,0,,,
1574045,2026-04-01 15:46:59 -0700,2026-04-01 17:49:39 -0700,en-US,thunderbird,"reinstalled TB, able to receive but not send email",False,,,False,1809440.0,1809435;1809440;,send-and-receive-email,windows-11;thunderbird;send-and-receive-email;,n3xge,"<p>I reinsatalled TB with my [edited]@ptd.net account, and two gmail accounts.  The gmail accounts work.  The ptd account will receive email but will not send. What settings need to be changed and where do I find the setting to change? </p>",n3xge;christ1;sfhowes;,False,False,False,";useragent:Mozilla/5.0 (Windows NT 10.0; Win64; x64) AppleWebKit/537.36 (KHTML, like Gecko) Chrome/145.0.0.0 Safari/537.36 Norton/145.0.34156.160;os:Windows 11",2,0,0,,,christ1
