id,created,updated,locale,product,title,is_solved,solution,solved_by,is_spam,last_answer,answers,topic,tags,creator,content,involved,is_archived,is_locked,is_taken,metadata,num_answers,num_votes_past_week,num_votes,taken_until,taken_by,updated_by
1579345,2026-04-30 17:25:07 -0700,2026-04-30 17:27:29 -0700,en-US,thunderbird,change of servers,False,,,False,1814975.0,1814975;,send-and-receive-email,thunderbird-1500;windows-11;thunderbird;send-and-receive-email;,donald21,"<p>Hi, I' ve been using Thunderbird for years with no problems, but the other day my servier changed their settings and now Thunderbird won't recieve any of e-mails. They sent me settings and finally I figured out them to work on my phone, but not on Thunderbird. The new serivcers address is ""<a href=""http://ny201.whpservers.com"" rel=""nofollow"">ny201.whpservers.com</a>"" and the incoming port is 995 and the outgoing port is 465. I used the same settings that I used for my phone, but they won't work on Thunderbird. I'm supose to use SSL for incoming/outgoing messages and when I use testing connection to server I get a message of ""The certificate for <a href=""http://mail.dostie.net"" rel=""nofollow"">mail.dostie.net</a>:995 is not valid for that server. Someone could be trying to impersonate the server and you should not continue."" Can you please provide help to resolve this issue. </p><p>Thank you Donald Dostie </p>",donald21;MattAuSupport;,False,False,False,";useragent:Mozilla/5.0 (Windows NT 10.0; Win64; x64) AppleWebKit/537.36 (KHTML, like Gecko) Chrome/147.0.0.0 Safari/537.36;tb_version:150.0;os:Windows 11",1,0,0,,,
1579346,2026-04-30 17:43:56 -0700,2026-04-30 18:08:01 -0700,en-US,thunderbird,Thunderbird suddenly stops formatting my emails,False,,,False,1814997.0,1814989;1814997;,send-and-receive-email,windows-11;thunderbird;send-and-receive-email;,mike.lowe25,"<p>Thunderbird suddenly stopped formatting the body of my emails correctly. Also, images are no longer displayed. </p>",mike.lowe25;MattAuSupport;,False,False,False,";useragent:Mozilla/5.0 (Windows NT 10.0; Win64; x64) AppleWebKit/537.36 (KHTML, like Gecko) Chrome/147.0.0.0 Safari/537.36;tb_version:150.0.1 (64-bit);os:Windows 11",2,1,1,,,
1579347,2026-04-30 17:52:18 -0700,2026-04-30 17:52:18 -0700,en-US,thunderbird,"""certificate for imap.gmail.com does not come from a trusted source""",False,,,False,,,encryption,thunderbird-1510;beta;thunderbird;encryption;,sji260,"<p>Every time I launch Thunderbird Beta 151.0b1 on Arch Linux, I immediately get a notification saying ""The certificate for <a href=""http://imap.gmail.com"" rel=""nofollow"">imap.gmail.com</a> does not come from a trusted source."" If I click through to the exception dialog, it shows ""No Information Available / Unable to obtain identification status for this site"" — it can't even fetch the certificate to show me what's wrong with it. The error only appears on launch and doesn't come back. Mail sends and receives fine. </p><p>From the terminal, openssl connects to <a href=""http://imap.gmail.com"" rel=""nofollow"">imap.gmail.com</a>:993 without any issue (Verify return code: 0, TLS 1.3, X25519MLKEM768). No antivirus, no VPN, no TLS-intercepting software. NSS 3.123. </p><p>Has anyone else seen this? Is this a known Beta issue? </p>",sji260;,False,False,False,";useragent:Mozilla/5.0 (X11; Linux x86_64) AppleWebKit/537.36 (KHTML, like Gecko) Chrome/147.0.0.0 Safari/537.36;tb_version:151.0b1 (64-bit);os:Arch Linux",0,0,0,,,
1579348,2026-04-30 18:17:04 -0700,2026-04-30 18:17:04 -0700,en-US,thunderbird,Only 5 domains are looked at until Thunderbird stalls...why?,False,,,False,,,crashing-and-slow-performance,windows-1011;thunderbird;crashing-and-slow-performance;,jimtippins,"<p>I have a Postfix/Dovecot server that hosts 10 of my domains from one IP. </p><p>When you open Thunderbird, it checks the domains you have preset. I have two. This happens immediately, especially if there is no new mail on the server. Everything works fine. </p><p>If you have other domain mailboxes open, and I have eight more, and you click the inbox on each one, Thunderbird stalls at the fifth mailbox, regardless of the inboxes' selected order.  </p><p>tail -f /var/log/mail.log  - confirms this. </p><p>I have reset or modified everything I can think of. My server is not throttling Dovecot. </p><p>This must be something internal to Thunderbird, possibly related to only using a specific mail server IP for all domains. </p><p>Google AI suggests assigning a unique local IP alias to each domain on my server so Thunderbird thinks it’s talking to 10 different machines. This seems extreme. </p><p>Any solutions? </p>",jimtippins;,False,False,False,;useragent:Mozilla/5.0 (Windows NT 10.0; Win64; x64; rv:150.0) Gecko/20100101 Firefox/150.0;tb_version:150.0.1;os:Windows 10/11,0,0,0,,,
1579353,2026-04-30 19:06:06 -0700,2026-04-30 19:06:06 -0700,en-US,thunderbird,"WHy do I sometimes get ""a copy was not placed in my sent folder"" ?",False,,,False,,,connectivity,thunderbird-140101;thunderbird-14010;windows-10;thunderbird;connectivity;,jack63ss,"<p>Every so often I get an error message ""Your message was sent but a copy was not placed in your sent folder (Sent) due to network or file access errors."" I understand these if I am sending multiple large attachments as I am using Imap and the Sent folder is on the server. But I got it today with a simple pdf attachment. Is there anything I can do to alleviate this problem ? </p><p>Edition	Windows 10 Home Version	22H2 Installed on	6/26/2024 OS Build	19045.6466 </p><p>Thunderbird 140.10.1esr (64-bit) </p>",jack63ss;,False,False,False,;useragent:Mozilla/5.0 (Windows NT 10.0; Win64; x64; rv:150.0) Gecko/20100101 Firefox/150.0;tb_version:140.10.1esr (64-bi;os:Windows 10,0,0,0,,,
1579359,2026-04-30 20:03:16 -0700,2026-04-30 20:03:16 -0700,pt-BR,thunderbird,Filtro nao funciona,False,,,False,,,email-and-messaging,thunderbird-15001;thunderbird-1500;windows-10;thunderbird;email-and-messaging;,davidgac25,"<p>Tenho um filtro criado para mover mensagens de uma pasta paa outra, e esta marcado a opção ""periodicamente a cada 10 minutos"" parece que isso nao funciona </p>",davidgac25;,False,False,False,";useragent:Mozilla/5.0 (Windows NT 10.0; Win64; x64) AppleWebKit/537.36 (KHTML, like Gecko) Chrome/147.0.0.0 Safari/537.36;tb_version:150.0.1;os:Windows 10",0,0,0,,,
1579368,2026-04-30 20:49:48 -0700,2026-05-01 00:38:36 -0700,en-US,thunderbird,I have a folder with 124000 email. Can I get backup with Thunderbird?,False,,,False,1815067.0,1815022;1815067;,import-and-export-email,thunderbird-1500;beta;windows-11;thunderbird;import-and-export-email;,sahaghshenas,<p>I have a folder with 124000 email in my mailbox. Can I get backup with Thunderbird? It seems that there is a limitation of 10000 </p>,sahaghshenas;davidsk;mozilla98;,False,False,False,";useragent:Mozilla/5.0 (Windows NT 10.0; Win64; x64) AppleWebKit/537.36 (KHTML, like Gecko) Chrome/146.0.0.0 Safari/537.36 Edg/146.0.0.0;tb_version:150.0b1;os:Windows 11",2,0,0,,,
1579381,2026-04-30 22:37:12 -0700,2026-04-30 22:37:12 -0700,en-US,thunderbird,"When I set up my accounts, I get a rejection saying that my password or email account is incorrect",False,,,False,,,passwords-and-sign-in,windows-11;thunderbird;passwords-and-sign-in;,mcquags,"<p>I have tried numerous times to enter an account into thunderbird with a password fail notification each time. It is the correct password as it works on my other mail accounts. also the correct email account is entered with the correct spelling etc. There is also a box beneath the password that says ""log in"" I have no idea what they mean by this. I have not encountered  this before. I am using an HP Omni Book Ultra 14inch. running Windows 11. I have installed Thunderbird on several other devices without this problem. </p>",mcquags;,False,False,False,";useragent:Mozilla/5.0 (Windows NT 10.0; Win64; x64) AppleWebKit/537.36 (KHTML, like Gecko) Chrome/147.0.0.0 Safari/537.36;tb_version:version 150.0;os:Windows 11",0,0,0,,,
1579394,2026-05-01 01:09:03 -0700,2026-05-01 01:09:03 -0700,en-US,thunderbird,"Thunderbird has suddenly gone insane -- ""From"" information wrong in the header pane",False,,,False,,,email-and-messaging,thunderbird-1500;windows-10;thunderbird;email-and-messaging;,n4aof,"<p>I apologize for the subject line, but there is no better way to describe the problem.... </p><p>I've been using Thunderbird for a few months now and it has mostly worked well.  Then this afternoon I was reading my mail in the Unified Inbox and I noticed something very odd.  I had a number of emails showing in the header list with the same ""From"" and various subject lines.  On the face of it, that wouldn't describe any weird behavior except that I noticed the subject lines absolutely didn't match the ""From"" information.   </p><p>As I would go to read these emails, the email itself would be correct in the preview pane -- including showing the correct sender name and email -- but the ""From"" information in the header list pane would still be wrong. </p><p>I'm sorry that I can't post a screenshot to make this more clear because there is just too much personal information on screen.  But these emails are from several different senders, received by several different email accounts.  Everything is correct <em><strong>except</strong></em> that the ""From"" shown in the header pane is <em><strong>wrong.</strong></em>  This is very obvious to me because I normally run entirely in the Unified Inbox with the emails sorted by the ""From"" information </p><p>One example is an email that is actually from ""U.S. Department of Veterans Affairs &lt;<a href=""mailto:do-not-reply@notifications.va.gov"" rel=""nofollow"">do-not-reply@notifications.va.gov</a>&gt;"" which Thunderbird displays correctly in the preview pane (where I usually read my emails) and if I open the email itself, <em><strong>but</strong></em> the header pane says this email is From ""Prepper-co &lt;<a href=""mailto:joshua@prepper-co.com"" rel=""nofollow"">joshua@prepper-co.com</a>&gt;"" </p><p>Another example is an email that is actually from ""USPS Customer Support &lt;<a href=""mailto:uspscustomersupport@usps.gov"" rel=""nofollow"">uspscustomersupport@usps.gov</a>&gt;"" but the header pane says it is from ""Rainier Arms </p><p>These two examples were received in different email accounts that aren't even on the same server.  I have other emails from these same senders that are shown correctly </p><p>I found this problem while using 150.0 (64-bit), which said 150.0.1 was available, so I restarted Thunderbird and it updated to 150.0.1 (64-bit) but the problem is the same. </p>",n4aof;,False,False,False,;useragent:Mozilla/5.0 (Windows NT 10.0; Win64; x64; rv:150.0) Gecko/20100101 Firefox/150.0;tb_version:150.0 (64-bit);os:Windows 10,0,0,0,,,
1579404,2026-05-01 03:14:40 -0700,2026-05-01 03:14:40 -0700,en-US,thunderbird,After last update email does not open as html,False,,,False,,,customization,windows-11;thunderbird;customization;,jlchampion,<p>Following the last update of thunderbird my emails are not opening. I get the blue underlined links but not opening as normal. If I click on the Links the email will open but not as normal. </p>,jlchampion;,False,False,False,";useragent:Mozilla/5.0 (Windows NT 10.0; Win64; x64) AppleWebKit/537.36 (KHTML, like Gecko) Chrome/147.0.0.0 Safari/537.36 Edg/147.0.0.0;tb_version:I think it is the;os:Windows 11;kb_visits_prior:[""/en-US/kb/troubleshoot-mode-thunderbird""]",0,0,0,,,
1579412,2026-05-01 05:25:59 -0700,2026-05-01 05:25:59 -0700,en-US,thunderbird,Thunderbird not receiving new emails,False,,,False,,,send-and-receive-email,thunderbird-140101;thunderbird-14010;windows-10;thunderbird;send-and-receive-email;,almudena2,"<p>After using Thunderbird without issue for several years, yesterday suddently it stopped receiving new emails. It seems like the connection times out. My internet service provider hasn't been able to help me, they guided me to change some settings but it hasn't worked. In the end they have said to just use their webmail, which I find difficult to use and disorienting. </p><p>Please help me get  my Thunderbird back up and running. </p>",almudena2;,False,False,False,;useragent:Mozilla/5.0 (Windows NT 10.0; Win64; x64; rv:150.0) Gecko/20100101 Firefox/150.0;tb_version:140.10.1esr;os:Windows 10,0,0,0,,,
1579419,2026-05-01 06:56:37 -0700,2026-05-01 06:56:37 -0700,en-US,thunderbird,Is it possible to have the calendar run as a separate app?,False,,,False,,,calendar,thunderbird-15001;thunderbird-1500;windows-11;thunderbird;calendar;,KJS-LES,<p>Is it possible to have the Calendar run when the rest of Thunderbird is closed ? </p>,KJS-LES;,False,False,False,";useragent:Mozilla/5.0 (Windows NT 10.0; Win64; x64) AppleWebKit/537.36 (KHTML, like Gecko) Chrome/147.0.0.0 Safari/537.36;tb_version:150.0.1 (64 bit);os:Windows 11",0,0,0,,,
1579422,2026-05-01 07:21:57 -0700,2026-05-01 07:21:57 -0700,tr,thunderbird,SÜTUN UZUNLUKLARI,False,,,False,,,customization,thunderbird-15001;thunderbird-1500;windows-11;thunderbird;customization;,harun482,<p>Gelen kutusunda alt klasörler açtım üsteki klasördeki sütun uzunluk ayarı yapınca tüm alt klasördeki sutün uzunluk ayarı değişiyor </p><p>örnek :Gelen kutusunda  </p><pre>KONU sütun a klasöründü uzun yaptım </pre> <p>b klasöründe kısa yapamıyorum  </p><p>a klasöründeki uzunluk tüm klasörleri değiştiriyor. </p>,harun482;,False,False,False,";useragent:Mozilla/5.0 (Windows NT 10.0; Win64; x64) AppleWebKit/537.36 (KHTML, like Gecko) Chrome/147.0.0.0 Safari/537.36 Edg/147.0.0.0;tb_version:150.0.1;os:Windows 11",0,0,0,,,
1579425,2026-05-01 07:37:58 -0700,2026-05-01 07:39:51 -0700,en-US,thunderbird,cant  resize T'bird window,False,,,False,1815117.0,1815117;,customization,thunderbird-140100;thunderbird-14010;linux;thunderbird;customization;,pcooper2,"<p>Since the last update , Tbird is either  a default window occupying ~1/3 of the  screen , or full screen. The  horizontal divider between message list and messages works.  resetting/changing font size  didnt solve it  neither did  </p><p>changing  toolkit.legacyUserProfileCustomizations.stylesheets from false to true  </p><p>or creating a new profile  </p><p>OS linux mint 22.3 Tbird 140.10.0esr </p>",pcooper2;,False,False,False,;useragent:Mozilla/5.0 (X11; Linux x86_64; rv:150.0) Gecko/20100101 Firefox/150.0;tb_version:140.10.0esr;os:Linux,1,0,0,,,
1579438,2026-05-01 09:40:14 -0700,2026-05-01 09:40:14 -0700,en-US,thunderbird,New email account set up fails,False,,,False,,,email-and-messaging,thunderbird-140100;thunderbird-14010;windows-11;thunderbird;email-and-messaging;,peter298,"<p>New email account successfully added on a pc and an android phone. However, Thunderbird fails to add the same account on a different pc. All details are correct. Please help </p>",peter298;,False,False,False,;useragent:Mozilla/5.0 (Windows NT 10.0; Win64; x64; rv:150.0) Gecko/20100101 Firefox/150.0;tb_version:140.10.0esr;os:Windows 11,0,0,0,,,
1579442,2026-05-01 09:54:00 -0700,2026-05-01 14:02:10 -0700,en-US,thunderbird,several IMAP accounts,False,,,False,,,send-and-receive-email,thunderbird-14901;thunderbird-1490;linux;thunderbird;send-and-receive-email;,gwahl2,"<p>I use Thunderbird 140.9.esr and happened to notice some strange behavior a few weeks ago: I have 5 email accounts, all of which I access via IMAP. Immediately upon syncing, some (not all) emails disappear from the inbox of the first account and appear in the inbox of the third account. When I then manually move the emails back to the correct inbox, they remain there permanently. </p><p>When I check the accounts via webmail, the emails have indeed been moved from one server to the other. At first, I thought it was a problem with my filters, but none of the filters were set up to move emails from one server to another. When I disable all filters, the problem persists. Could it be that I made a mistake in the account settings? However, the accounts have been set up for several years now, and I’ve been using Thunderbird for just as long. I didn’t notice this error in earlier versions. </p>",gwahl2;,False,False,False,;useragent:Mozilla/5.0 (X11; Linux x86_64; rv:150.0) Gecko/20100101 Firefox/150.0;tb_version:149.0.1esr;os:Linux,0,0,0,,,gwahl2
1579444,2026-05-01 09:57:52 -0700,2026-05-01 09:57:52 -0700,en-US,thunderbird,authentication failure while connecting to server imap.gmail.com,False,,,False,,,send-and-receive-email,thunderbird-115180;thunderbird-11518;windows-7;thunderbird;send-and-receive-email;,ericathroll,"<p>Hi I regularly get a message popping up when I attempt to access my gmail emails in Thunderbird stating that there was an Authentication Failure while connecting to server <a href=""http://imap.gmail.com"" rel=""nofollow"">imap.gmail.com</a>. I cannot find a solution as to how I get over this error and could find nothing on the Thunderbird forum regarding this problem. Help! regards Eric Athroll </p>",ericathroll;,False,False,False,;useragent:Mozilla/5.0 (Windows NT 6.1; Win64; x64; rv:109.0) Gecko/20100101 Firefox/115.0;tb_version:115.18.0 64-bit;os:Windows 7,0,0,0,,,
1579447,2026-05-01 10:43:09 -0700,2026-05-01 11:27:43 -0700,en-US,thunderbird,How can I stop a certain sender's email going to Junk?,False,,,False,1815178.0,1815178;,junk-mail-and-spam,firefox-140100;firefox-14010_1;windows-1011;thunderbird;junk-mail-and-spam;,ivorellis,<p>How can I stop a certain sender's emails going into my Junk box </p>,ivorellis;wxie2016;,False,False,False,;useragent:Mozilla/5.0 (Windows NT 10.0; Win64; x64; rv:140.0) Gecko/20100101 Thunderbird/140.10.0;ff_version:140.10.0;os:Windows 10/11,1,0,0,,,
1579457,2026-05-01 11:38:16 -0700,2026-05-01 12:22:40 -0700,nl,thunderbird,Waar zijn mijn berichten,True,1815186.0,Mozilla-assistent,False,1815186.0,1815186;,send-and-receive-email,thunderbird;send-and-receive-email;needsinfo;,maartenkouwenhoven,<p>Waar zijn mijn mails? </p>,maartenkouwenhoven;Mozilla-assistent;,False,False,False,";useragent:Mozilla/5.0 (Linux; Android 10; K) AppleWebKit/537.36 (KHTML, like Gecko) Chrome/147.0.0.0 Mobile Safari/537.36;tb_version:333333;os:4444;solver_id:7607810",1,0,0,,,
1579461,2026-05-01 12:08:32 -0700,2026-05-01 12:08:32 -0700,en-US,thunderbird,Why does one account have a different color in the left panel?,False,,,False,,,customization,thunderbird-1500;linux;thunderbird;customization;,spartanhooah,"<p>I have two Gmail accounts and one school account that uses Office 365. In the left panel where the inbox, drafts, etc. are, the Gmail accounts are listed in blue but the school account is listed in white. I can't see any reason for this difference in the accounts' settings. What does the difference indicate? </p>",spartanhooah;,False,False,False,;useragent:Mozilla/5.0 (X11; Linux x86_64; rv:150.0) Gecko/20100101 Firefox/150.0;tb_version:150;os:Linux,0,0,0,,,
1579464,2026-05-01 12:41:05 -0700,2026-05-01 12:41:05 -0700,pt-BR,thunderbird,Erro ao tentar adicionar contas no Thunderbird,False,,,False,,,passwords-and-sign-in,thunderbird-140100;thunderbird-14010;thunderbird;passwords-and-sign-in;,flpchagas,"<p>Estou tendo problemas para adicionar contas recém-criadas no Thunderbird. Já adicionei várias outras contas anteriormente sem dificuldades. </p><p>Ontem criei três contas Outlook e, ao tentar adicioná-las, aparece a seguinte mensagem: </p><p>'Não foi possível acessar a conta no servidor. A configuração, o nome de usuário ou a senha provavelmente estão incorretos.' </p><p>São contas novas, com autenticação em dois fatores (2FA). Já tentei adicioná-las tanto de forma automática quanto manual, mas ambas apresentam erro. </p><p>Inclusive, tentei com outros clientes de e-mail, como o Betterbird, e também tive problemas. </p>",flpchagas;,False,False,False,";useragent:Mozilla/5.0 (X11; Linux x86_64; rv:150.0) Gecko/20100101 Firefox/150.0;tb_version:140.10.0esr;os:Linux, Fedora 43 KDE",0,0,0,,,
1579467,2026-05-01 13:31:46 -0700,2026-05-01 13:31:46 -0700,en-US,thunderbird,In searchresults i get a wrong to adress,False,,,False,,,contacts,thunderbird-140100;thunderbird-14010;linux;thunderbird;contacts;,henkh1,"<p>There is an attachment with searchresults. This searchresult belong to an accountname with an emailadres of my own. But in the searchlist there is another To:  address. Here it is Gospel Music Hoogeveen | Tineke </p><p>It should <a href=""mailto:info@contras.nl"" rel=""nofollow"">info@contras.nl</a> </p><p>How did I get this and how do I get rid of this. </p><p>Support will be appreciated. </p><p>Henk </p>",henkh1;,False,False,False,";useragent:Mozilla/5.0 (X11; Linux x86_64; rv:150.0) Gecko/20100101 Firefox/150.0;tb_version:140.10.0esr;os:Linux;kb_visits_prior:[""/nl/kb/van-start-thunderbird""]",0,0,0,,,
1579471,2026-05-01 13:45:44 -0700,2026-05-01 13:45:44 -0700,en-US,thunderbird,"How to solve the problem with the constant message ""No new messages to download""?",False,,,False,,,send-and-receive-email,thunderbird-1500;beta;thunderbird;send-and-receive-email;,mihail140104,"<p>Problem: the bottom left says ""No messages to download"", the download line on the bottom right keeps jumping and it's impossible to use filters! </p><p>Tried: -Logged in to my account again, clearing old data. Didn't help. -Tried ""Repair Folder"" -Deleted filters -Deleted indexes None of these helped. How can I fix the problem? This didn't happen before, but it appeared with version 150.0.1. </p>",mihail140104;,False,False,False,";useragent:Mozilla/5.0 (Windows NT 10.0; Win64; x64) AppleWebKit/537.36 (KHTML, like Gecko) Chrome/147.0.0.0 Safari/537.36;tb_version:150.0b1;os:Windows 10,11",0,0,0,,,
1579483,2026-05-01 16:13:47 -0700,2026-05-01 17:45:16 -0700,en-US,thunderbird,I recently moved thunderbird from my Win 7 laptop to a new laptop with Win11. Folders are no longer in alphbetical order.,False,,,False,1815228.0,1815226;1815228;,customization,thunderbird-140101;thunderbird-14010;windows-11;thunderbird;customization;,ralphbs,"<p>I recently moved thunderbird from my Win 7 laptop to a new laptop with Win11. All was OK for awhile. One day all of my Local Folders were no longer in alphabetical order. Some folders, like Outbox are under Local Folders. Is there a fix? Please don’t tell me to uninstall and re-install. </p>",ralphbs;davidsk;,False,False,False,;useragent:Mozilla/5.0 (Windows NT 10.0; Win64; x64; rv:150.0) Gecko/20100101 Firefox/150.0;tb_version:140.10.1esr;os:Windows 11,2,0,0,,,
1579493,2026-05-01 17:59:34 -0700,2026-05-01 17:59:34 -0700,en-US,thunderbird,Pourquoi je peux pas envoyer de mails ?..,False,,,False,,,send-and-receive-email,thunderbird;send-and-receive-email;,fefortune972,<p>Je ne peux pas envoyer de mail.. </p>,fefortune972;,False,False,False,";useragent:Mozilla/5.0 (Linux; Android 10; K) AppleWebKit/537.36 (KHTML, like Gecko) Chrome/145.0.0.0 Mobile Safari/537.36",0,1,1,,,
1579503,2026-05-01 18:44:20 -0700,2026-05-01 19:17:41 -0700,en-US,thunderbird,I cannot find Unified Inbox anywhere in my Thunderbird mailbox,False,,,False,1815241.0,1815241;,customization,thunderbird-15001;thunderbird-1500;windows-11;thunderbird;customization;,mar16cha,<p>I cannot find Unified Inbox anywhere in my Thunderbird mailbox. Should I download Thunderbird again? </p>,mar16cha;rednoise;,False,False,False,";useragent:Mozilla/5.0 (Windows NT 10.0; Win64; x64) AppleWebKit/537.36 (KHTML, like Gecko) Chrome/148.0.0.0 Safari/537.36 Edg/148.0.0.0;tb_version:150.0.1;os:Windows 11",1,0,0,,,
1579519,2026-05-01 20:23:01 -0700,2026-05-01 20:23:01 -0700,en-US,thunderbird,Converting Outlook 365 Exchange account that used Owl Exchange to Thunderbird EWS,False,,,False,,,email-and-messaging,windows-1011;thunderbird;email-and-messaging;,ccctriplec,"<p>Hello! Over the last few years, I was using Owl Exchange to access my school and work email accounts which couldn't be added regularly. </p><p>Now that I've upgraded, I'm not able to add these accounts using the EWS method. I run into all kinds of errors, or Thunderbird is unable to detect the kind of account. </p><p>Yet, my existing IMAP accounts work great with Owl. How can I easily convert these to work with Thunderbird EWS natively? </p>",ccctriplec;,False,False,False,;useragent:Mozilla/5.0 (Windows NT 10.0; Win64; x64; rv:150.0) Gecko/20100101 Firefox/150.0;tb_version:150.1;os:Windows 10/11,0,0,0,,,
1579522,2026-05-01 20:53:46 -0700,2026-05-02 07:53:20 -0700,en-US,thunderbird,Blank Tabs on top of page,False,,,False,1815294.0,1815294;,crashing-and-slow-performance,thunderbird-140101;thunderbird-14010;windows-10;thunderbird;crashing-and-slow-performance;,signedbooks,"<p>Good afternoon! </p><p>We use Thunderbird for our business across several computers. However, on the main computer, we've suddenly received blank tabs at the top of the page, as if an open email thread is there. There are about ten or so of these blank open tabs, and you cannot exit them. The X button doesn't work on them, nor does Ctrl + W.  </p><p>I've uninstalled and reinstalled the software, and we've tried a shutting everything down and restarting the computer, but nothing seems to get rid of the tabs. </p><p>Is this an issue others have experienced and, if so, what's the best remedy for it? </p><p>Thanks in advance! </p>",signedbooks;siffemoz;,False,False,False,";useragent:Mozilla/5.0 (Windows NT 10.0; Win64; x64) AppleWebKit/537.36 (KHTML, like Gecko) Chrome/147.0.0.0 Safari/537.36;tb_version:140.10.1esr 32-bit;os:Windows 10",1,0,0,,,signedbooks
